original_entry,page_num,doc_page_num,opening_bits,author(s),title,format,little_bits,publisher,date
"Lutz (Grace L. H.)- The Obsession of Victoria Gracen. Cr. 8vo.74 x 5,65. LIFPINCOTT, Mar. 16",139,147,,Lutz (Grace L. H.),The Obsession of Victoria Gracen.,Cr. 8vo.,"74 x 5,65.",LIFPINCOTT,Mar. 16
"Lutz (Grace L. H.)-A Voice in the wilderness : a novel. Cr. 8vo. 74 X5, 6s.....HARPER, Oct. 16",139,147,,Lutz (Grace L. H.),A Voice in the wilderness : a novel.,Cr. 8vo.,"74 X5, 6s.....",HARPER,Oct. 16
"Lutz (Grace L. H.)-The Finding of Jasper Holt. 7* *57, pp. 272, 6s. ..LIPPINCOTT, J uly 16",139,147,,Lutz (Grace L. H.),The Finding of Jasper Holt.,,"7* *57, pp. 272, 6s. ..",LIPPINCOTT,J uly 16
"Lyall (David)—The Land of Beulah. Cr. 8vo. 78 x 5, pp. 287, 6s. ...HODDER & S., Aug. 16",139,147,,Lyall (David),The Land of Beulah.,Cr. 8vo.,"78 x 5, pp. 287, 6s. ...",HODDER & S.,Aug. 16
"Lyall (Edna)-Hope the hermit: a romance of Borrowdale. Cheap ed. 8vo. 81 x 54, pp. 162, swd. 6d. . PEARSON, Apr. 16",140,148,,Lyall (Edna),Hope the hermit: a romance of Borrowdale. Cheap ed.,8vo.,"81 x 54, pp. 162, swd. 6d. .",PEARSON,Apr. 16
"Lyle (Marius) --Unhappy in thy daring. Cr. 8vo. 73x44, pp. 480, 55. net ..MELROSE, Mar. 16",140,148,,Lyle (Marius),Unhappy in thy daring.,Cr. 8vo.,"73x44, pp. 480, 55. net ..",MELROSE,Mar. 16
"Lyle (William T.)--Parks and park engineering. 8vo. 94 X 6, 5s. 6d. net CHAPMAN & H., June 16",140,148,,Lyle (William T.),Parks and park engineering.,8vo.,"94 X 6, 5s. 6d. net",CHAPMAN & H.,June 16
"Lyly (John)-Euphues, the anatomy of wit ; Euphues and his England. Ed. by M. W. Croll and Harry Clemons. Cr. 8vo. 8 X 5, pp. 537, 6s. net. ROUTLEDGE, Nov. 16",140,148,,Lyly (John),"Euphues, the anatomy of wit ; Euphues and his England. Ed. by M. W. Croll and Harry Clemons.",Cr. 8vo.,"8 X 5, pp. 537, 6s. net.",ROUTLEDGE,Nov. 16
"Lynch (Bohun)-The Complete gentleman. Cr. 8vo. 73 x 5, pp. 402, 6s. ... SECKER, Apr. 16",140,148,,Lynch (Bohun),The Complete gentleman.,Cr. 8vo.,"73 x 5, pp. 402, 6s. ...",SECKER,Apr. 16
"Lynch (George)—War wire. Cr. 8vo. 71x41, pp. 88, swd. is. net ...BIRD, Mar. 16",140,148,,Lynch (George),War wire.,Cr. 8vo.,"71x41, pp. 88, swd. is. net",BIRD,Mar. 16
"Lynch (Lawrence L.)-A Sealed verdict. 18mo. 64 x43, pp. 252, 7d. net ...LONG, Aug. 16",140,148,,Lynch (Lawrence L.),A Sealed verdict.,18mo.,"64 x43, pp. 252, 7d. net ...",LONG,Aug. 16
"Lynd (Sylvia)— The Thrush and the jay. 8vo. 9x6, pp. 165, 5s. net .... CONSTABLE, Dec. 16",140,148,,Lynd (Sylvia),The Thrush and the jay.,8vo.,"9x6, pp. 165, 5s. net ....",CONSTABLE,Dec. 16
"Lynd (Sylvia)—The Chorus : a tale of love and folly. Cr. 8vo. 71 X 5, pp. 320, 6s. CONSTABLE, Jan. 16",140,148,,Lynd (Sylvia),The Chorus : a tale of love and folly.,Cr. 8vo.,"71 X 5, pp. 320, 6s.",CONSTABLE,Jan. 16
"Lynn (Escott)-Oliver Hastings, V.C. Cr. 8vo. 7tx 51, pp. 404, 5S. CHAMBERS, Oct. 16",140,148,,Lynn (Escott),"Oliver Hastings, V.C.",Cr. 8vo.,"7tx 51, pp. 404, 5S.",CHAMBERS,Oct. 16
"Lyon (W. S. S.)-Easter at Ypres, 1915, and other poems. Cr. 8vo. 78 x 5ł, pp. 148, 25. 6d. net MACLEHOSE, Aug. 16",140,148,,Lyon (W. S. S.),"Easter at Ypres, 1915, and other poems.",Cr. 8vo.,"78 x 5ł, pp. 148, 25. 6d. net",MACLEHOSE,Aug. 16
"Lyons (A. Neil) — Moby Lane and thereabouts. Cr. 8vo. 71 x 44, pp. 344, 6s.....LANE, Jan, 16",140,148,,Lyons (A. Neil),Moby Lane and thereabouts.,Cr. 8vo.,"71 x 44, pp. 344, 6s.....",LANE,"Jan, 16"
"Lyons (A. Neil)-A Kiss from France. Cr. 8vo. 71 X 5, pp. 252, IS. 3d. net HODDER & S., Sep. 16",140,148,,Lyons (A. Neil),A Kiss from France.,Cr. 8vo.,"71 X 5, pp. 252, IS. 3d. net",HODDER & S.,Sep. 16
"Lyons (J.)-Sons of the Empire, and cther poems. 74 X 5, pp. 62, is, net.. .HEYWOOD, May 16",140,148,,Lyons (J.),"Sons of the Empire, and cther poems.",,"74 X 5, pp. 62, is, net.. .",HEYWOOD,May 16
"Lysaght (Edward E.)—Sir Horace Plunkett and his place in the Irish nation. Cr. 8vo. 7} x 5, pp. 160, 2s. 6d. net. (Irishmen of to-day) MAUNSEL, Sep. 16",140,148,,Lysaght (Edward E.),Sir Horace Plunkett and his place in the Irish nation.,Cr. 8vo.,"7} x 5, pp. 160, 2s. 6d. net. (Irishmen of to-day)",MAUNSEL,Sep. 16
"M'Crindle (Quintin) - Jock. Cr. 8vo.7} X 5, pp. 158, 25. net, swd. is, net ....A. GARDNER, Apr. 16",140,148,,M'Crindle (Quintin),Jock.,Cr. 8vo.,"7} X 5, pp. 158, 25. net, swd. is, net ....",A. GARDNER,Apr. 16
"M'Intosh (John Geddes) -The Technology of sugar. 3rd ed., rev. 8vo. 84x5, pp: 542, I2s. 6d. net ....SCOTT, GREENWOOD, Mar. 16",141,149,,M'Intosh (John Geddes),"The Technology of sugar. 3rd ed., rev.",8vo.,"84x5, pp: 542, I2s. 6d. net ....","SCOTT, GREENWOOD",Mar. 16
"M'Kerlie (Marianne H.)--Pilgrim spots in Galloway. Cr. 8vo. 75 X 4$, 5s. net SANDS, Vov. 16",142,150,,M'Kerlie (Marianne H.),Pilgrim spots in Galloway.,Cr. 8vo.,"75 X 4$, 5s. net",SANDS,Vov. 16
"M'Mlllan (William)-Scottish symbois, royal, national, and ecclesiastical : their history and heraldic significance. Small 4to. 81 x64, pp. 336, 78. 6d. net ...A. GARDNER, Apr. 16",143,151,,M'Mlllan (William),"Scottish symbois, royal, national, and ecclesiastical : their history and heraldic significance.",Small 4to.,"81 x64, pp. 336, 78. 6d. net",A. GARDNER,Apr. 16
"M6 Imbo (Prosper)-Carmen. Tr. by A. E. Johnson. Illus. by René Bull. n**8), pp. 212, 2IS. net ..HUTCHINSON, Nov. 16",151,159,M6 ,Imbo (Prosper),Carmen. Tr. by A. E. Johnson. Illus. by René Bull.,n**8),"pp. 212, 2IS. net ..",HUTCHINSON,Nov. 16
"Mac Coll (D. S.)--A German peace. 8vo. 8* X7, pp. 7, 6d. net. . MACLEHOSE, July 16",140,148,,Mac Coll (D. S.),A German peace.,8vo.,"8* X7, pp. 7, 6d. net. .",MACLEHOSE,July 16
"Mac Donagh (Thomas)-Literature in Ireland : studies Irish and Anglo-Irish. 8vo. 8+X54, pp. 263, 6s. net ...UNWIN, June 16",140,148,,Mac Donagh (Thomas),Literature in Ireland : studies Irish and Anglo-Irish.,8vo.,"8+X54, pp. 263, 6s. net ...",UNWIN,June 16
"Mac Donagh (Thomas)-Songs of myself. Cr. 8vo. 7* X 5, PP. 52, 25. net HODGES, F., June 16",140,148,,Mac Donagh (Thomas),Songs of myself.,Cr. 8vo.,"7* X 5, PP. 52, 25. net","HODGES, F.",June 16
"Macaulay (F. S.)--The Algebraic theory of modular systems. 8vo. 81 x 54, pp. 126, 43. 6d. net (Camb. tracts in math.) CAMB. UNIV. PR., Aug. 16",140,148,,Macaulay (F. S.),The Algebraic theory of modular systems.,8vo.,"81 x 54, pp. 126, 43. 6d. net (Camb. tracts in math.)",CAMB. UNIV. PR.,Aug. 16
"Macaulay (Rose)-Non-combatants and others. Cr. 8vo. 71 X 5, pp. 316, 5s. net HODDER & S., Aug. 16",140,148,,Macaulay (Rose),Non-combatants and others.,Cr. 8vo.,"71 X 5, pp. 316, 5s. net",HODDER & S.,Aug. 16
"MacCartan (Hugh A.)---The Little white roads and other poems. 71 x 5, pp. 72, 2s. 6d. net HEATH, C., Dec. 16",140,148,,MacCartan (Hugh A.),The Little white roads and other poems.,,"71 x 5, pp. 72, 2s. 6d. net","HEATH, C.",Dec. 16
"MacCarthaigh (Diarmada Seain Buidhe) Amhrain Tadhg o Donnchadh a do cuir in-eagar. 8vo. 10 X 63, cloth 2s. 6d. net ; swd. is. 6d. net M. H. GILL, Nov. 16",140,148,,MacCarthaigh (Diarmada Seain Buidhe),Amhrain Tadhg o Donnchadh a do cuir in-eagar.,8vo.,"10 X 63, cloth 2s. 6d. net ; swd. is. 6d. net",M. H. GILL,Nov. 16
"Maccas (Leon)-German barbarism : a neutral's indictment. Pref. by Paul Girard. Gr. 8vo. 75 X4, pp. 240, 25. 6d. net HODDER & S., May 16",140,148,,Maccas (Leon),German barbarism : a neutral's indictment. Pref. by Paul Girard.,Gr. 8vo.,"75 X4, pp. 240, 25. 6d. net",HODDER & S.,May 16
"MacDonagh (Michael)—The Irish at the Front. With intro. by John Redmond. Cr. 8vo. 74 x 5, pp. 174, is. net .. HODDER & S., Mar. 16",140,148,,MacDonagh (Michael),The Irish at the Front. With intro. by John Redmond.,Cr. 8vo.,"74 x 5, pp. 174, is. net ..",HODDER & S.,Mar. 16
"MacDonagh (Thomas)--Poetical works. Cr. 8vo. 8x5, pp. 180, 4s. 6d. net ..UNWIN, Oct. 16",140,148,,MacDonagh (Thomas),Poetical works.,Cr. 8vo.,"8x5, pp. 180, 4s. 6d. net ..",UNWIN,Oct. 16
"Macdonald (A. J.)--Trade politics and Christianity in Africa and the East. 8vo. 9x51, pp. 317, 6s, net .LONGMANS, Sep. 16",140,148,,Macdonald (A. J.),Trade politics and Christianity in Africa and the East.,8vo.,"9x51, pp. 317, 6s, net .",LONGMANS,Sep. 16
"MacDonald (Donald F.) - Some engineering problems of the Panama Canal in their rela. to geology and topography. Illus. 8vo. 9 x 51, pp. 82, 4s. 6d. net. (U.S. “ Bureau of Mines Bull."" 86) .. WESLEY, June 16",141,149,,MacDonald (Donald F.),Some engineering problems of the Panama Canal in their rela. to geology and topography. Illus.,8vo.,"9 x 51, pp. 82, 4s. 6d. net. (U.S. “ Bureau of Mines Bull."" 86)",WESLEY,June 16
"Macdonald (George)-The Evolution of coinage. 7 pl. Ryl. 16mo. 61 x 45, pp. 156, IS. 3d. net ; Ithr. 2s.6d. net. (Camb. Manuals of science and literature) .CAMB. UNIV. PR., Dec. 16",141,149,,Macdonald (George),The Evolution of coinage.,Ryl. 16mo.,"7 pl. 61 x 45, pp. 156, IS. 3d. net ; Ithr. 2s.6d. net. (Camb. Manuals of science and literature)",.CAMB. UNIV. PR.,Dec. 16
"MacDonald (Greville)-How Jonas found his enemy: a romance of the South Downs. Cr. 8vo. 71x41, pp. 382, 6s. CONSTABLE, June 16",141,149,,MacDonald (Greville),How Jonas found his enemy: a romance of the South Downs.,Cr. 8vo.,"71x41, pp. 382, 6s.",CONSTABLE,June 16
"Macdonald (J. A. Murray)-European inter- national relations. Cr. 8vo. 71 x 5, pp. 144, 28. 6d. net ...UNWIN, Mar. 16",141,149,,Macdonald (J. A. Murray),European inter- national relations.,Cr. 8vo.,"71 x 5, pp. 144, 28. 6d. net ...",UNWIN,Mar. 16
"Macdonald (Mina)—Some experiences in Hungary, August 1914 to January 1915. Illus. Cr. 8vo. 78 X 5, pp. 148, 3s. 6d, net LONGMANS, May 16",141,149,,Macdonald (Mina),"Some experiences in Hungary, August 1914 to January 1915. Illus.",Cr. 8vo.,"78 X 5, pp. 148, 3s. 6d, net",LONGMANS,May 16
"Macdonell (Anne)-The Italian fairy book. Cheaper ed. 8vo. 83X 53, pp. 316, 38. 6d. UNWIN, Nov. 16",141,149,,Macdonell (Anne),The Italian fairy book. Cheaper ed.,8vo.,"83X 53, pp. 316, 38. 6d.",UNWIN,Nov. 16
"Macdonell (Arthur Anthony)--A Vedic grammar for students. Cr. 8vo. 7*X 5, ios, 6d. net MILFORD, June 16",141,149,,Macdonell (Arthur Anthony),A Vedic grammar for students.,Cr. 8vo.,"7*X 5, ios, 6d. net",MILFORD,June 16
"Macduff (J. R.)-The Morning watches. 32mo. 33 x 21, 6d. net (Sanctuary bklets.) ALLENSON, May 16",141,149,,Macduff (J. R.),The Morning watches.,32mo.,"33 x 21, 6d. net (Sanctuary bklets.)",ALLENSON,May 16
"Macduft (J. R.)—The Night watches. 32no. 34x2+, 6d. net (Sanctuary bklets.) ALLENSON, May 16",141,149,,Macduft (J. R.),The Night watches.,32no.,"34x2+, 6d. net (Sanctuary bklets.)",ALLENSON,May 16
"Macewen (John A. C.)-Surgical anatomy. 2nd ed. Cr. 8vo. 74 x 5), ros. 6d. net BAILLIERE, Nov. 16",141,149,,Macewen (John A. C.),Surgical anatomy. 2nd ed.,Cr. 8vo.,"74 x 5), ros. 6d. net",BAILLIERE,Nov. 16
"Macey (Alfred)-A Quartette. No. 2. 71 X41, pp. 40, 6d. net .STOCKWELL, Oct. 16",141,149,,Macey (Alfred),A Quartette. No. 2.,,"71 X41, pp. 40, 6d. net .",STOCKWELL,Oct. 16
"Macfaddon (Bernard)-Manhood and marriage. Cr. 8vo. 71x5), pp. 374, 6s. net PHYSICAL CULT. PUB. Co., Dec. 16",141,149,,Macfaddon (Bernard),Manhood and marriage.,Cr. 8vo.,"71x5), pp. 374, 6s. net",PHYSICAL CULT. PUB. Co.,Dec. 16
"Macfadyen (Archdeacon)—The Four visions of the Apostle Paul : his life motto, his last message. 43x3), pp. 47, 4d. net ..BAGSTER, Aug. 16",141,149,,Macfadyen (Archdeacon),"The Four visions of the Apostle Paul : his life motto, his last message.",,"43x3), pp. 47, 4d. net ..",BAGSTER,Aug. 16
"Macfarlane (Alexander)-Lect. on ten Brit. mathematicians of the 19th cent. 8vo., 59. 60. net. (Math. monographs 17) CHAPMAN & H., July 16",141,149,,Macfarlane (Alexander),Lect. on ten Brit. mathematicians of the 19th cent.,8vo.,59. 60. net. (Math. monographs 17),CHAPMAN & H.,July 16
"Macfarlane (Norman C.)-Scotland's Keswick. Evo. 87 x 51, bds. 28. 6d. net MARSHALL BROS., May 16",141,149,,Macfarlane (Norman C.),Scotland's Keswick.,Evo.,"87 x 51, bds. 28. 6d. net",MARSHALL BROS.,May 16
"MacGill (Patrick)-The Great push : an episode of the Gt. War. Cr. 8vo. 74 x 5, pp. 264, 28. 6d. net · JENKINS, June 16",141,149,,MacGill (Patrick),The Great push : an episode of the Gt. War.,Cr. 8vo.,"74 x 5, pp. 264, 28. 6d. net ·",JENKINS,June 16
"MacGill (Patrick)-The Red horizon. Cheaper ed. Foreword by Visct. Esher. Cr. 8vo. 78 x 5, pp. 306, 2s. net ..H. JENKINS, Nov. 16",141,149,,MacGill (Patrick),The Red horizon. Cheaper ed. Foreword by Visct. Esher.,Cr. 8vo.,"78 x 5, pp. 306, 2s. net ..",H. JENKINS,Nov. 16
"MacGill (Patrick)—The Red horizon. With a foreword by Viscount Esher, Cr. 8vo. 71 x 5, pp. 306, 5s, net ........H. JENKINS, Feb. 16",141,149,,MacGill (Patrick),"The Red horizon. With a foreword by Viscount Esher,",Cr. 8vo.,"71 x 5, pp. 306, 5s, net ........",H. JENKINS,Feb. 16
"MacGli (Patrick)-Soldier songs. Cr. 8vo. 78 x 5, pp. 120, 3s. 6d. net, ed. de luxe, 21s. net H. JENKINS, Oct., Dec. 16",141,149,,MacGli (Patrick),Soldier songs.,Cr. 8vo.,"78 x 5, pp. 120, 3s. 6d. net, ed. de luxe, 21s. net",H. JENKINS,"Oct., Dec. 16"
"MacGlil (Patrick) Songs of the dead end. Re- issue. Cr. 8vo. 74 x 51, pp. 167, 38. 6d. net YEAR BK. PR., Nov. 16",141,149,,MacGlil (Patrick),Songs of the dead end. Re- issue.,Cr. 8vo.,"74 x 51, pp. 167, 38. 6d. net",YEAR BK. PR.,Nov. 16
"MacHarg (William) and Balmer (Edwin)—The Blind man's eyes. Cr. 8vo. 7*X5, pp. 368, ...NASH, July 16",141,149,,MacHarg (William) and Balmer (Edwin),The Blind man's eyes.,Cr. 8vo.,"7*X5, pp. 368, ...",NASH,July 16
"Machen (Arthur)-The Great god Pan. New ed. 18mo. 61 X 43, pp. 140, bds., Is. net SIMPKIN, Jan. 16",141,149,,Machen (Arthur),The Great god Pan. New ed.,18mo.,"61 X 43, pp. 140, bds., Is. net",SIMPKIN,Jan. 16
"Machine-gunner's pocket bk. By ""An M.G.O. in Flanders.” 77 x 41, pp. 55, Is. 6d. net GRAHAM & LATHAM, Jan. 16",141,149,,,"Machine-gunner's pocket bk. By ""An M.G.O. in Flanders.”",,"77 x 41, pp. 55, Is. 6d. net",GRAHAM & LATHAM,Jan. 16
"Machray (Robert)-The Night side of London. Cheap ed. 8vo. 83 x 55, pp. 118, swd. 6d. net LAURIE, June 16",141,149,,Machray (Robert),The Night side of London. Cheap ed.,8vo.,"83 x 55, pp. 118, swd. 6d. net",LAURIE,June 16
"MacInemy (M. H.)--A Hist. of the Irish Domini- cans: fr. orig. sources and unpub. records. Vol. I, Irish Dominican Bishops, 1224-1307. 84x5), pp. 646, 1os. 6d. net BROWNE & N., Nov. 16",141,149,,MacInemy (M. H.),"A Hist. of the Irish Domini- cans: fr. orig. sources and unpub. records. Vol. I, Irish Dominican Bishops, 1224-1307.",,"84x5), pp. 646, 1os. 6d. net",BROWNE & N.,Nov. 16
"Macintosh (Douglas Clyde)-The Problem of knowledge. 8vo. 84x5, pp. 524, Ios. 6d. net ALLEN & U., Jan. 16",141,149,,Macintosh (Douglas Clyde),The Problem of knowledge.,8vo.,"84x5, pp. 524, Ios. 6d. net",ALLEN & U.,Jan. 16
"Mackall (J. W.)-Shakespeare after three hundred years. Ryl. 8vo. 98 x6, pp. 25, is. net. (S. Lecture of the Brit. Academy) (Brit. Acad.) MILFORD, Aug. 16",141,149,,Mackall (J. W.),Shakespeare after three hundred years.,Ryl. 8vo.,"98 x6, pp. 25, is. net. (S. Lecture of the Brit. Academy) (Brit. Acad.)",MILFORD,Aug. 16
"Mackall (J. W.)-William Morris. IS. net N.H.R.U., June 16",141,149,,Mackall (J. W.),William Morris.,,IS. net,N.H.R.U.,June 16
"Mackarness (Charles Coleridge)-Faith and duty in time of war: sermons preached in the Parish Church of St. Martin's, Scarborough. Cr. 8vo. 7X43, pp. 118, Is. 6d. net MOWBRAY, Mar. 16",142,150,,Mackarness (Charles Coleridge),"Faith and duty in time of war: sermons preached in the Parish Church of St. Martin's, Scarborough.",Cr. 8vo.,"7X43, pp. 118, Is. 6d. net",MOWBRAY,Mar. 16
