original_entry,page_num,doc_page_num,opening_bits,author(s),title,format,little_bits,publisher,date
"Young People's Society of Christian Endeavour- Year book for 1923. Compil:i and edited by Herbert Halliwell. Cr. 8vo, 71 X 4*, pp. 128, swd. IS. net. CHRISTIAN ENDEAVOUR BOOK ROOM, Dec. '22",305.0,313.0,,,Young People's Society of Christian Endeavour- Year book for 1923. Compil:i and edited by Herbert Halliwell.,Cr. 8vo,"71 X 4*, pp. 128, swd. IS. net.",CHRISTIAN ENDEAVOUR BOOK ROOM,Dec. '22
"Younghusband (George, Maj.-Gen. Sir).—The Jewel House : an account of the many romances connected with the Royal Regalia, together with Sir Gilbert Talbot's account of Colonel Blood's plot, here reproduced for the first time. Illus. in col., etc. Repr. 8vo. 81 x 51, pp. 256, 7s. 6d. net.....H. JENKINS, Sept. '22",305.0,313.0,,"Younghusband (George, Maj.-Gen. Sir).","The Jewel House : an account of the many romances connected with the Royal Regalia, together with Sir Gilbert Talbot's account of Colonel Blood's plot, here reproduced for the first time. Illus. in col., etc. Repr.",8vo.,"81 x 51, pp. 256, 7s. 6d. net.....",H. JENKINS,Sept. '22
"Youngson (Peter) and Shaw (James H.)-Practical mathematics.' Cr. 8vo. 71 x 44, pp. 500, Ios. 6d. net . J. MUNRO, May'22",305.0,313.0,,Youngson (Peter) and Shaw (James H.),Practical mathematics.',Cr. 8vo.,"71 x 44, pp. 500, Ios. 6d. net .",J. MUNRO,May'22
"Youngster's big book, Roy. 8vo., bds. 3. (Budget series). ..DEAN, June '22",305.0,313.0,,,"Youngster's big book,",Roy. 8vo.,bds. 3. (Budget series).,DEAN,June '22
"Youth : the author's magazine. Vol. I, no. 1. 91 x 71, ca. no. 7d. net ALLENSON, Mar., &c.,'22",305.0,313.0,,,"Youth : the author's magazine. Vol. I, no. 1.",,"91 x 71, ca. no. 7d. net",ALLENSON,"Mar., &c.,'22"
"Yule (G. Udny)—An Introduction to the theory of statistics. 6th ed., enl. Cr. 8vo. 7*X5, PP: 430, 125. 6d. net. (Griffin's Scientific textbooks.).. GRIFFIN, Sept. '22",305.0,313.0,,Yule (G. Udny),"An Introduction to the theory of statistics. 6th ed., enl.",Cr. 8vo.,"7*X5, PP: 430, 125. 6d. net. (Griffin's Scientific textbooks.).",GRIFFIN,Sept. '22
"Zadkiel's Almanac and ephemeris, 1923. By Zadkiel, Tao Sze, etc. Cr. 8vo, 741, pp. 96, swd. IS. net.... ....SIMPKIN, Nov. 22",305.0,313.0,,,"Zadkiel's Almanac and ephemeris, 1923. By Zadkiel, Tao Sze, etc.",Cr. 8vo,"741, pp. 96, swd. IS. net.... ....",SIMPKIN,Nov. 22
"Zahm (J. A., Rev.)–From Berlin to Bagdad and Babylon. 8vo, 9 x 51, pp. 541, 21s. net. APPLETON Dec. '22",305.0,313.0,,"Zahm (J. A., Rev.)",From Berlin to Bagdad and Babylon.,"8vo,","9 x 51, pp. 541, 21s. net.",APPLETON,Dec. '22
"Zanetti (Celest)—Through all the seasons : occa- sional verse. 78 x 5}, pp. 32, 25. net SELWYN & B., Apr.'22",305.0,313.0,,Zanetti (Celest),Through all the seasons : occa- sional verse.,,"78 x 5}, pp. 32, 25. net",SELWYN & B.,Apr.'22
"Zangwill (Israel) —The Forcing House; or, The Cockpit continued : tragi-comedy in four acts. 8vo. 81 x 54, pp. 311, 7s. 6d. net. HEINEMANN, Oct. '22",305.0,313.0,,Zangwill (Israel),"The Forcing House; or, The Cockpit continued : tragi-comedy in four acts.",8vo.,"81 x 54, pp. 311, 7s. 6d. net.",HEINEMANN,Oct. '22
"Zanzibar—Colonial report, 1921. 6d. net. H.M.S.O., Oct. '22",305.0,313.0,,,"Zanzibar—Colonial report, 1921.",,6d. net.,H.M.S.O.,Oct. '22
"Zoalloy (P. Raymond)—An Introduction to forecasting weather. Cr. 8vo. 71 x 5, pp. 32, swd. Is, net... .HEFFER, Sept. '22",305.0,313.0,,Zoalloy (P. Raymond),An Introduction to forecasting weather.,Cr. 8vo.,"71 x 5, pp. 32, swd. Is, net...",.HEFFER,Sept. '22
"Zeller (Edward)— Outlines of the history of Greek philosophy. Trans. by Sarah Frances Alleyne and Evelyn Abbott. New impr. Cr. 8vo. 7X5, pp. 378, 6s. net.... ...LONGMANS, May'22",306.0,314.0,,Zeller (Edward),Outlines of the history of Greek philosophy. Trans. by Sarah Frances Alleyne and Evelyn Abbott. New impr.,Cr. 8vo.,"7X5, pp. 378, 6s. net.... ...",LONGMANS,May'22
"Zimmer (Alfred E.)Europe in convalescence. 7** 5, pp 206, 5s. net.. MILLS & B., Mar. '22",306.0,314.0,,Zimmer (Alfred E.),Europe in convalescence.,,"7** 5, pp 206, 5s. net..",MILLS & B.,Mar. '22
"Zimmer (George Frederick)-The Mechanical handling and storing of material. Foreword by Sir John V. Griffith. 3rd ed., rev., Roy. 8vo., 103 x 77, pp. 824, 63s. net CROSBY, LOCKWOOD, July '22",306.0,314.0,,Zimmer (George Frederick),"The Mechanical handling and storing of material. Foreword by Sir John V. Griffith. 3rd ed., rev.,",Roy. 8vo.,"103 x 77, pp. 824, 63s. net","CROSBY, LOCKWOOD",July '22
"Zimmern (Alfred E.)-Europe in convalescence. New ed. 8vo. 84x58, pp. 310, ros. 6d. net. MILLS & B. Aug. '22",306.0,314.0,,Zimmern (Alfred E.),Europe in convalescence. New ed.,8vo.,"84x58, pp. 310, ros. 6d. net.",MILLS & B.,Aug. '22
"Zimmern (Alfred E.)— The Greek Commonwealth: politics and economics in fifth century Athens. 3rd ed. revised. 8vo. 9x55, pp. 461, 16s. net. MILFORD, Aug. 22",306.0,314.0,,Zimmern (Alfred E.),The Greek Commonwealth: politics and economics in fifth century Athens. 3rd ed. revised.,8vo.,"9x55, pp. 461, 16s. net.",MILFORD,Aug. 22
"Zoliqzon (Leon)—Dictionnaire des patois Romans de la Moselle. (Premiere partee, A-E) Roy. 8vo, pp. 256, swd. 5s. net. (Publications de la Faculte des Lettres d'Univ. de Strasburg.) MILFORD, Dec. '22",306.0,314.0,,Zoliqzon (Leon),"Dictionnaire des patois Romans de la Moselle. (Premiere partee, A-E)",Roy. 8vo,"pp. 256, swd. 5s. net. (Publications de la Faculte des Lettres d'Univ. de Strasburg.)",MILFORD,Dec. '22
"Zumbrummem (Albert C.)—The Community church. Cr. 8vo, pp. 169, 8s. 6d. net. CAMB. UNIV. Nov. '22",306.0,314.0,,Zumbrummem (Albert C.),The Community church.,Cr. 8vo,"pp. 169, 8s. 6d. net.",CAMB. UNIV.,Nov. '22
"Zumbusch (Leo V.)-Atlas of syphilis. 4to. 30s. net. BALE, July 22",306.0,314.0,,Zumbusch (Leo V.),Atlas of syphilis.,4to.,30s. net.,BALE,July 22
