original_entry,page_num,doc_page_num,opening_bits,author(s),title,format,little_bits,publisher,date
"Cobb (Irvin S.)-The Glory of the coming: what mine eyes have seen of Americans in action in this year of Grace and Allied endeavour. 8vo. 8 × 5, pp. 464, 7s. net ..HODDER & S., Sep. '19",55,67,,Cobb (Irvin S.),The Glory of the coming: what mine eyes have seen of Americans in action in this year of Grace and Allied endeavour.,8vo.,"8 × 5, pp. 464, 7s. net ..",HODDER & S.,Sep. '19
"Cobb (Thomas)-While Guy was in France: a novel. Cr. 8vo. 7× 5, pp. 315, 2s. 6d. net S. PAUL, Aug. '19",55,67,,Cobb (Thomas),While Guy was in France: a novel.,Cr. 8vo.,"7× 5, pp. 315, 2s. 6d. net",S. PAUL,Aug. '19
"Cock (William H.)-A Scheme of graded religious instruction. 8vo. pp. 103, 2s. 6d. ... (Exeter) W. POLLARD & Co., Dec. '18",55,67,,Cock (William H.),A Scheme of graded religious instruction.,8vo.,"pp. 103, 2s. 6d. ... (Exeter)",W. POLLARD & Co.,Dec. '18
"Cockburn (John Henry)-The Law of check- weighing. 8vo., 71 × 5, pp. 150, 7s. 6d. STEVENS, Nov. '19",55,67,,Cockburn (John Henry),The Law of check- weighing.,8vo.,"71 × 5, pp. 150, 7s. 6d.",STEVENS,Nov. '19
"Codd (Mortimer A.)-Electrical ignition for internal combustion engines. 2nd ed. 8vo. pp. 170, 6s. net ..SPON, Dec. '18",55,67,,Codd (Mortimer A.),Electrical ignition for internal combustion engines. 2nd ed.,8vo.,"pp. 170, 6s. net ..",SPON,Dec. '18
"Codrington (F. J.)-Bring-Brother: one of the children-in-blue from the Town of Lone Bamboo. 8vo., 9 × 71, pp. 63, 4s. net S.P.C.K., Nov. '19",55,67,,Codrington (F. J.),Bring-Brother: one of the children-in-blue from the Town of Lone Bamboo.,8vo.,"9 × 71, pp. 63, 4s. net",S.P.C.K.,Nov. '19
"Coe (Fanny E.)-Stories to read and to tell: for little ones of nine and ten. Illus. by Eileen Robinson. Cr. 8vo. 7×61, pp. 192, 5s. net HARRAP, Dec. '19",55,67,,Coe (Fanny E.),Stories to read and to tell: for little ones of nine and ten. Illus. by Eileen Robinson.,Cr. 8vo.,"7×61, pp. 192, 5s. net",HARRAP,Dec. '19
"Coffey (Walter C.)-Productive sheep husbandry. 8vo. 10s. 6d. net........LIPPINCOTT, Feb. '19",55,67,,Coffey (Walter C.),Productive sheep husbandry.,8vo.,10s. 6d. net........,LIPPINCOTT,Feb. '19
"Cohen (Chapman)-Christianity and slavery. 8vo. pp. 95, swd. Is. net PIONEER PR., Dec. '18",55,67,,Cohen (Chapman),Christianity and slavery.,8vo.,"pp. 95, swd. Is. net",PIONEER PR.,Dec. '18
"Cohen (Chapman)-Woman and Christianity: the subjection and exploitation of a sex. 7×41, pp. 96, swd. Is. net...... PIONEER PR., May '19",55,67,,Cohen (Chapman),Woman and Christianity: the subjection and exploitation of a sex.,,"7×41, pp. 96, swd. Is. net......",PIONEER PR.,May '19
"Cohen (Julius Henry)-Commercial arbitration and the law. 8vo. 12s. 6d. net APPLETON, Feb. '19",55,67,,Cohen (Julius Henry),Commercial arbitration and the law.,8vo.,12s. 6d. net,APPLETON,Feb. '19
"Cohen (O. R.)-The Other woman. Cr. 8vo. swd. Is. 6d. net .A. M. GARDNER, Sep. '19",55,67,,Cohen (O. R.),The Other woman.,Cr. 8vo.,swd. Is. 6d. net .,A. M. GARDNER,Sep. '19
"Cohen (Octavus Roy)-The Crimson alibi. Cr. 8vo. 7×5, pp. 253, 7s. net ....NASH, Dec. '19",55,67,,Cohen (Octavus Roy),The Crimson alibi.,Cr. 8vo.,"7×5, pp. 253, 7s. net ....",NASH,Dec. '19
"Coins of Roman Emp., Hist. references on, Sydenham (E. A.).. .Dec. '17 Coke (Desmond)—The Bending of a twig. New ed. Cr. 8vo. 7 X5, pp. 350, 5s. net 7s. 6d. MILFORD, Nov. '19",55,67,,,"Coins of Roman Emp., Hist. references on, Sydenham (E. A.).",,,,Dec. '17
"Coins of Roman Emp., Hist. references on, Sydenham (E. A.).. .Dec. '17 Coke (Desmond)—The Bending of a twig. New ed. Cr. 8vo. 7 X5, pp. 350, 5s. net 7s. 6d. MILFORD, Nov. '19",55,67,,Coke (Desmond),The Bending of a twig. New ed.,Cr. 8vo.,"7 X5, pp. 350, 5s. net 7s. 6d.",MILFORD,Nov. '19
"Coke (Desmond)-Youth, youth...! Illus. by H. M. Brock. Cr. 8vo. 7 X 5, pp. 313. net .CHAPMAN & H. Oct. '19",55,67,,Coke (Desmond),"Youth, youth...! Illus. by H. M. Brock.",Cr. 8vo.,"7 X 5, pp. 313. net .",CHAPMAN & H.,Oct. '19
"Coker (Edith M.)-Secrets of the flowers: told to the children. Illus. by Florence M. Ander- son. 8vo. 8 x 61, pp. 57, 3s. 6d. net JARROLDS, Nov. '19",55,67,,Coker (Edith M.),Secrets of the flowers: told to the children. Illus. by Florence M. Ander- son.,8vo.,"8 x 61, pp. 57, 3s. 6d. net",JARROLDS,Nov. '19
"Colbrook (E. W.) ed.-Odham's A B C of the Great War. Cr. 8vo. 7×5, pp. 229, 6s. net ODHAMS, Aug. '19",55,67,,Colbrook (E. W.) ed.,Odham's A B C of the Great War.,Cr. 8vo.,"7×5, pp. 229, 6s. net",ODHAMS,Aug. '19
"Coldicott (Rowlands)-London men in Palestine, and how they marched to Jerusalem. 8vo. 9 × 5, pp. 243, 12s. 6d. net E. ARNOLD, Nov. '19",55,67,,Coldicott (Rowlands),"London men in Palestine, and how they marched to Jerusalem.",8vo.,"9 × 5, pp. 243, 12s. 6d. net",E. ARNOLD,Nov. '19
"Cole (Grenville A. J.)-Aids in practical geology. 7th ed., rev. Cr. 8vo. 74 × 51, pp. 447, 10s. 6d. net. (Scientific text bks.)....GRIFFIN, Mar. '19",55,67,,Cole (Grenville A. J.),"Aids in practical geology. 7th ed., rev.",Cr. 8vo.,"74 × 51, pp. 447, 10s. 6d. net. (Scientific text bks.)....",GRIFFIN,Mar. '19
"Cole (Harold F. G.)-Concerning the advents and the ages. 8vo. pp. 115 S. E. ROBERTS, Oct. '19",55,67,,Cole (Harold F. G.),Concerning the advents and the ages.,8vo.,pp. 115,S. E. ROBERTS,Oct. '19
"Cole (R. E. G.)-ed. Chapter Acts of the Cathedral Church of St. Mary of Lincoln. A.D. 1536-1547. 10×6, pp. 266, 10s. 6d. (Lincoln Record Soc.) MORTON, Dec. '18",55,67,,Cole (R. E. G.),ed. Chapter Acts of the Cathedral Church of St. Mary of Lincoln. A.D. 1536-1547.,,"10×6, pp. 266, 10s. 6d. (Lincoln Record Soc.)",MORTON,Dec. '18
"Cole (Sophie)-The Devil's chapel. Cr. 8vo. 7×5, pp. 315, 6s. net. MILLS & B., Aug. '19",55,67,,Cole (Sophie),The Devil's chapel.,Cr. 8vo.,"7×5, pp. 315, 6s. net.",MILLS & B.,Aug. '19
"Cole (Sydney W.)-Practical physiological chemis- try. 5th ed. Intro. by Prof. F. G. Hopkins. 8vo. 8×51, pp. 415, 15s. net HEFFER, June '19",55,67,,Cole (Sydney W.),Practical physiological chemis- try. 5th ed. Intro. by Prof. F. G. Hopkins.,8vo.,"8×51, pp. 415, 15s. net",HEFFER,June '19
"Coleman (Frederic)-From Mons to Ypres with French a personal narrative. 6th imp. Cr. 8vo., 7×5, pp. 343, 3s. 6d. net. S. LOW, Oct. '19",55,67,,Coleman (Frederic),From Mons to Ypres with French a personal narrative. 6th imp.,Cr. 8vo.,"7×5, pp. 343, 3s. 6d. net.",S. LOW,Oct. '19
"Coleman (T. E., Lt.-Col.)-New standard building prices: for the use of architects, civil engineers, builders, contractors, &c. Cr. 8vo. 7×41, pp. 44, swd. 4s. net ...SPON, Oct. '19",55,67,,"Coleman (T. E., Lt.-Col.)","New standard building prices: for the use of architects, civil engineers, builders, contractors, &c.",Cr. 8vo.,"7×41, pp. 44, swd. 4s. net ...",SPON,Oct. '19
"Coleridge (Ernest Hartley)-The Life of Thomas Coutts, Banker. 2 vols. 8vo. 8×5, pp. 459, ..LANE, Dec. '19",55,67,,Coleridge (Ernest Hartley),"The Life of Thomas Coutts, Banker. 2 vols.",8vo.,"8×5, pp. 459, ..",LANE,Dec. '19
"Coleridge (Gilbert)-An Instinctive criminal. New ed. Cr. 8vo. 2s. 6d. net 42s. net S. LOW, Sep., Dec. '19",55,67,,Coleridge (Gilbert),An Instinctive criminal. New ed.,Cr. 8vo.,2s. 6d. net 42s. net,S. LOW,"Sep., Dec. '19"
"Coleridge (John, Lieut.)-The Grand Fleet: a war-time sketch book. Ryl. 8vo. 71× 10, swd. 3s. 6d. net Coleridge (John)-The 4s. 6d. net Coleridge (Samuel Taylor)-Marriage: a letter. 8vo. pp. 22 (privately printed) T. J. WISE, June '19",55,67,,"Coleridge (John, Lieut.)",The Grand Fleet: a war-time sketch book.,Ryl. 8vo.,"71× 10, swd. 3s. 6d. net",,
"Coleridge (John, Lieut.)-The Grand Fleet: a war-time sketch book. Ryl. 8vo. 71× 10, swd. 3s. 6d. net Coleridge (John)-The 4s. 6d. net Coleridge (Samuel Taylor)-Marriage: a letter. 8vo. pp. 22 (privately printed) T. J. WISE, June '19",55,67,,Coleridge (John),,,4s. 6d. net,,
"Coleridge (John, Lieut.)-The Grand Fleet: a war-time sketch book. Ryl. 8vo. 71× 10, swd. 3s. 6d. net Coleridge (John)-The 4s. 6d. net Coleridge (Samuel Taylor)-Marriage: a letter. 8vo. pp. 22 (privately printed) T. J. WISE, June '19",55,67,,Coleridge (Samuel Taylor),Marriage: a letter.,8vo.,pp. 22 (privately printed),T. J. WISE,June '19
"Collar (George)—An Industrial and social history of England. Cr. 8vo. 7×5, pp. 305, 3s. net PITMAN, Sep. '19",55,67,,Collar (George),An Industrial and social history of England.,Cr. 8vo.,"7×5, pp. 305, 3s. net",PITMAN,Sep. '19
"Collections and recollections of the 107th Field Company, R.E. 81×51, pp. 146 .LEE WARNER, Mar. '19",55,67,,,"Collections and recollections of the 107th Field Company, R.E.",,"81×51, pp. 146 .",LEE WARNER,Mar. '19
"Collie (Arnold E.)-Aids to materia medica. 18mo. 64×4 pp. 123 3s. net .... BAILLIERE, Oct. '19",55,67,,Collie (Arnold E.),Aids to materia medica.,18mo.,64×4 pp. 123 3s. net ....,BAILLIERE,Oct. '19
"Collier (Madeleine)-Fragments. 5×41, pp. 32, IS. 4d. net (Amersham, Bucks) MORLAND, Mar. '19",55,67,,Collier (Madeleine),Fragments.,,"5×41, pp. 32, IS. 4d. net (Amersham, Bucks)",MORLAND,Mar. '19
"Collier (Price)-England and the English: from an American point of view. New ed. Cr. 8vo., 7 × 41, pp. 362, 5s. net. DUCKWORTH, Nov. '19",55,67,,Collier (Price),England and the English: from an American point of view. New ed.,Cr. 8vo.,"7 × 41, pp. 362, 5s. net.",DUCKWORTH,Nov. '19
"Grand Fleet. Ryl. 8vo. . LEE WARNER, May '19",55,67,,,Grand Fleet.,Ryl. 8vo.,. ,LEE WARNER,May '19
"A. K.) 2S., Nov. '19",56,68,,A. K.),,,"2S.,",,Nov. '19
"Colliery, Accident at Stanrigg and Arbuckle, Lanarkshire-Report on the causes and cir- cumstances, IS. H.M. STATIONERY OFF., June '19",56,68,,,"Colliery, Accident at Stanrigg and Arbuckle, Lanarkshire-Report on the causes and cir- cumstances,",,IS.,H.M. STATIONERY OFF.,June '19
"Collingridge (W. H.)-Tricks of self-defence. 3rd ed. Cr. 8vo. 7× 4, pp. 78 Is. 6d. net 66 BOXING OFFICES, Mar. '19",56,68,,Collingridge (W. H.),Tricks of self-defence. 3rd ed.,Cr. 8vo.,"7× 4, pp. 78 Is. 6d. net",66 BOXING OFFICES,Mar. '19
"Collins (A. Frederick)-How to fly. Illus. Cr. 8vo. 7×5, pp. 197, 5s. net ..APPLETON, June '19",56,68,,Collins (A. Frederick),How to fly. Illus.,Cr. 8vo.,"7×5, pp. 197, 5s. net ..",APPLETON,June '19
"Collins (A. Frederick)-The Amateur mechanic. Illus. Cr. 8vo. 7× 5, pp. 223, 5s. net APPLETON, May '19",56,68,,Collins (A. Frederick),The Amateur mechanic. Illus.,Cr. 8vo.,"7× 5, pp. 223, 5s. net",APPLETON,May '19
"Collins (Charles)-The Natural law: Based on the drama of Howard Hall and Charles Summer. Cr. 8vo 7×5, pp.184, 6s. net MILLS & B.Aug. ‘19",56,68,,Collins (Charles),The Natural law: Based on the drama of Howard Hall and Charles Summer.,Cr. 8vo,"7×5, pp.184, 6s. net",MILLS & B.,Aug. ‘19
"Colloids, Physics and chem. of, 4s. 6d. net Colmore (G.)-The Thunderbolt. Cr. 8vo. 7×5, pp. 312, 7s. net UNWIN, May '19",56,68,"Colloids, Physics and chem. of, 4s. 6d. net ",Colmore (G.),The Thunderbolt.,Cr. 8vo.,"7×5, pp. 312, 7s. net",UNWIN,May '19
"Colonial Office list, 1919 (The)-Ed. by Sir Wil- liam H. Mercer and A. E. Collins. 8vo., 8×51, pp. 846, 21s. net. WATERLOW & SONS, Aug. '19",56,68,,,"Colonial Office list, 1919 (The)-Ed. by Sir Wil- liam H. Mercer and A. E. Collins.",8vo.,"8×51, pp. 846, 21s. net.",WATERLOW & SONS,Aug. '19
"Colonial reports (1917)—Gold Coast. 3d. H.M. STATIONERY OFF., Sep. '19",56,68,,,Colonial reports (1917)—Gold Coast.,,3d.,H.M. STATIONERY OFF.,Sep. '19
"Colonial reports-Nyasaland, 1917-18, 1d.; Basu- toland, 1917-18, 1d. H.M. STATIONERY OFF., July '19",56,68,,,"Colonial reports-Nyasaland, 1917-18, 1d.; Basutoland, 1917-18, 1d.",,,H.M. STATIONERY OFF.,July '19
"Colonial reports, 1917-Grenada (1917-18), id.; Turks and Caicos Islands, Id. H.M. STATIONERY OFF., Nov. '18",56,68,,,"Colonial reports, 1917-Grenada (1917-18), id.; Turks and Caicos Islands, Id.",,,H.M. STATIONERY OFF.,Nov. '18
"Colonial Reports, 1917-Mauritius, 3d.; Fast Africa Protectorate (1916-17) 2d.; Barbados (1917-18), Id. H.M. STATIONERY OFF., Apr. '19",56,68,,,"Colonial Reports, 1917-Mauritius, 3d.; Fast Africa Protectorate (1916-17) 2d.; Barbados (1917-18), Id.",,,H.M. STATIONERY OFF.,Apr. '19
"Colonial Reports, 1917-Sierra Leone, 2d.; Straits Settlements, 3d. ; Leeward Islands (1917-18) 1d.; Uganda (1917-18) 1d.; British Honduras, Id.; Gilbert and Ellice Islands (1917-18) 1d...H.M. STATIONERY OFF., June '10 Colonial Reports, 1917-St. Vincent (1917-18) Id. Bahamas (1917-18) 2d.; Gambia, 2d.; Jam- aica (1917-18) 2d.; Gibraltar, id.; Bermuda, Id.; Swaziland (1917-18, Id.; Trinidad and Tobago, 5d.; Cyprus (1917-18), id.; Bechuana- land Protectorate (1917-18), id. H.M. STATIONERY OFF., Mar. '19",56,68,,,"Colonial Reports, 1917-Sierra Leone, 2d.; Straits Settlements, 3d. ; Leeward Islands (1917-18) 1d.; Uganda (1917-18) 1d.; British Honduras, Id.; Gilbert and Ellice Islands (1917-18) 1d.",,,H.M. STATIONERY OFF.,June '10
"Colonial Reports, 1917-Sierra Leone, 2d.; Straits Settlements, 3d. ; Leeward Islands (1917-18) 1d.; Uganda (1917-18) 1d.; British Honduras, Id.; Gilbert and Ellice Islands (1917-18) 1d...H.M. STATIONERY OFF., June '10 Colonial Reports, 1917-St. Vincent (1917-18) Id. Bahamas (1917-18) 2d.; Gambia, 2d.; Jam- aica (1917-18) 2d.; Gibraltar, id.; Bermuda, Id.; Swaziland (1917-18, Id.; Trinidad and Tobago, 5d.; Cyprus (1917-18), id.; Bechuana- land Protectorate (1917-18), id. H.M. STATIONERY OFF., Mar. '19",56,68,,,"Colonial Reports, 1917-St. Vincent (1917-18) Id. Bahamas (1917-18) 2d.; Gambia, 2d.; Jam- aica (1917-18) 2d.; Gibraltar, id.; Bermuda, Id.; Swaziland (1917-18, Id.; Trinidad and Tobago, 5d.; Cyprus (1917-18), id.; Bechuana- land Protectorate (1917-18), id.",,,H.M. STATIONERY OFF.,Mar. '19
"Colonial reports, 1918-Wei-Hai-Wei, id.; Zan- zibar, id.; Hong Kong, 2d. H.M. STATIONERY OFF., Oct. '19",56,68,,,"Colonial reports, 1918-Wei-Hai-Wei, id.; Zan- zibar, id.; Hong Kong, 2d.",,,H.M. STATIONERY OFF.,Oct. '19
"Colonial reports. 1917-Northern Territories of the Gold Coast, id.; Ceylon, (map), 6d. ; Hong Kong (abridged), 2d.; Zanzibar, id.; St. Helena, Id.; Malta, (1917-18), 1d.; British Guiana, 2d. ..H.M. STATIONERY OFF., Dec. '18",56,68,,,"Colonial reports. 1917-Northern Territories of the Gold Coast, id.; Ceylon, (map), 6d. ; Hong Kong (abridged), 2d.; Zanzibar, id.; St. Helena, Id.; Malta, (1917-18), 1d.; British Guiana, 2d.",,,H.M. STATIONERY OFF.,Dec. '18
"Colonial Service (H. M.)-Regulations. 9d. H.M. STATIONERY OFF., Aug. '19",56,68,,Colonial Service (H. M.),Regulations.,,9d.,H.M. STATIONERY OFF.,Aug. '19
"Columbia University: Dept. of Philosophy- Studies in the history of ideas. Vol. 1. 8vo. 8×51, pp. 279, 8s. 6d. net MILFORD, Jan. '19",56,68,,,Columbia University: Dept. of Philosophy- Studies in the history of ideas. Vol. 1.,8vo.,"8×51, pp. 279, 8s. 6d. net",MILFORD,Jan. '19
"Colvin (Ian D.)-The Safety of the Nation : showing how our security rests upon our industries. Cr. 8vo. 7×44, pp. 253, 6s. net MURRAY, June '19",56,68,,Colvin (Ian D.),The Safety of the Nation : showing how our security rests upon our industries.,Cr. 8vo.,"7×44, pp. 253, 6s. net",MURRAY,June '19
"Colwyn (John)-A City without a church. Cr. 8vo. 3s. 6d. net .STOCKWELL, July'19",56,68,,Colwyn (John),A City without a church.,Cr. 8vo.,3s. 6d. net .,STOCKWELL,July'19
"Colyer (J. F.-Dental surgery and pathology. 4th ed. 8vo. 81×51, pp. 913, 32s. net LONGMANS, July '19",56,68,,Colyer (J. F.),Dental surgery and pathology. 4th ed.,8vo.,"81×51, pp. 913, 32s. net",LONGMANS,July '19
"Combe Mrs. Kenneth)-The Upward flight. Cr. 8vo. 7X5, pp. 254, 6s. 9d. net net. """" SKEFFINGTON, Feb. '19",56,68,,Combe Mrs. Kenneth),The Upward flight.,Cr. 8vo.,"7X5, pp. 254, 6s. 9d. net net. """"",SKEFFINGTON,Feb. '19
"Combridge (Daniel Thomas)--All the way: autobiographical jottings. 8vo. 7×5, 35. (Hove) COMBRIDGES, Sep. '18",56,68,,Combridge (Daniel Thomas),All the way: autobiographical jottings.,8vo.,"7×5, 35. (Hove)",COMBRIDGES,Sep. '18
"Comic tragedies. Written by ""Jo"" and ""Meg and acted by the ""Little women."" Cr. 8vo. 7×4, pp. 317, 2s. 6d. net ..S. LOW, Aug. '19",56,68,,,"Comic tragedies. Written by ""Jo"" and ""Meg and acted by the ""Little women.""",Cr. 8vo.,"7×4, pp. 317, 2s. 6d. net ..",S. LOW,Aug. '19
"Comical customers. Fol. -clo., Is. 6d. SCOTT & S., Jan. '19",56,68,,,Comical customers.,Fol.,"-clo., Is. 6d.",SCOTT & S.,Jan. '19
"Commercial traveller, &c., Duties as, IS. 3d. net... Common examination for entrance to public schools reprint of selected papers 1909-15, with appendix cont. selected papers 1916 and 1917. 8vo. pp. 320, 3s. 6d. net WARREN; SIMPKIN, Jan. '19",56,68,"Commercial traveller, &c., Duties as, IS. 3d. net...",,"Common examination for entrance to public schools reprint of selected papers 1909-15, with appendix cont. selected papers 1916 and 1917.",8vo.,"pp. 320, 3s. 6d. net",WARREN; SIMPKIN,Jan. '19
"Common prayer (Book of), and Hymns ancient and modern. 32mo., 4×3, pp. 690, 2s. 6d. net; lthr. 3s. 6d. net....COLLINS, Aug. '19",56,68,,,"Common prayer (Book of), and Hymns ancient and modern.",32mo.,"4×3, pp. 690, 2s. 6d. net; lthr. 3s. 6d. net....",COLLINS,Aug. '19
"Commons Act, 1876 (Coity Wallia Commons, Glamorgan)-Report by Bd. of Agriculture upon the Regulation of, id. H.M. STATIONERY OFF., May '19",56,68,,,"Commons Act, 1876 (Coity Wallia Commons, Glamorgan)-Report by Bd. of Agriculture upon the Regulation of, id.",,,H.M. STATIONERY OFF.,May '19
"Commons, House of. See House of Commons. Commonwealth in Palestine (A): the land of Israel for the People Israel. By ""A Jewish Nationalist."" 8×51, pp. 7, Id. JEWISH CHRONICLE, Dec. '18",56,68,"Commons, House of. See House of Commons.",,"Commonwealth in Palestine (A): the land of Israel for the People Israel. By ""A Jewish Nationalist.""",,"8×51, pp. 7, Id.",JEWISH CHRONICLE,Dec. '18
"Companies—27th General annual report by Bd. of Trade. 4d. H.M. STATIONERY OFF., Nov. '18",57,69,,,Companies—27th General annual report by Bd. of Trade.,,4d.,H.M. STATIONERY OFF.,Nov. '18
"Complete guide to the Hotchkiss machine gun. By an Instructor. Cr. 8vo. 7 X4, pp. 128, cloth limp 2s. 6d. net .GALE & P., Mar. '19",57,69,,,Complete guide to the Hotchkiss machine gun. By an Instructor.,Cr. 8vo.,"7 X4, pp. 128, cloth limp 2s. 6d. net .",GALE & P.,Mar. '19
