original_entry,page_num,doc_page_num,opening_bits,author(s),title,format,little_bits,publisher,date
"Bell (Gertrude Lowthian)-Palace and mosque at Ukhaidir: a study in early Mohammadan architecture. Illus. Ryl. 4to., PP. 200, 425. net .. (Clarendon Press) MILFORD, Mar. 14",26,34,,Bell (Gertrude Lowthian),Palace and mosque at Ukhaidir: a study in early Mohammadan architecture. Illus.,Ryl. 4to.,"PP. 200, 425. net ..",(Clarendon Press) MILFORD,Mar. 14
"Bell (Ida) --Country clash : the sayings and doings of Meggy Bowman.. Cr. 8vo., pp. 230, swd., IS. net HODDER & S., Apr. 14",26,34,,Bell (Ida),Country clash : the sayings and doings of Meggy Bowman..,Cr. 8vo.,"pp. 230, swd., IS. net",HODDER & S.,Apr. 14
"Bell (J. J.)--The Whalers. Cr. 8vo. 71 X4+, pp. 320, 68 ... HODDER & S., Od. 14",26,34,,Bell (J. J.),The Whalers.,Cr. 8vo.,"71 X4+, pp. 320, 68 ...",HODDER & S.,Od. 14
"Bell (J. J.)-Bobby. Pop. edit. Cr. 8vo., pp. 158, swd. is, net „HODDER & S., May 14",26,34,,Bell (J. J.),Bobby. Pop. edit.,Cr. 8vo.,"pp. 158, swd. is, net",„HODDER & S.,May 14
"Bell (J. J.)-Courtin' Christina. Pop. edit. Cr. 8vo., pp. 144, Is. net HODDER & S. Mar. 14",26,34,,Bell (J. J.),Courtin' Christina. Pop. edit.,Cr. 8vo.,"pp. 144, Is. net",HODDER & S.,Mar. 14
"Bell (J. J.)-The Indiscreetions of Maister Redhorn. Pop. edit. Cr. 8vo., pp. 188, is. net HODDER & S., Mar. 14",26,34,,Bell (J. J.),The Indiscreetions of Maister Redhorn. Pop. edit.,Cr. 8vo.,"pp. 188, is. net",HODDER & S.,Mar. 14
"Bell (James Mackintosh)—The Wilds of Maoriland. Illus, 8vo. 9 X5), pp. 272, 158. MACMILLAN, May 14",26,34,,Bell (James Mackintosh),The Wilds of Maoriland.,8vo.,"Illus, 9 X5), pp. 272, 158.",MACMILLAN,May 14
"Bell (Lettice)-The Tuck-me-Up book. 4to. 8 X6, pp. 176, 3s. 6d.; bds. 25, 6d. HODDER & S., Nov. 14",26,34,,Bell (Lettice),The Tuck-me-Up book.,4to.,"8 X6, pp. 176, 3s. 6d.; bds. 25, 6d.",HODDER & S.,Nov. 14
"Bell (Mrs. Arthur)-Architecture. 12mo. 60. net (People's books) · JACK, Feb. 14",26,34,,Bell (Mrs. Arthur),Architecture.,12mo.,60. net (People's books),JACK,Feb. 14
"Bell (R. H.)-Art talks with Ranger. Cr. 8vo., 6s. net ... PUTNAM, Nov. 14",26,34,,Bell (R. H.),Art talks with Ranger.,Cr. 8vo.,6s. net ...,PUTNAM,Nov. 14
"Bell (R. S. Warren)—“ Dormitory Eight."" Cr. 8vo. 8 X5], pp. 274, 39. 60. BLACK, Oct. 14",26,34,,Bell (R. S. Warren),""" Dormitory Eight.""",Cr. 8vo.,"8 X5], pp. 274, 39. 60.",BLACK,Oct. 14
"Bell's French picture cards. 3rd ser. Packet, IS. 6d. net . BELL, Feb. 14",26,34,,,Bell's French picture cards. 3rd ser.,,"Packet, IS. 6d. net .",BELL,Feb. 14
"Bell's Outdoor and indoor experimental arith- metic: teachers' book. Cr. 8vo., 35. 6d. net BELL, Apr. 14",26,34,,,Bell's Outdoor and indoor experimental arith- metic: teachers' book.,Cr. 8vo.,35. 6d. net,BELL,Apr. 14
"Belloc (Hilaire) —The Book of the Bayeux tapestry : presenting the complete work in a series of colour facsimiles. 8vo. 10 X64, pp. 96, IOS. 6d. net CHATTO, Oct. 14",26,34,,Belloc (Hilaire),The Book of the Bayeux tapestry : presenting the complete work in a series of colour facsimiles.,8vo.,"10 X64, pp. 96, IOS. 6d. net",CHATTO,Oct. 14
"Belloc (Hilaire)-The Four men : a farrago. 12mo., pp. 374, Is. net ..NELSON, June 14",26,34,,Belloc (Hilaire),The Four men : a farrago.,12mo.,"pp. 374, Is. net ..",NELSON,June 14
"Belloc (Hilaire)-The Girondin. 12mo., 7d. net NELSON, May 14",26,34,,Belloc (Hilaire),The Girondin.,12mo.,7d. net,NELSON,May 14
"Belloc (Hilaire)—The Historic Thames. 12mo., pp. 206, is. net (The Wayfarer's library) DENT, May 14",26,34,,Belloc (Hilaire),The Historic Thames.,12mo.,"pp. 206, is. net (The Wayfarer's library)",DENT,May 14
"Bellot (Hugh H. L.)- The Temple. 12mo., 61X3), pp. 222, 2s, 6d. net (Lillle guides) METHUEN, June 14",26,34,,Bellot (Hugh H. L.),The Temple.,12mo.,"61X3), pp. 222, 2s, 6d. net (Lillle guides)",METHUEN,June 14
"Benavente (Jacinto)-Teatro. 12mo., pp. 480, IS. net .NELSON, June 14",26,34,,Benavente (Jacinto),Teatro.,12mo.,"pp. 480, IS. net .",NELSON,June 14
"Bendz (E.)-The Influence of Pater and Matthew Arnold in the prose writings of Oscar Wilde. Ryl. 8vo. swd. 35. net....H. GREVEL, Mar. 14",26,34,,Bendz (E.),The Influence of Pater and Matthew Arnold in the prose writings of Oscar Wilde.,Ryl. 8vo.,swd. 35. net....,H. GREVEL,Mar. 14
"Benecke (Amy M.)—Cannes and its surroundings : illustrated and described. 4to. 84 X 7, pp. 106, 35. 6d, net. ..G. ALLEN, Oct. 14",26,34,,Benecke (Amy M.),Cannes and its surroundings : illustrated and described.,4to.,"84 X 7, pp. 106, 35. 6d, net. ..",G. ALLEN,Oct. 14
"Benett (W.)-England's mission. Cr. 8vo., swd., 20. net (Oxford pamphlets) MILFORD, Nov. 14",26,34,,Benett (W.),England's mission.,Cr. 8vo.,"swd., 20. net (Oxford pamphlets)",MILFORD,Nov. 14
"Bengal code (The)-Fourth edit. by F. G. Wigley. (In 4 vols.) Vol. 1. Ryl. 8vo. 104 x7, pp. 830, 6s. (Calcutta) BENGAL SECRETARIAT BOOK Co., Jan. 14",26,34,,,Bengal code (The)-Fourth edit. by F. G. Wigley. (In 4 vols.) Vol. 1.,Ryl. 8vo.,"104 x7, pp. 830, 6s. (Calcutta)",BENGAL SECRETARIAT BOOK Co.,Jan. 14
"Benn (Alfred William)— The Greek philosophers. 8vo. 9 X5), pp. 656, 18s, net SMITII, E., Oct. 14",26,34,,Benn (Alfred William),The Greek philosophers.,8vo.,"9 X5), pp. 656, 18s, net","SMITII, E.",Oct. 14
"Bennet (E.)- Shots and snapshots in British East Africa. Illus. 8vo. 97x5}, pp. 324, 128. 6d. net..... ...LONGMANS, Oct. 14",27,35,,Bennet (E.),Shots and snapshots in British East Africa. Illus.,8vo.,"97x5}, pp. 324, 128. 6d. net..... ...",LONGMANS,Oct. 14
"Bennett (A. H.)-Through an Anglican sisterhood to Rome. Illus. Cr. 8vo. 8 x 57, pp. 216, 4s. 6d. net ...LONGMANS, May 14",27,35,,Bennett (A. H.),Through an Anglican sisterhood to Rome. Illus.,Cr. 8vo.,"8 x 57, pp. 216, 4s. 6d. net ...",LONGMANS,May 14
"Bennett (Arnold) —The Truth about an author. New edit. 12mo. 7 X 41, pp. 172, 28. 6d. net METHUEN, Mar. 14",27,35,,Bennett (Arnold),The Truth about an author. New edit.,12mo.,"7 X 41, pp. 172, 28. 6d. net",METHUEN,Mar. 14
"Bennett (Arnold)---The Plain man and his wife. Pop. edit. Cr. 8vo., pp. 150, is, net HODDER & S., Nov. 14",27,35,,Bennett (Arnold),The Plain man and his wife. Pop. edit.,Cr. 8vo.,"pp. 150, is, net",HODDER & S.,Nov. 14
"Bennett (Arnold)--Leonora. 8vo. swd. 6d. CHATTO, Jan. 14",27,35,,Bennett (Arnold),Leonora.,8vo.,swd. 6d.,CHATTO,Jan. 14
"Bennett (Arnold)--The Old wives' taie. 8vo., swd., 6d. HODDER & S., June 14",27,35,,Bennett (Arnold),The Old wives' taie.,"8vo.,","swd., 6d.",HODDER & S.,June 14
"Bennett (Arnold)-A Man from the North. Cr. 8vo. 7* X4, pp. 270, 4th ed. 28. net METHUEN, Aug. 14",27,35,,Bennett (Arnold),A Man from the North.,Cr. 8vo.,"7* X4, pp. 270, 4th ed. 28. net",METHUEN,Aug. 14
"Bennett (Arnold)-Helen with the high hand : an idyllic diversion. Reissue. Cr. 8vo. 71 X 5, pp. 318, 25. net........CHAPMAN & H., Feb. 14",27,35,,Bennett (Arnold),Helen with the high hand : an idyllic diversion. Reissue.,Cr. 8vo.,"71 X 5, pp. 318, 25. net........",CHAPMAN & H.,Feb. 14
"Bennett (Arnold)-The Card : a story of adven- ture in the Five Towns. Cr. 8vo. 67 x 41, pp. 256, is. net . METHUEN, Aug. 14",27,35,,Bennett (Arnold),The Card : a story of adven- ture in the Five Towns.,Cr. 8vo.,"67 x 41, pp. 256, is. net .",METHUEN,Aug. 14
"Bennett (Arnold)-The Price of love : a tale. Cr. 8vo. 78 X 5, pp. 360, 6s. METHUEN, Oct. 14",27,35,,Bennett (Arnold),The Price of love : a tale.,Cr. 8vo.,"78 X 5, pp. 360, 6s.",METHUEN,Oct. 14
"Bennett (Arnold)—Liberty : a statement of the British case. Cr. 8vo., pp. 60, is. net HODDER & S., Oct. 14",27,35,,Bennett (Arnold),Liberty : a statement of the British case.,Cr. 8vo.,"pp. 60, is. net",HODDER & S.,Oct. 14
"Bennett (Arnold)—The City of pleasure. 12mo., pp. 254, IS. net. (Wayfarers' library) DENT, June 14",27,35,,Bennett (Arnold),The City of pleasure.,12mo.,"pp. 254, IS. net. (Wayfarers' library)",DENT,June 14
"Bennett (Arnold)—The Gates of wrath. Pop. edit. 12mo., pp. 160, is. net METHUEN, Mar. 14",27,35,,Bennett (Arnold),The Gates of wrath. Pop. edit.,12mo.,"pp. 160, is. net",METHUEN,Mar. 14
"Bennett (Arnold)—The Grand Babylon Hotel. 12mo., pp. 290, IS. net. (The Wayfarer's library) .DENT, Feb. 14",27,35,,Bennett (Arnold),The Grand Babylon Hotel.,12mo.,"pp. 290, IS. net. (The Wayfarer's library)",.DENT,Feb. 14
"Bennett (Arnold)—Those United States. New edit. Cr. 8vo. 73 X 5, pp. 256, 25. 6d. net M. SECKER, Od. 14",27,35,,Bennett (Arnold),Those United States. New edit.,Cr. 8vo.,"73 X 5, pp. 256, 25. 6d. net",M. SECKER,Od. 14
"Bennett (Arthur)- Some plain words to the English people. 8vo., pp. 241, 25. 6d. net (Warrington).. SUNRISE PUBL. Co., Mar. 14",27,35,,Bennett (Arthur),Some plain words to the English people.,8vo.,"pp. 241, 25. 6d. net (Warrington)..",SUNRISE PUBL. Co.,Mar. 14
"Bennett (E. N.)-Problems of village life. 12mo., pp. 256, is. net. (Home univ. lib.) WILLIAMS & N., Jan. 14",27,35,,Bennett (E. N.),Problems of village life.,12mo.,"pp. 256, is. net. (Home univ. lib.)",WILLIAMS & N.,Jan. 14
"Bennett (Frank)-Forty years in Brazil. Illus. 8vo. 9 X5, pp. 296, 1os. 6d. net MILLS & B., Feb. 14",27,35,,Bennett (Frank),Forty years in Brazil. Illus.,8vo.,"9 X5, pp. 296, 1os. 6d. net",MILLS & B.,Feb. 14
"Bennett (Norman G.) ed.—The Science and prac- tice of dental surgery. Ryl. 8vo. 428. net. (Oxford medical publications)..FROWDE, May 14",27,35,,Bennett (Norman G.) ed.,The Science and prac- tice of dental surgery.,Ryl. 8vo.,428. net. (Oxford medical publications).,FROWDE,May 14
"Bennett (R. Allan)--Plain rules for the use of tuberculin. 8vo. 82X51, pp. 480, 25. 6d. net SIMPKIN, Jan. 14",27,35,,Bennett (R. Allan),Plain rules for the use of tuberculin.,8vo.,"82X51, pp. 480, 25. 6d. net",SIMPKIN,Jan. 14
"Bennett (Reginald R.)-Medical and pharma- ceutical Latin. With intro. by Henry G. Greenish. 2nd edit. Cr. 8vo. 71 X41, pp. 458, 6s. 6d. net ......CHURCHILL, Aug. 14",27,35,,Bennett (Reginald R.),Medical and pharma- ceutical Latin. With intro. by Henry G. Greenish. 2nd edit.,Cr. 8vo.,"71 X41, pp. 458, 6s. 6d. net",CHURCHILL,Aug. 14
"Bennett (W. H.)-The Life of Christ according to St. Mark. Re-issue, Cr. 8vo., pp. 308, 25. net. (Expositor's library) .... HODDER & S., Nov. 14",27,35,,Bennett (W. H.),"The Life of Christ according to St. Mark. Re-issue,",Cr. 8vo.,"pp. 308, 25. net. (Expositor's library)",HODDER & S.,Nov. 14
"Bennett (W. H.)-The Value of the Old Testament for the religion of to-day. 12mo. swd. 6d. net S. P. C. K., June 14",27,35,,Bennett (W. H.),The Value of the Old Testament for the religion of to-day.,12mo.,swd. 6d. net,S. P. C. K.,June 14
"Bennett (W. P.)-The History and present position of the Bill of Lading as a document of title to goods (Being the York prize essay for the year 1913). Demy 8vo., pp. 110, 4s. net CAMB. L':IV. PRESS, July 14",27,35,,Bennett (W. P.),The History and present position of the Bill of Lading as a document of title to goods (Being the York prize essay for the year 1913).,Demy 8vo.,"pp. 110, 4s. net",CAMB. L':IV. PRESS,July 14
"Bennetts (H. J. T.)-Visions of the unseen: chapter in the communion of saints. Cr. 8vo. 73 X5, pp. 184, 25. 6d. net.... MOWBRAY, Oct. 14",27,35,,Bennetts (H. J. T.),Visions of the unseen: chapter in the communion of saints.,Cr. 8vo.,"73 X5, pp. 184, 25. 6d. net....",MOWBRAY,Oct. 14
"Benson (Arthur C.)-Along the road. Cheaper edit. Cr. 8vo. 71 x5, pp. 398, 35. 6d. net SMITH, E., May 14",27,35,,Benson (Arthur C.),Along the road. Cheaper edit.,Cr. 8vo.,"71 x5, pp. 398, 35. 6d. net","SMITH, E.",May 14
"Benson (Arthur C.)-The Beauty of life : selections from writings. Compiled by Caroline Abbott Derby. Illus. Re-issue. 8vo. 87X57, pp. 410, 6s. net HODDER & S., Oct. 14",27,35,,Benson (Arthur C.),The Beauty of life : selections from writings. Compiled by Caroline Abbott Derby. Illus. Re-issue.,8vo.,"87X57, pp. 410, 6s. net",HODDER & S.,Oct. 14
"Benson (Arthur C.)— The Schoolmaster. Pop. edit. Cr. 8vo., pp. 182, is. net MURRAY, Feb. 14",27,35,,Benson (Arthur C.),The Schoolmaster. Pop. edit.,Cr. 8vo.,"pp. 182, is. net",MURRAY,Feb. 14
"Benson (Arthur C)-Where no fear was : a book about fear. 8vo. 87 x 5}, pp. 246, 6s. net SMITH, E., Apr. 14",27,35,,Benson (Arthur C),Where no fear was : a book about fear.,8vo.,"87 x 5}, pp. 246, 6s. net","SMITH, E.",Apr. 14
"Benson (C. E.)-British mountaineering. 2nd edit., rev. and enlarged. Cr. 8vo. 71 X43, pp. 238, is. ROUTLEDGE, July 14",27,35,,Benson (C. E.),"British mountaineering. 2nd edit., rev. and enlarged.",Cr. 8vo.,"71 X43, pp. 238, is.",ROUTLEDGE,July 14
"Benson (E. F.)- Sheaves. 8vo. swd. 6d. HODDER & S., June 14",27,35,,Benson (E. F.),Sheaves.,8vo.,swd. 6d.,HODDER & S.,June 14
"Benson (E. F.)- The Room in the tower, and other stories. 12mo., pp. 296, is. net MILLS & B., Mar. 14",27,35,,Benson (E. F.),"The Room in the tower, and other stories.",12mo.,"pp. 296, is. net",MILLS & B.,Mar. 14
"Benson (E. F.)--The Image in the sand. 8vo., swd., 6d.... HODDER & S., Mar. 14",27,35,,Benson (E. F.),The Image in the sand.,"8vo.,","swd., 6d....",HODDER & S.,Mar. 14
"Benson (E. F.)-A Reaping. 12mo., pp. 380, is.. net .NELSON, Nov. 14",27,35,,Benson (E. F.),A Reaping.,12mo.,"pp. 380, is.. net .",NELSON,Nov. 14
"Benson (E. F.)-Arundel. Cr. 8vo. 71 X4+, pp. 382, 6s...... UNWIN, Dec. 14",27,35,,Benson (E. F.),Arundel.,Cr. 8vo.,"71 X4+, pp. 382, 6s......",UNWIN,Dec. 14
"Benson (E. F.)-Daisy's aunt. 8vo. Swd. 6d. PEARSON, Feb. 14",27,35,,Benson (E. F.),Daisy's aunt.,8vo.,Swd. 6d.,PEARSON,Feb. 14
"Benson (E. F.)-Dodo the second. Cr. 8vo. 78X5, pp. 318, 6s. .. HODDER & S., Apr. 14",27,35,,Benson (E. F.),Dodo the second.,Cr. 8vo.,"78X5, pp. 318, 6s. ..",HODDER & S.,Apr. 14
"Benson (E. F.)-Dodo: a detail of the day. Immo., 7d. net . METHUEN, Feb. 14",27,35,,Benson (E. F.),Dodo: a detail of the day.,Immo.,7d. net .,METHUEN,Feb. 14
"Benson (E. F.)-The Luck of the Vails. I 2mo. 70. net .NELSON, Dec. 14",27,35,,Benson (E. F.),The Luck of the Vails.,I 2mo.,70. net .,NELSON,Dec. 14
"Benson (E. F.)-The Relentless city. 8vo., swd., 6d. ... HODDER & S., Apr. 14",27,35,,Benson (E. F.),The Relentless city.,"8vo.,","swd., 6d. ...",HODDER & S.,Apr. 14
