original_entry,page_num,doc_page_num,opening_bits,author(s),title,format,little_bits,publisher,date
"Burgess (Gelett)-Burgess unabridged : a new dictionary of words you have always needed. Cr. 8vo. 7* 4, pp. 144, bds., 35. 6d. net SIMPKIN, Oct. 14",46,54,,Burgess (Gelett),Burgess unabridged : a new dictionary of words you have always needed.,Cr. 8vo.,"7* 4, pp. 144, bds., 35. 6d. net",SIMPKIN,Oct. 14
"Burgess (Mildred M.)-Health. With original illus. by Eleanor M. Cartwright. Cr. 8vo., pp. 184, swd. Is. 6d. net H. K. LEWIS, Feb. 14",46,54,,Burgess (Mildred M.),Health. With original illus. by Eleanor M. Cartwright.,Cr. 8vo.,"pp. 184, swd. Is. 6d. net",H. K. LEWIS,Feb. 14
"Burghard (F. F.) ed.-System of operative surgery. New edit. in 5 vols. Vols. 1, 2, and 3, ea. 218. net ; Vol. 4, 245. net ; Vol. 5, 18s. net ; per set, 845. net. Ryl. 8vo. (Oxford medical publications) . MILFORD, Sep. 14",46,54,,Burghard (F. F.) ed.,"System of operative surgery. New edit. in 5 vols. Vols. 1, 2, and 3, ea. 218. net ; Vol. 4, 245. net ; Vol. 5, 18s. net ; per set, 845. net.",Ryl. 8vo.,(Oxford medical publications) .,MILFORD,Sep. 14
"Burghs (Areas and Rates) (Scotland)-Return showing for 1911-12 with respect to each Royal, Parliamentary, and Police burgh in Scotland, the area of the burgh and of the agricultural lands, etc., and the total amount of Rates collected, id. .... WYMAN, Apr. 14",46,54,,,"Burghs (Areas and Rates) (Scotland)-Return showing for 1911-12 with respect to each Royal, Parliamentary, and Police burgh in Scotland, the area of the burgh and of the agricultural lands, etc., and the total amount of Rates collected, id.",,,WYMAN,Apr. 14
"Burgin (G. B.) Old man's marriage. 8vo., swd., 6d. ....HODDER & S., June 14",46,54,,Burgin (G. B.),Old man's marriage.,"8vo.,","swd., 6d. ....",HODDER & S.,June 14
"Burgin (G. B.)- The Duke's twins. Cr. 8vo. 8 x5, pp. 346, 6s. HUTCHINSON, Oct. 14",46,54,,Burgin (G. B.),The Duke's twins.,Cr. 8vo.,"8 x5, pp. 346, 6s.",HUTCHINSON,Oct. 14
"Burgin (G. B.)- Varick's legacy. 8vo., swd., 60. HUTCHINSON, June 14",46,54,,Burgin (G. B.),Varick's legacy.,"8vo.,","swd., 60.",HUTCHINSON,June 14
"Burgin (G. B.)-The Cattle man. 8vo. swd. 6.1. HODDER & S., Apr. 14",46,54,,Burgin (G. B.),The Cattle man.,8vo. swd.,6.1.,HODDER & S.,Apr. 14
"Burgin (G. B.)-Within the gates. Cr. 8vo. 74 X5, HUTCHINSON, Feb. 14",46,54,,Burgin (G. B.),Within the gates.,Cr. 8vo.,"74 X5,",HUTCHINSON,Feb. 14
"Burgin (G. B.)—Dickie Dilver. 8vo. swd. 6d. HUTCHINSON, Apr. 14",46,54,,Burgin (G. B.),Dickie Dilver.,8vo.,swd. 6d.,HUTCHINSON,Apr. 14
"Burgin (G. B.)—The Belie of Santiago. 8vo. swd. 6d. ...HUTCHINSON, Feb. 14",46,54,,Burgin (G. B.),The Belie of Santiago.,8vo. swd.,6d. ,HUTCHINSON,Feb. 14
"Burgin (G. B.)—The King of Four Corners. 12mo. 7d. net ...HUTCHINSOX, June 14",46,54,,Burgin (G. B.),The King of Four Corners.,12mo.,7d. net,HUTCHINSOX,June 14
"Burke (Arthur Meredyth)-Memorials of St. Margaret's Church, Westminster : comprising the Parish registers 1539-1660, and the Church- wardens' accounts, 1460-1603. 26 parts. Imp. 8vo. 114 X8}, pp. 846, 425, net EYRE & SPOTTISWOODE, May 14",46,54,,Burke (Arthur Meredyth),"Memorials of St. Margaret's Church, Westminster : comprising the Parish registers 1539-1660, and the Church- wardens' accounts, 1460-1603.",Imp. 8vo.,"26 parts. 114 X8}, pp. 846, 425, net",EYRE & SPOTTISWOODE,May 14
"Burke (Edmund)--A Cluster of shamrocks. Cr. 8vo. 71 X44, pp. 320, 25. net LYNWOOD, Mar. 14",46,54,,Burke (Edmund),A Cluster of shamrocks.,Cr. 8vo.,"71 X44, pp. 320, 25. net",LYNWOOD,Mar. 14
"Burke (Sir Bernard, and Ashworth P.)-A Genea- logical and heraldic history of the peerage and baronetage, the Privy Council, knightage and companionage, 1914. Ryl. 8vo., 42s. net HARRISON & SONS, Dec. 13",46,54,,"Burke (Sir Bernard, and Ashworth P.)","A Genea- logical and heraldic history of the peerage and baronetage, the Privy Council, knightage and companionage, 1914.",Ryl. 8vo.,42s. net,HARRISON & SONS,Dec. 13
"Burke (Sir Bernard)---A Genealogical and heraldic history of the landed gentry of Great Britain, 1914. Imp. 8vo., 528, 6d. net HARRISON & SONS, Sep. 14",46,54,,Burke (Sir Bernard),"A Genealogical and heraldic history of the landed gentry of Great Britain, 1914.",Imp. 8vo.,"528, 6d. net",HARRISON & SONS,Sep. 14
"Burke (Thomas)—The Contented mind : anthology of optimism. Cheaper edit. Cr. 8vo. 7* X 41, pp. 168, 25. 6d. net TRUSLOVE & HANSON, Oct. 14",46,54,,Burke (Thomas),The Contented mind : anthology of optimism. Cheaper edit.,Cr. 8vo.,"7* X 41, pp. 168, 25. 6d. net",TRUSLOVE & HANSON,Oct. 14
"Burkett (C. W.) sce Hunt (T. F.) and Burkett. Burkhardt (H.)—Theory of functions of a complex variable. 8vo., 125. 6d. net D. C. HEATH, Feb. 14",46,54,Burkett (C. W.) sce Hunt (T. F.) and Burkett. ,Burkhardt (H.),Theory of functions of a complex variable.,8vo.,125. 6d. net,D. C. HEATH,Feb. 14
"Burkitt (F. Crawford)- Jewish and Christian Apocalypses. Ryl. 8vo., pp. 90, (British Academy) MILFORD, June 14",46,54,,Burkitt (F. Crawford),Jewish and Christian Apocalypses.,Ryl. 8vo.,"pp. 90, (British Academy)",MILFORD,June 14
"Burlingham (Frederick)—How to become an Alpinist. Illus. Cr. 8vo. 7*X5}, pp. 230, 6s. net ..T. W. LAURIE, Mar. 14",46,54,,Burlingham (Frederick),How to become an Alpinist. Illus.,Cr. 8vo.,"7*X5}, pp. 230, 6s. net ..",T. W. LAURIE,Mar. 14
"Burn (Joseph) — Vital statistics explained : some practical suggestions. 8vo. 9 X54, pp. 150, 4s, net CONSTABLE, Nov. 14",46,54,,Burn (Joseph),Vital statistics explained : some practical suggestions.,8vo.,"9 X54, pp. 150, 4s, net",CONSTABLE,Nov. 14
"Burnand (Sir Francis C.)-Happy thoughts. New edit. 12mo. 7 X4), pp. 256, 25. 6d. net BRADBURY, AGNEW, May 14",46,54,,Burnand (Sir Francis C.),Happy thoughts. New edit.,12mo.,"7 X4), pp. 256, 25. 6d. net","BRADBURY, AGNEW",May 14
"Burnet (John)-Greek philosophy. Part 1, Thales to Plato. 8vo. 84x54, pp. 370, ios. net MACMILLAN, June 14",46,54,,Burnet (John),"Greek philosophy. Part 1, Thales to Plato.",8vo.,"84x54, pp. 370, ios. net",MACMILLAN,June 14
"Burnett (Frances Hodgson!—The Shuttle. Pop. edit. Cr. 8vo. 71 X5, pp. 450, 25. net HEINEMANN, July 14",46,54,,Burnett (Frances Hodgson!),The Shuttle. Pop. edit.,Cr. 8vo.,"71 X5, pp. 450, 25. net",HEINEMANN,July 14
"Burnett (Frances Hodgson)- Little Saint Eliza- beth, and other stories. New edit. 8vo. gilt, .. WARNE, Feb. 14",46,54,,Burnett (Frances Hodgson),"Little Saint Eliza- beth, and other stories. New edit.",8vo.,"gilt, ..",WARNE,Feb. 14
"Burnett (Lawson)— The Heart of Jesus : a study of the perfect man through illustrative ex- amples of the Christlike in human character. Cr. 8vo. 71 X5, PP. 316, 38. 6d. net STOCKWELL, Mar. 14",46,54,,Burnett (Lawson),The Heart of Jesus : a study of the perfect man through illustrative ex- amples of the Christlike in human character.,Cr. 8vo.,"71 X5, PP. 316, 38. 6d. net",STOCKWELL,Mar. 14
"Burnham (Clara Louise) —The Right track. Cr. 8vo. 8 X5, pp. 428, 6s. .... CONSTABLE, Oct. 14",46,54,,Burnham (Clara Louise),The Right track.,Cr. 8vo.,"8 X5, pp. 428, 6s. ....",CONSTABLE,Oct. 14
"Burnham (Clara Louise)— The Golden dog. 16mo. pp. 80, is. net .GAY & H., Nov. 14",46,54,,Burnham (Clara Louise),The Golden dog.,16mo.,"pp. 80, is. net .",GAY & H.,Nov. 14
"Burnham (Hampden)-Jack Ralston: a tale of life in the far North East of Canada. Cr. 8vo. 77X5, pp. 448, 28. 6d... .NELSON, Oct. 14",46,54,,Burnham (Hampden),Jack Ralston: a tale of life in the far North East of Canada.,Cr. 8vo.,"77X5, pp. 448, 28. 6d...",NELSON,Oct. 14
"Burniston (Asa) ---A Common-sense algebra : an elementary course. With answers. Cr. 8vo. 71 X5, pp. 176, 25..... HEINEMANN, Feb. 14",46,54,,Burniston (Asa),A Common-sense algebra : an elementary course. With answers.,Cr. 8vo.,"71 X5, pp. 176, 25.....",HEINEMANN,Feb. 14
"Burns (Daniel) — Electrical practice in collieries. 4th edit., rev. and enlarged. Cr. 8vo. 78 X5, pp. 364, 78. 6d. net ....C. GRIFFIN, June 14",46,54,,Burns (Daniel),"Electrical practice in collieries. 4th edit., rev. and enlarged.",Cr. 8vo.,"78 X5, pp. 364, 78. 6d. net ....",C. GRIFFIN,June 14
"Burns (James) ---Laws of the upward life: ad- dresses to men. Cr. 8vo. 78 X 5, PP. 192, 25. 6d. net ...R. SCOTT, Nov. 14",46,54,,Burns (James),Laws of the upward life: ad- dresses to men.,Cr. 8vo.,"78 X 5, PP. 192, 25. 6d. net ...",R. SCOTT,Nov. 14
"Burns (James) —The Happy warrior : an interpre- tation of G. F. Watts's picture. 16mo. parch- ment, is. net .......J. CLARKE, Dec. 14",46,54,,Burns (James),The Happy warrior : an interpre- tation of G. F. Watts's picture.,16mo.,"parch- ment, is. net .......",J. CLARKE,Dec. 14
"Burns (Robert)—Poems and songs. 2 vols. Illus. 8vo. 91 X6), pp. 694, 155. net FOULIS, Nov. 14",46,54,,Burns (Robert),Poems and songs.,8vo.,"2 vols. Illus. 91 X6), pp. 694, 155. net",FOULIS,Nov. 14
"Burr (A. R.)--Religious confessions and con- fessants. 8vo. Ios. 6d. net CONSTABLE, July 14",47,55,,Burr (A. R.),Religious confessions and con- fessants.,8vo.,Ios. 6d. net,CONSTABLE,July 14
"Burr (W. H.)-Suspension bridges, arch ribs, and cantilevers. 8vo., 198. net CHAPMAN & H., Jan. 14",47,55,,Burr (W. H.),"Suspension bridges, arch ribs, and cantilevers.",8vo.,198. net,CHAPMAN & H.,Jan. 14
"Burrage (Champlin) - Nazareth and the begin- nings of Christianity: a new view based upon philological evidence. 8vo., pp. 68, 3s. 6d. net MILFORD, Mar. 14",47,55,,Burrage (Champlin),Nazareth and the begin- nings of Christianity: a new view based upon philological evidence.,8vo.,"pp. 68, 3s. 6d. net",MILFORD,Mar. 14
"Burrell (G.) and Seibert (F. M.)—The Sampling and examination of mine gases and natural gas. (U.S. Bur. of Mines.) Illus. 8vo. 9 X6, pp. 116, swd. 28. 6d. net WESLEY June 14",47,55,,Burrell (G.) and Seibert (F. M.),The Sampling and examination of mine gases and natural gas. (U.S. Bur. of Mines.) Illus.,8vo.,"9 X6, pp. 116, swd. 28. 6d. net",WESLEY,June 14
"Burroughs (E. A.)-Progressive meanings of spiritual life: a sermon preached in Southwark Cathedral. 8vo. swd. 3d. net B. H. BLACKWELL, July 14",47,55,,Burroughs (E. A.),Progressive meanings of spiritual life: a sermon preached in Southwark Cathedral.,8vo. swd.,3d. net,B. H. BLACKWELL,July 14
"Burrows (H. L.)—The Story of English industry and trade : a reader for the upper classes of primary schools, &c. Cr. 8vo. 71 X 48, pp. 227, IS. 6d. .BLACK, Dec. 14",47,55,,Burrows (H. L.),"The Story of English industry and trade : a reader for the upper classes of primary schools, &c.",Cr. 8vo.,"71 X 48, pp. 227, IS. 6d. .",BLACK,Dec. 14
"Burrows (R.)—The Law of income tax relating to business profits. 8vo. 58. net SWEET & M., Oct. 14",47,55,,Burrows (R.),The Law of income tax relating to business profits.,8vo.,58. net,SWEET & M.,Oct. 14
"Burt-Davy (Joseph)-Maize : its history, cultiva- tion, handling and uses. With special reference to South Africa. Illus. 8vo. 9 X6, pp. 872, 255. net.. .LONGMANS, Jan, 14",47,55,,Burt-Davy (Joseph),"Maize : its history, cultiva- tion, handling and uses. With special reference to South Africa. Illus.",8vo.,"9 X6, pp. 872, 255. net.. .",LONGMANS,"Jan, 14"
"Burton (A. H. G.)—The Tuberculosis handbook for health visitors and nurses. Illus. Cr. 8vo. 77 x 4, pp. 66, 28. 6d. net SCIENTIFIC PRESS, Aug. 14",47,55,,Burton (A. H. G.),The Tuberculosis handbook for health visitors and nurses. Illus.,Cr. 8vo.,"77 x 4, pp. 66, 28. 6d. net",SCIENTIFIC PRESS,Aug. 14
"Burton (Edwin H.) and Pollen (J. H.) eds.- Lives of the English Martyrs. Second series. The Martyrs declared Venerable. Vol. 1, 1583-1588. Cr. 8vo., 7s. 6d. net LONGMANS, Jan. 14",47,55,,Burton (Edwin H.) and Pollen (J. H.) eds.,"Lives of the English Martyrs. Second series. The Martyrs declared Venerable. Vol. 1, 1583-1588.",Cr. 8vo.,7s. 6d. net,LONGMANS,Jan. 14
"Burton (H. Bindon)-Eolsyné and other poems. Gr. 8vo. 81 X54, pp. 152, 5s. net MAUNSEL, Mar. 14",47,55,,Burton (H. Bindon),Eolsyné and other poems.,Gr. 8vo.,"81 X54, pp. 152, 5s. net",MAUNSEL,Mar. 14
"Burton (J. W.)—The Call of the Pacific. Cr. 8vo., iod. net (Every age library)C. H. KELLY, Mar. 14",47,55,,Burton (J. W.),The Call of the Pacific.,Cr. 8vo.,iod. net (Every age library),C. H. KELLY,Mar. 14
"Burton (Margaret E.)— The Education of women in Japan. Illus. 8vo. 8} <5), pp. 268, 35. 6d. net REVELL, Sep. 14",47,55,,Burton (Margaret E.),The Education of women in Japan. Illus.,8vo.,"8} <5), pp. 268, 35. 6d. net",REVELL,Sep. 14
"Burton (R. G.)-Napoleon's invasion of Russia. Cr. 8vo. 73 X5, pp. 246, 5s. net. (Special cam- paign ser.) G. ALLEN, May 14",47,55,,Burton (R. G.),Napoleon's invasion of Russia.,Cr. 8vo.,"73 X5, pp. 246, 5s. net. (Special cam- paign ser.)",G. ALLEN,May 14
"Burton (Richard)—How to see a play. Cr. 8vo. 58. 6d. net MACMILLAN, Dec. 14",47,55,,Burton (Richard),How to see a play.,Cr. 8vo.,58. 6d. net,MACMILLAN,Dec. 14
"Burton (Sir Richard F.)-The Kasidah of Haji Abdû el Yezdi : a lay of the higher law. 8vo., parchment, 5s, net HUTCHINSON, Dec. 14",47,55,,Burton (Sir Richard F.),The Kasidah of Haji Abdû el Yezdi : a lay of the higher law.,8vo.,"parchment, 5s, net",HUTCHINSON,Dec. 14
"Busck (August)-New genera and species of microlepidoptera from Panama (U.S. Nat. Mus.) 8vo. 91 x64, pp. 67, swd. 35. 6d. net WESLEY, Sep. 14",47,55,,Busck (August),New genera and species of microlepidoptera from Panama (U.S. Nat. Mus.),8vo.,"91 x64, pp. 67, swd. 35. 6d. net",WESLEY,Sep. 14
"Bushnell (A. J. de Havilland)-Storied windows : a traveller's introduction to the study of old church glass, from the 12th century to the renaissance, especially in France. Illus. 8vo. 9 x5, pp. 370, 155. net W. BLACKWOOD, May 14",47,55,,Bushnell (A. J. de Havilland),"Storied windows : a traveller's introduction to the study of old church glass, from the 12th century to the renaissance, especially in France. Illus.",8vo.,"9 x5, pp. 370, 155. net",W. BLACKWOOD,May 14
"Business, What you want to know in, Ouseley (J.) is, net. ",ADDED,ADDED,"Business, What you want to know in,",Ouseley (J.),,,"is, net.",,
"Buster Brown at home, Outcault (R. F.) 35. 6d. net",ADDED,ADDED,,Outcault (R. F.),"Buster Brown at home,",,35. 6d. net,,
"Buster Brown's funny tricks. Oblong 4to bds. 38. 6d. net ... DEAN, July 14",47,55,,,Buster Brown's funny tricks.,Oblong 4to bds.,38. 6d. net ...,DEAN,July 14
"Busy bunny book (The) 4to. is. NELSON, Oct. 14",47,55,,,Busy bunny book (The),4to.,is.,NELSON,Oct. 14
"Butler (A. J.)-Babylon of Egypt: a study in the history of old Cairo. 8vo., pp. 64, 4s. 6d. net (Clarendon Press) MILFORD, Mar. 14",47,55,,Butler (A. J.),Babylon of Egypt: a study in the history of old Cairo.,8vo.,"pp. 64, 4s. 6d. net (Clarendon Press)",MILFORD,Mar. 14
"Butler (Edward)-Oil fuel : its supply, compo- sition, and application. 3rd edit., greatly enlarged. Cr. 8vo. 8 X5, pp. 342, 75. 6d. net GRIFFIN, June 14",47,55,,Butler (Edward),"Oil fuel : its supply, compo- sition, and application. 3rd edit., greatly enlarged.",Cr. 8vo.,"8 X5, pp. 342, 75. 6d. net",GRIFFIN,June 14
"Butler (Ellis Parker)"" Pigs is pigs.” Re-issue. Cr. 8vo., PP. 65, is, net HODDER & S., Mar. 14",47,55,,Butler (Ellis Parker),""" Pigs is pigs.” Re-issue.",Cr. 8vo.,"PP. 65, is, net",HODDER & S.,Mar. 14
"Butler (Frederick W.)- Personality and revela- tion: a statement of the grounds of Christian certainty. Cr. 8vo. 73 X4*, pp. 96, 28. net HEFFER, Apr. 14",47,55,,Butler (Frederick W.),Personality and revela- tion: a statement of the grounds of Christian certainty.,Cr. 8vo.,"73 X4*, pp. 96, 28. net",HEFFER,Apr. 14
"Butler (Geoffrey G.)-The Tory tradition : Bolingbroke- Burke-Disraeli-Salisbury. Cr. 8vo. 74 x5, pp. 158, 35. 6d. net MURRAY. Nov. 14",47,55,,Butler (Geoffrey G.),The Tory tradition : Bolingbroke- Burke-Disraeli-Salisbury.,Cr. 8vo.,"74 x5, pp. 158, 35. 6d. net",MURRAY.,Nov. 14
"Butler (Henry Montagu)- Some leisure hours of a long life : translations into Greek, Latin, and English verse from 1850 to 1914. Cr. 8vo. 71 x5, pp. 610, 7s. 6d. net Bowes & B., June 14",47,55,,Butler (Henry Montagu),"Some leisure hours of a long life : translations into Greek, Latin, and English verse from 1850 to 1914.",Cr. 8vo.,"71 x5, pp. 610, 7s. 6d. net",Bowes & B.,June 14
"Butler (Henry Montagu)—“Lift up your hearts or, Words of good cheer for the Holy Com- munion. 2nd edit., enlarged. 12mo. 6+ x4, pp. 170, 28. net .... BOWES & BOWES, NCV. 14",47,55,,Butler (Henry Montagu),"""Lift up your hearts or, Words of good cheer for the Holy Com- munion. 2nd edit., enlarged.",12mo.,"6+ x4, pp. 170, 28. net ....",BOWES & BOWES,NCV. 14
"Butler (J. R. M.)—The Passing of the great Reform Bill. Illus. 8vo. 9£ 5, pp. 468, I2s. 6d. net ..LONGMANS, May 14",47,55,,Butler (J. R. M.),The Passing of the great Reform Bill. Illus.,8vo.,"9£ 5, pp. 468, I2s. 6d. net ..",LONGMANS,May 14
