original_entry,page_num,doc_page_num,opening_bits,author(s),title,format,little_bits,publisher,date
"Cleveland (Duchess of)-The Life and letters of Lady Hester Stanhope. Illus. 8vo. 9X53, pp. 478, 155, net.... .MURRAY, Feb. 14",63,71,,Cleveland (Duchess of),The Life and letters of Lady Hester Stanhope. Illus.,8vo.,"9X53, pp. 478, 155, net.... .",MURRAY,Feb. 14
"Cleveland (John)-Hustler Paul. Cr. 8vo. 71 X 5, pp. 408, 6s. .SIDGWICK & J., June 14",63,71,,Cleveland (John),Hustler Paul.,Cr. 8vo.,"71 X 5, pp. 408, 6s. .",SIDGWICK & J.,June 14
"Clewell (C. E.)--Laboratory manual, direct and alternating current. 8vo. 45. 6d. net CHAPMAN & H., Feb. 14",63,71,,Clewell (C. E.),"Laboratory manual, direct and alternating current.",8vo.,45. 6d. net,CHAPMAN & H.,Feb. 14
"Clibborn (Arthur Sydney Booth-) See Booth- Clibborn. Clierens (F1.)-A Plain tale from Malines, Aug. 1914. Trans. by R. W. B. Pugh, illus. 8vo. pp. 48, swd, is. net..B. H. BLACKWELL, Dec. 14",63,71,Clibborn (Arthur Sydney Booth-) See Booth- Clibborn. ,Clierens (F1.),"A Plain tale from Malines, Aug. 1914. Trans. by R. W. B. Pugh, illus.",8vo.,"pp. 48, swd, is. net..",B. H. BLACKWELL,Dec. 14
"Clifford (John)— Temperance reform and the ideal state: a lecture. 8vo. swd. 4d. MACMILLAN, Jan. 14",63,71,,Clifford (John),Temperance reform and the ideal state: a lecture.,8vo.,swd. 4d.,MACMILLAN,Jan. 14
"Clifford (Mrs. W. K.)-A Wild proxy. 12mo., 7d. net .NEWNES, Mar, 14",63,71,,Clifford (Mrs. W. K.),A Wild proxy.,12mo.,7d. net .,NEWNES,"Mar, 14"
"Clifton (Edward J.)--Bible illustrations from Persia of to-day. 8vo. 82X51, pp. 160, 35. 6d. MARSHALL BROS. Oct. 14",63,71,,Clifton (Edward J.),Bible illustrations from Persia of to-day.,8vo.,"82X51, pp. 160, 35. 6d.",MARSHALL BROS.,Oct. 14
"Clock almanack (The), 1915. Cr. 8vo., swd., 3d. W. NICHOLSON, Oct. 14",63,71,,,"Clock almanack (The), 1915.",Cr. 8vo.,"swd., 3d.",W. NICHOLSON,Oct. 14
"Clodd (Edward)—The Childhood of the World: a simple account of man's origin and early history. New edit., re-written and enlarged. Cr. 8vo. 71 X5, pp. 254, 4s. 6d. net MACMILLAN, May 14",63,71,,Clodd (Edward),"The Childhood of the World: a simple account of man's origin and early history. New edit., re-written and enlarged.",Cr. 8vo.,"71 X5, pp. 254, 4s. 6d. net",MACMILLAN,May 14
"Clough (J. E.)—Social christianity in the Orient. Cr. 8vo., 6s. 6d. net ..MACMILLAN, Nov. 14",64,72,,Clough (J. E.),Social christianity in the Orient.,Cr. 8vo.,6s. 6d. net ..,MACMILLAN,Nov. 14
"Clowes (Frank) and Coleman (T. B.)-Elementary practical chemistry. Part 2, Analytical chemis- try : qualitative and quantitative. 7th edit. Cr. 8vo. 71 x 41, pp. 258, 35. 6d. net CHURCHILL, May 14",64,72,,Clowes (Frank) and Coleman (T. B.),"Elementary practical chemistry. Part 2, Analytical chemis- try : qualitative and quantitative. 7th edit.",Cr. 8vo.,"71 x 41, pp. 258, 35. 6d. net",CHURCHILL,May 14
"Clowes (Tirank) and Coleman (J.B.)Quantitative analysis. 10th edit. 8vo. 9X51, pp. 612, TOS. 60. net CIRCHILL, Feb. 14",64,72,,Clowes (Tirank) and Coleman (J.B.),Quantitative analysis. 10th edit.,8vo.,"9X51, pp. 612, TOS. 60. net",CIRCHILL,Feb. 14
"Cluster of grapes (A): a book of twentieth century poetry. Cr. 8vo. 71 X5, pp. 120, 35. 6d, net. ...E. MACDONALD, May 14",64,72,,,Cluster of grapes (A): a book of twentieth century poetry.,Cr. 8vo.,"71 X5, pp. 120, 35. 6d, net. ...",E. MACDONALD,May 14
"Clutton-Brock (A.) - Thoughts on the War. From the Times Literary Supplement. 12mo., PP. 94, swd. Is. net ... METHUEN, Nov. 14",64,72,,Clutton-Brock (A.),Thoughts on the War. From the Times Literary Supplement.,12mo.,"PP. 94, swd. Is. net ...",METHUEN,Nov. 14
"Clutton-Brock (A.)-William Morris : his work and Influence. 12mo., pp. 256, IS, net (Home univ. library) WILLIAMS & N., May 14",64,72,,Clutton-Brock (A.),William Morris : his work and Influence.,12mo.,"pp. 256, IS, net (Home univ. library)",WILLIAMS & N.,May 14
"Co wan (John)-Diseases of the heart. 8vo. 9X51, pp. 458, 155. net..E. ARNOLD, Jan, 14",71,79,,Co wan (John),Diseases of the heart.,8vo.,"9X51, pp. 458, 155. net.",E. ARNOLD,"Jan, 14"
"Co ward (Henry)-Choral technique and interpre- tation. 8vo. 81x5), pp. 333, 6s. (Handbks. for musicians) NOVELLO, Jan, 14",71,79,,Co ward (Henry),Choral technique and interpre- tation.,8vo.,"81x5), pp. 333, 6s. (Handbks. for musicians)",NOVELLO,"Jan, 14"
"Co wen (Lawrence)—The World, the flesh, and the devil. Pop. edit. Cr. 8vo., pp. 224, swd., IS. net..... ... EVERETT, May 14",71,79,,Co wen (Lawrence),"The World, the flesh, and the devil. Pop. edit.",Cr. 8vo.,"pp. 224, swd., IS. net..... ...",EVERETT,May 14
"Co wley (Abraham)-Essays and selected verse. Cr. 8vo., pp. 308, is. net. (Scott library) W. SCOTT, Dec. 14",71,79,,Co wley (Abraham),Essays and selected verse.,Cr. 8vo.,"pp. 308, is. net. (Scott library)",W. SCOTT,Dec. 14
"Co wling (G. H.)-A Yorkshire tyke : rustic tunes, mainly in the Doric mode. 18mo. 2. 6d. net swd. Is. 6d. net ..RICHARDS, Feb. 14",71,79,,Co wling (G. H.),"A Yorkshire tyke : rustic tunes, mainly in the Doric mode.",18mo.,2. 6d. net swd. Is. 6d. net,RICHARDS,Feb. 14
"Coal mines—Spontaneous combustion of coal in Mines-(Departmental Committee on) First report, 14d. ; Minutes of Evidence, 31st July to 13th August, 1913, 7d.... .WYMAN, Jan. 14",64,72,,,"Coal mines—Spontaneous combustion of coal in Mines-(Departmental Committee on) First report, 14d. ; Minutes of Evidence, 31st July to 13th August, 1913, 7d....",,,WYMAN,Jan. 14
"Coal shipments— Tables for each quarter of 1912–13, 6d... . WYMAN, July 14",64,72,,,"Coal shipments— Tables for each quarter of 1912–13,",,6d...,WYMAN,July 14
"Coal tables, 1912 : statistical tables relating to production, consumption, &c., in the British Empire and principal foreign countries. 5 d. WYMAN, Mar. 14",64,72,,,"Coal tables, 1912 : statistical tables relating to production, consumption, &c., in the British Empire and principal foreign countries.",,5 d.,WYMAN,Mar. 14
"Coats (R. H.)--The Christian life. 18mo., swd., 6d. net .....T. & T. CLARK, Sep. 14",64,72,,Coats (R. H.),The Christian life.,18mo.,"swd., 6d. net .....",T. & T. CLARK,Sep. 14
"Coats (R. H.)— Travellers' tales of Scotland. Cr. 8vo. 8 X5, pp. 276, 28. 6d. net A. GARDNER, Mar. 14",64,72,,Coats (R. H.),Travellers' tales of Scotland.,Cr. 8vo.,"8 X5, pp. 276, 28. 6d. net",A. GARDNER,Mar. 14
"Cobb (Thomas)-Andrew and his wife. Cr. 8vo. 7+ x44, pp. 320, 6s. MILLS & B., July 14",64,72,,Cobb (Thomas),Andrew and his wife.,Cr. 8vo.,"7+ x44, pp. 320, 6s.",MILLS & B.,July 14
"Cobb (Thomas)-Lady Sylvia's impostor. Cr. 8vo. 74 X 5, pp. 316, 6s.........MILLS & B., Jan. 14",64,72,,Cobb (Thomas),Lady Sylvia's impostor.,Cr. 8vo.,"74 X 5, pp. 316, 6s.........",MILLS & B.,Jan. 14
"Cobb (W. F.)-Mysticism and the creed. 8vo. 9X54, pp. 592, Ios. 6d. net MACMILLAN, May 14",64,72,,Cobb (W. F.),Mysticism and the creed.,8vo.,"9X54, pp. 592, Ios. 6d. net",MACMILLAN,May 14
"Cobb (W.F.)-Spiritual healing. Cr. 8vo.7"" X 41, pp.'324, 5s. net ... BELL, Oct. 14",64,72,,Cobb (W.F.),Spiritual healing.,Cr. 8vo.,"7"" X 41, pp.'324, 5s. net ...",BELL,Oct. 14
"Cobban (J. Maclaren)-Her Royal Highness's love affair. 8vo. Swd. 6d. ....PEARSONS, July 14",64,72,,Cobban (J. Maclaren),Her Royal Highness's love affair.,8vo.,Swd. 6d. ....,PEARSONS,July 14
"Cobbett (William)--Rural rides in England, during the years 1821-1826. 2 vols. Cr. 8vo., ea. rod. net. (“* Every age” library) C. H. KELLY, Mar. 14",64,72,,Cobbett (William),"Rural rides in England, during the years 1821-1826. 2 vols.",Cr. 8vo.,ea. rod. net. (“* Every age” library),C. H. KELLY,Mar. 14
"Cobbett (William)-Rural rides. 12mo. 6d. net NELSON, Apr. 14",64,72,,Cobbett (William),Rural rides.,12mo.,6d. net,NELSON,Apr. 14
"Cobden (Ellen Melicent)-Sylvia Saxon : episodes in a life. Cr. 8vo. 72x41, rp. 350, 6s. UNUIN, July 14",64,72,,Cobden (Ellen Melicent),Sylvia Saxon : episodes in a life.,Cr. 8vo.,"72x41, rp. 350, 6s.",UNUIN,July 14
"Cobleigh (Uncle Tom)-Down in Devon : humor- ous tales. Cr. 8vo. 74 x 44, pp. 256, 35. 6d. net HEATII, CRANTON, Jan. 14",64,72,,Cobleigh (Uncle Tom),Down in Devon : humor- ous tales.,Cr. 8vo.,"74 x 44, pp. 256, 35. 6d. net","HEATII, CRANTON",Jan. 14
"Cockburn (Henry) --The Tresleys. Cr. 8vo. 71 X4, pp. 320, 6s. .A. MELROSE, Feb. 14",64,72,,Cockburn (Henry),The Tresleys.,Cr. 8vo.,"71 X4, pp. 320, 6s. .",A. MELROSE,Feb. 14
"Cody (H. A.)-On trail and rapid by dog-sled and canoe : the story of Bishop Bompas's life amongst the Red Indians and Eskimo. Told for boys and girls. edit. Cr. 8vo. 8 X5, pp. 204, 28. 6d. SEELEY, Oct. 14",64,72,,Cody (H. A.),On trail and rapid by dog-sled and canoe : the story of Bishop Bompas's life amongst the Red Indians and Eskimo. Told for boys and girls. edit.,Cr. 8vo.,"8 X5, pp. 204, 28. 6d.",SEELEY,Oct. 14
"Cody (H. A.)The Chief of the ranges: a tale of Yukon. Cr. 8vo. 73 X5, pp. 314, 6s. HODDER & S., Mar. 14",64,72,,Cody (H. A.),The Chief of the ranges: a tale of Yukon.,Cr. 8vo.,"73 X5, pp. 314, 6s.",HODDER & S.,Mar. 14
"Coe (Fanny E.)--The Book of stories for the story-teller. Cr. 8vo. 7* X5, pp. 186, 28. 6d. net HARRAP, Apr. 14",64,72,,Coe (Fanny E.),The Book of stories for the story-teller.,Cr. 8vo.,"7* X5, pp. 186, 28. 6d. net",HARRAP,Apr. 14
"Coffey (Diarmidi-O'Neill and Ormond: a chapter in Irish history. 8vo. 8X54, pp. 262, 6s, net MAUNSEL, June 14",64,72,,Coffey (Diarmidi,O'Neill and Ormond: a chapter in Irish history.,8vo.,"8X54, pp. 262, 6s, net",MAUNSEL,June 14
"Coffey (George) — The Bronze age in Ireland Illus. 8vo. 103 x64, pp. 120, 6s. net, buckram ros. 6d. net HODGES, FIGGIS, Jan. 14",64,72,,Coffey (George),The Bronze age in Ireland Illus.,8vo.,"103 x64, pp. 120, 6s. net, buckram ros. 6d. net","HODGES, FIGGIS",Jan. 14
"Coffin (Henry Sloane)- University sermons. 8vo., pp. 266, 6s. 6d. net....MILFORD, May 14",64,72,,Coffin (Henry Sloane),University sermons.,8vo.,"pp. 266, 6s. 6d. net....",MILFORD,May 14
"Cohen (Israel) — Jewish life in modern times. Illus. 8vo. 9 X 5), pp. 384, IOS. 6d. net METHUEN, Oct. 14",64,72,,Cohen (Israel),Jewish life in modern times. Illus.,8vo.,"9 X 5), pp. 384, IOS. 6d. net",METHUEN,Oct. 14
"Cohn (Albert M.)-A Bibliographical catalogue of the printed works illustrated by George Cruik- shank. Ryl. 8vo. 155. net LONGMANS, Feb. 14",64,72,,Cohn (Albert M.),A Bibliographical catalogue of the printed works illustrated by George Cruik- shank.,Ryl. 8vo.,155. net,LONGMANS,Feb. 14
"Cohu (J. R.)- Vital problems. Imp. 16mo. 74x51, pp. 304, 55. net T. & T. CLARK, Feb. 14",64,72,,Cohu (J. R.),Vital problems.,Imp. 16mo.,"74x51, pp. 304, 55. net",T. & T. CLARK,Feb. 14
"Coit (Stanton) — The Soul of America : a con- structive essay in the sociology of religion. Cr. 8vo. 8 X 51, pp. 418, 8s. 6d. net MACMILLAN, July 14",64,72,,Coit (Stanton),The Soul of America : a con- structive essay in the sociology of religion.,Cr. 8vo.,"8 X 51, pp. 418, 8s. 6d. net",MACMILLAN,July 14
"Colchester (H. B.) ed.-Lay views : by six clergy. Cr. 8vo. 8 X5}, pp. 236. 35. 6d. net LONGMANS, May 14",64,72,,Colchester (H. B.) ed.,Lay views : by six clergy.,Cr. 8vo.,"8 X5}, pp. 236. 35. 6d. net",LONGMANS,May 14
"Colcord (Lincoln) — The Game of life and death : stories of the sea. Cr. 8vo. 7*X5, pp. 298, 6s. MACMILLAN, Nov. 14",64,72,,Colcord (Lincoln),The Game of life and death : stories of the sea.,Cr. 8vo.,"7*X5, pp. 298, 6s.",MACMILLAN,Nov. 14
"Cole (Arthur Charles)—The Whig Party in the South. Cr. 8vo., pp. 404, 6s. 6d. net MILFORD, Sep. 14",64,72,,Cole (Arthur Charles),The Whig Party in the South.,Cr. 8vo.,"pp. 404, 6s. 6d. net",MILFORD,Sep. 14
"Cole (Douglas)-New beginnings; and, The Record. Cr. 8vo. 8 X 5, PP 84, bds., 25. 6d, net B. H. BLACKWELL, Sep. 14",64,72,,Cole (Douglas),"New beginnings; and, The Record.",Cr. 8vo.,"8 X 5, PP 84, bds., 25. 6d, net",B. H. BLACKWELL,Sep. 14
"Cole (Grenville A. J.)-The Growth of Europe. 12mo., pp. 256, is, net (Home univ. library) WILLIAMS & N., May 14",65,73,,Cole (Grenville A. J.),The Growth of Europe.,12mo.,"pp. 256, is, net (Home univ. library)",WILLIAMS & N.,May 14
"Cole (Sophie) - Patience Tabernacle. Cr. 8vo. 78X5, pp. 318,6s. MILLS & B., July 14",65,73,,Cole (Sophie),Patience Tabernacle.,Cr. 8vo.,"78X5, pp. 318,6s.",MILLS & B.,July 14
"Cole (T. W.)-Quatrains. Ryl. 16mo., swd. 6d. net F. PALMER, Afr. 14",65,73,,Cole (T. W.),Quatrains.,"Ryl. 16mo.,",swd. 6d. net,F. PALMER,Afr. 14
"Cole man (T. E.)-Approximate estimates. 4th edit., rev. and enlarged. 12mo. 6} 3), pp. 424, ..SPON, May 14",65,73,,Cole man (T. E.),"Approximate estimates. 4th edit., rev. and enlarged.",12mo.,"6} 3), pp. 424, ..",SPON,May 14
"Colebrooke (Helen)-Fetters of the past. Cr. 8vo. 71 X5, pp. 348, 6s. ..MURRAY, Oct. 14",65,73,,Colebrooke (Helen),Fetters of the past.,Cr. 8vo.,"71 X5, pp. 348, 6s. ..",MURRAY,Oct. 14
"Coleman (F.)-Extraction of teeth. Illus. 2nd edit. Cr. 8vo. 71 x 44, pp. 186, 3s. 6d. net H. K. LEWIS, June 14",65,73,,Coleman (F.),Extraction of teeth. Illus. 2nd edit.,Cr. 8vo.,"71 x 44, pp. 186, 3s. 6d. net",H. K. LEWIS,June 14
"Coleman (Percy)-Co-ordinate geometry : elementary course. Cr. 8vo. 7 X 5, pp. 240, 45. 6d. (Clarendon Press) H. MILFORD, Dec. 14",65,73,,Coleman (Percy),Co-ordinate geometry : elementary course.,Cr. 8vo.,"7 X 5, pp. 240, 45. 6d. (Clarendon Press)",H. MILFORD,Dec. 14
"Coleridge (Samuel Taylor)-Lectures and notes on Shakespeare and other English poets. 12mo., pp. 564, Is. net (Bohn's Popular library) BELL, Oct. 14",65,73,,Coleridge (Samuel Taylor),Lectures and notes on Shakespeare and other English poets.,12mo.,"pp. 564, Is. net (Bohn's Popular library)",BELL,Oct. 14
"Coleridge (Samuel Taylor)—The Rime of the ancient mariner. Cr. 8vo., pp. 38, swd. 6d. net Ithr. 28. net ...SIMPKIN Sep. 14",65,73,,Coleridge (Samuel Taylor),The Rime of the ancient mariner.,Cr. 8vo.,"pp. 38, swd. 6d. net Ithr. 28. net ...",SIMPKIN,Sep. 14
"Coles (Arthur)-Guide for the Company secretary: a practical manual. 2nd edit. 8vo. 81 X54, pp. 432, 5s. net . PITMAN, Sep. 14",65,73,,Coles (Arthur),Guide for the Company secretary: a practical manual. 2nd edit.,8vo.,"81 X54, pp. 432, 5s. net .",PITMAN,Sep. 14
"Coles (V. S. S.)-A Litany for the war. Music by H. A. Branscombe. Cr. 8vo., sheet, music and words, 35. 6d. net per 100 ; words only, 28. 6d. net per 100. . BLACKWELL, Nov. 14",65,73,,Coles (V. S. S.),A Litany for the war. Music by H. A. Branscombe.,Cr. 8vo.,"sheet, music and words, 35. 6d. net per 100 ; words only, 28. 6d. net per 100. .",BLACKWELL,Nov. 14
"Colin (J.)-France and the next war: a French view of modern war. Cr. 8vo. 71 x5, pp. 318, 2s.6d, net ; swd. 28. net.. HODDER & S., Oct. 14",65,73,,Colin (J.),France and the next war: a French view of modern war.,Cr. 8vo.,"71 x5, pp. 318, 2s.6d, net ; swd. 28. net..",HODDER & S.,Oct. 14
"Collier (Price)-Germany and the Germans from an American point of view. Cheaper edit. Cr. 8vo. 7 X 44, pp. 510, 2s. 6d. net, swd. 28. net DUCKWORTH, Nov. 14",65,73,,Collier (Price),Germany and the Germans from an American point of view. Cheaper edit.,Cr. 8vo.,"7 X 44, pp. 510, 2s. 6d. net, swd. 28. net",DUCKWORTH,Nov. 14
"Colling wood (Harry)-A Chinese command. Cr. 8vo. 7) X 5, pp. 352, 55... ...BLACKIE, Oct. 14",65,73,,Colling wood (Harry),A Chinese command.,Cr. 8vo.,"7) X 5, pp. 352, 55...",BLACKIE,Oct. 14
"Colling wood (Harry)-A Pirate of the Caribbees. Cr. 8vo , pp. 344, Is. net .... .. FROWDE, May 14",65,73,,Colling wood (Harry),A Pirate of the Caribbees.,Cr. 8vo,", pp. 344, Is. net .... ..",FROWDE,May 14
