original_entry,page_num,doc_page_num,opening_bits,author(s),title,format,little_bits,publisher,date
"Constables, Handy notes for, 6d. Constant (Benjamin)-Adolphe. 2mo., pp. 200, IS. net DENT, Feb. 14",68,76,"Constables, Handy notes for, 6d. ",Constant (Benjamin),Adolphe.,2mo.,"pp. 200, IS. net",DENT,Feb. 14
"Constantine (Grand Duke) (“K.P."")-The King of the Jews : a sacred drama. Trans. by Victor E. Marsden. Cr. 8vo. 78 X 5, pp. 170, 2s.6d. net CASSELL, Oct. 14",68,76,,"Constantine (Grand Duke) (""K.P."")",The King of the Jews : a sacred drama. Trans. by Victor E. Marsden.,Cr. 8vo.,"78 X 5, pp. 170, 2s.6d. net",CASSELL,Oct. 14
"Constitutional year book, The), 1914. 8vo. 25., Swd. is. . . NATIONAL UNIONIST ASSOC., June 14",68,76,,,"Constitutional year book, The), 1914.",8vo.,"25., Swd. is. . .",NATIONAL UNIONIST ASSOC.,June 14
"Consular reports-Aleppo Vilayet (map), 2d.; Society Islands, 1}d.; Lourenco Marques, &c. (map), 3}d.; Osaka, 2d. ; Mengtsz (map), 1 d.; Teng Yueh, kd.; Japan, 5d. ; Piedmont, 2d. WYMAN, Sep. 14",68,76,,,"Consular reports-Aleppo Vilayet (map), 2d.; Society Islands, 1}d.; Lourenco Marques, &c. (map), 3}d.; Osaka, 2d. ; Mengtsz (map), 1 d.; Teng Yueh, kd.; Japan, 5d. ; Piedmont, 2d.",,,WYMAN,Sep. 14
"Consular reports-Hawaii, 4ļd.; Isfahan, 4d. ; Bushire, 5d.; Thessaly, 4d. WYMAN, Feb. 14",68,76,,,"Consular reports-Hawaii, 4ļd.; Isfahan, 4d. ; Bushire, 5d.; Thessaly, 4d.",,,WYMAN,Feb. 14
"Consular reports-Kerman, 1}d.; Bahrein Is- lands (map), 3}d. .WYMAN, A pl. 14",68,76,,,"Consular reports-Kerman, 1}d.; Bahrein Is- lands (map), 3}d.",,,.WYMAN,A pl. 14
"Consular reports-Lingah (map), 2}d. ; Nether- lands, trade and shipping, Id.; Brest, id. ; Colima (map), itd.; St. Thomas and St. Croix, id. ; Cape Verde Islands (map), 1ļd.; Goa, id. ; Corsica (map), 1\d. WYMAN, May 14",68,76,,,"Consular reports-Lingah (map), 2}d. ; Nether- lands, trade and shipping, Id.; Brest, id. ; Colima (map), itd.; St. Thomas and St. Croix, id. ; Cape Verde Islands (map), 1ļd.; Goa, id. ; Corsica (map), 1\d.",,,WYMAN,May 14
"Consular reports-Porto Alegre (map), 2ļd.; Paraguay, budget, &c., d.; Kiungchow (map), 1d.; Shimonoseki, id.; Newchang (map), Ijd.; Swatow (map), 1}d.; Antwerp, shipping and navigation, 2d. ; Cyclades (map), 2d. ; Coquimbo (map), 2d. .WYMAN, May 14",68,76,,,"Consular reports-Porto Alegre (map), 2ļd.; Paraguay, budget, &c., d.; Kiungchow (map), 1d.; Shimonoseki, id.; Newchang (map), Ijd.; Swatow (map), 1}d.; Antwerp, shipping and navigation, 2d. ; Cyclades (map), 2d. ; Coquimbo (map), 2d.",,,.WYMAN,May 14
"Consular reports—Algeria, 7d.; Shiraz, 3d.; Vladivostock, 7d. ; Congo, 3 d. ; Persia, 1}d.; Pará, 2}d. ; Bunder Abbas, 3}d. ; Arabistan, I}d. Portugal, id. ; Argentine Republic (wine and fruit growing industries), 1 d. WYMAN, Mar. 14",68,76,,,"Consular reports—Algeria, 7d.; Shiraz, 3d.; Vladivostock, 7d. ; Congo, 3 d. ; Persia, 1}d.; Pará, 2}d. ; Bunder Abbas, 3}d. ; Arabistan, I}d. Portugal, id. ; Argentine Republic (wine and fruit growing industries), 1 d.",,,WYMAN,Mar. 14
"Consular reports—Belgium, 3d. ; Buenos Ayres, 8}d.; Danzig, 4d.; Surinam, or Dutch Guiana, 3}d.; Samoa, id. ; Smyrna, 4]d. ; Morocco, 5d. ; French Congo, 3d.; Norway (suppl.), 2d. ; Bangkok, 3}d. ; Dunkirk, 2d. WYMAN, Jan. 14",68,76,,,"Consular reports—Belgium, 3d. ; Buenos Ayres, 8}d.; Danzig, 4d.; Surinam, or Dutch Guiana, 3}d.; Samoa, id. ; Smyrna, 4]d. ; Morocco, 5d. ; French Congo, 3d.; Norway (suppl.), 2d. ; Bangkok, 3}d. ; Dunkirk, 2d.",,,WYMAN,Jan. 14
"Consular reports—Chicago (map), 3d. ; Batoum (map), 3d. ; Patras (map), i}d. ; Changsha (map 1}d. ; Canary Islands (map), 2d. ; Azores (map), 1 d. ; Foochow (map), 1 d.; Beirut (map), 2d; Katanga (map), id. ...... WYMAN, June 14",68,76,,,"Consular reports—Chicago (map), 3d. ; Batoum (map), 3d. ; Patras (map), i}d. ; Changsha (map 1}d. ; Canary Islands (map), 2d. ; Azores (map), 1 d. ; Foochow (map), 1 d.; Beirut (map), 2d; Katanga (map), id.",,......,WYMAN,June 14
"Consular reports—Index, 1913. 6d. WYMAN, June 14",68,76,,,"Consular reports—Index, 1913.",,6d.,WYMAN,June 14
"Consular reports—Sao Paulo, id; Dresden, id. ; Baltimore (map), 3}d. ; Hayti (map), 2}d. ; Dominican Republic (map), 2 d.; Piræus (map), 24d. ; Ichaing (map), itd. ; Peru (map), 2}d.; St. Louis (map), 2 d. ; Corunna (map), 3d. . WYMAN, June 14",68,76,,,"Consular reports—Sao Paulo, id; Dresden, id. ; Baltimore (map), 3}d. ; Hayti (map), 2}d. ; Dominican Republic (map), 2 d.; Piræus (map), 24d. ; Ichaing (map), itd. ; Peru (map), 2}d.; St. Louis (map), 2 d. ; Corunna (map), 3d.",,,. WYMAN,June 14
"Consular reports, 1913-Antofagasta, id.; Hang- chow (map), 1d.; Chinde (map), 2d.; Wuchow and Nanning (map), id.; Chinkiang (map), 1}d.; Kiukiang (map), 2d. ; Italy, 2d.; Corfu, 20.; Réunion, id. ; Trebizond, 2d.; Rotterdam, &c. (map), 6}d.; Philadelphia, 2}d.; San Francisco Do Sul, id.; Portland (U.S.), 4d.; Bordeaux (map), 4d.; Bulgaria, Iļd.; San' Thomé and Principe, įd.; Iquitos, ijd.; New Caledonia (map), 1 d.; Lyons (map), 4d. WYMAN, July 14",68,76,,,"Consular reports, 1913-Antofagasta, id.; Hang- chow (map), 1d.; Chinde (map), 2d.; Wuchow and Nanning (map), id.; Chinkiang (map), 1}d.; Kiukiang (map), 2d. ; Italy, 2d.; Corfu, 20.; Réunion, id. ; Trebizond, 2d.; Rotterdam, &c. (map), 6}d.; Philadelphia, 2}d.; San Francisco Do Sul, id.; Portland (U.S.), 4d.; Bordeaux (map), 4d.; Bulgaria, Iļd.; San' Thomé and Principe, įd.; Iquitos, ijd.; New Caledonia (map), 1 d.; Lyons (map), 4d.",,,WYMAN,July 14
"Consular reports, 1913-Basra (map), 2d.; Erzeroum, id.; Pondicherry and Karikal 1909-13, Id.; Pakhoi (map), 1 d.; Chefoo (map), 1}d.; Constantinople (inap), 3!d.; Brindisi (nap), 21.; Shanghai, Marseilles (map), 3}d. ; Chungking (map), 2d. Dusseldorf, 3}d.; Para, 2d. ; Stettin, 2}d.; Faroe Islands and Iceland (map), 2!d. WYMAN, Aug. 14",68,76,,,"Consular reports, 1913-Basra (map), 2d.; Erzeroum, id.; Pondicherry and Karikal 1909-13, Id.; Pakhoi (map), 1 d.; Chefoo (map), 1}d.; Constantinople (inap), 3!d.; Brindisi (nap), 21.; Shanghai, Marseilles (map), 3}d. ; Chungking (map), 2d. Dusseldorf, 3}d.; Para, 2d. ; Stettin, 2}d.; Faroe Islands and Iceland (map), 2!d.",,,WYMAN,Aug. 14
"Consular reports, 1913-Yokohama (map), 2 d.; Japan, Trade of, 5d.; Piedmont, 2d.; Rio Grande, ld. ... WYMAN, Oct. 14",68,76,,,"Consular reports, 1913-Yokohama (map), 2 d.; Japan, Trade of, 5d.; Piedmont, 2d.; Rio Grande, ld.",,,WYMAN,Oct. 14
"Consular reports, 1913–Nanking (map), id. ; German S.-W. Africa (map), 3d. ; Lisbon, 3d. Finland (map), 4d. ; Madeira (map), Iļd.; Seistan and Kain (map), 2d.; Shasi (map), 1}d. ; Ciudad Bolivar (map), id. ; Mannheim, id.; Havre (map), 3}d. ; Costa Rica (map), ild.; Calais, itd.; Vera Cruz, 1 d.; Oporto (map), 1 d.; Progreso, id. ; Rome, i}d. WYMAN, Aug. 14",68,76,,,"Consular reports, 1913–Nanking (map), id. ; German S.-W. Africa (map), 3d. ; Lisbon, 3d. Finland (map), 4d. ; Madeira (map), Iļd.; Seistan and Kain (map), 2d.; Shasi (map), 1}d. ; Ciudad Bolivar (map), id. ; Mannheim, id.; Havre (map), 3}d. ; Costa Rica (map), ild.; Calais, itd.; Vera Cruz, 1 d.; Oporto (map), 1 d.; Progreso, id. ; Rome, i}d.",,,WYMAN,Aug. 14
"Consular reports, 1913–Netherlands Fast Indies, 3}d.; Roumania, 3}d.; Spanish possess. in Gulf of Guinea, id.; Foreign commerce of Russia, &c., 60.; Warsaw (map), 2ļd. ; Sicily, 3}d; San Francisco, 2}d.; New York, 3d. ; Savannah (map), 3!d. ; Dairen (map), 3}d. ; Amoy, d.; Finances of Netherlands, id.; Hakodate (map), 2d. ; Panama (map), 2£d. ; Jerusalem (map), 2d. ; Seville (map), 2 d. WYMAN, July 14",68,76,,,"Consular reports, 1913–Netherlands Fast Indies, 3}d.; Roumania, 3}d.; Spanish possess. in Gulf of Guinea, id.; Foreign commerce of Russia, &c., 60.; Warsaw (map), 2ļd. ; Sicily, 3}d; San Francisco, 2}d.; New York, 3d. ; Savannah (map), 3!d. ; Dairen (map), 3}d. ; Amoy, d.; Finances of Netherlands, id.; Hakodate (map), 2d. ; Panama (map), 2£d. ; Jerusalem (map), 2d. ; Seville (map), 2 d.",,,WYMAN,July 14
"Consular reports, 1913— Tsinan and Tsingtau, id.; Wuhu (map), 1}d.; Ningpo (map), ijd.; Tientsin (map), 10.; Corea, 2d.; Austria Hungary, 2d. ; Boston (map), 3d. ; Canton, id.; Genoa (map), 3d. ; Philippine Islands (map), 2}d. ; Alexandria (map), 4d. ; Venezuela (map), 2jd. .WYMAN, July 14",68,76,,,"Consular reports, 1913— Tsinan and Tsingtau, id.; Wuhu (map), 1}d.; Ningpo (map), ijd.; Tientsin (map), 10.; Corea, 2d.; Austria Hungary, 2d. ; Boston (map), 3d. ; Canton, id.; Genoa (map), 3d. ; Philippine Islands (map), 2}d. ; Alexandria (map), 4d. ; Venezuela (map), 2jd.",,,.WYMAN,July 14
"Converse (Florence)—The Children of light. 12mo., pp. 310, is. net. (Wayfarer's library) DENT, July 14",68,76,,Converse (Florence),The Children of light.,12mo.,"pp. 310, is. net. (Wayfarer's library)",DENT,July 14
"Conway (Sir Martin)——The Sport of collecting. 8vo. 83 X52, pp. 152, 55. net ..UNWIN, May 14",69,77,,Conway (Sir Martin),The Sport of collecting.,8vo.,"83 X52, pp. 152, 55. net ..",UNWIN,May 14
"Conybeare (Edward)—Alfred in the chroniclers. 2nd edit. 8vo. 83X5, pp. 284, 4s. 6d. net HEFFER, July 14",69,77,,Conybeare (Edward),Alfred in the chroniclers. 2nd edit.,8vo.,"83X5, pp. 284, 4s. 6d. net",HEFFER,July 14
"Conybeare (F. C.) and Harris (J. R.)-- The Story of Ahikar. 2nd edit., enlarged and corrected. 8vo., pp. 312, 155. net CAMB. UNIV. PRESS, Jan. 14",69,77,,Conybeare (F. C.) and Harris (J. R.),"The Story of Ahikar. 2nd edit., enlarged and corrected.",8vo.,"pp. 312, 155. net",CAMB. UNIV. PRESS,Jan. 14
"Conybeare (Fred. C.) The Historical Christ. Cr. 8vo. 8 X5, pp. 248, 3s. 6d. net WATTS, Mar. 14",69,77,,Conybeare (Fred. C.),The Historical Christ.,Cr. 8vo.,"8 X5, pp. 248, 3s. 6d. net",WATTS,Mar. 14
"Conyers (Dorothea) - For Henri and Navarre. I 2mo. 7d. net HUTCHINSON, Feb. 14",69,77,,Conyers (Dorothea),For Henri and Navarre.,I 2mo.,7d. net,HUTCHINSON,Feb. 14
"Conyers (Dorothea) ---Old Andly. Cr. Svo. 73 X 5, pp. 314, 6s. METHUEX, July 14",69,77,,Conyers (Dorothea),Old Andly.,Cr. Svo.,"73 X 5, pp. 314, 6s.",METHUEX,July 14
"Conyers (Dorothea)—Aunt Jane and Uncle James. 18mo., 7d. net.. HUTCHINSOX, Aug. 14",69,77,,Conyers (Dorothea),Aunt Jane and Uncle James.,18mo.,7d. net..,HUTCHINSOX,Aug. 14
"Coo maras wamy (Ananda K.) ed.–Visvakarma : examples of Indian sculpture. Part 8, 20 plates, with title page, list of plates, and intro. by Eric Gill. Demy 4to., 4s, net.. LUZAC, Nov. 14",69,77,,Coo maras wamy (Ananda K.) ed.,"Visvakarma : examples of Indian sculpture. Part 8, 20 plates, with title page, list of plates, and intro. by Eric Gill.",Demy 4to.,"4s, net..",LUZAC,Nov. 14
"Cook (Alec.)-Our prison system. Cr. 8vo., 6s. DRANE, Mar. 14",69,77,,Cook (Alec.),Our prison system.,Cr. 8vo.,6s.,DRANE,Mar. 14
"Cook (Arthur Bernard)—Zeus : a study in ancient religion. Vol. 1, Zeus, the God of the Bright Sky. Illus. Ryl. 8vo., pp. 930, 455. net CAMB. UNIV. PRESS, Nov. 14",69,77,,Cook (Arthur Bernard),"Zeus : a study in ancient religion. Vol. 1, Zeus, the God of the Bright Sky. Illus.",Ryl. 8vo.,"pp. 930, 455. net",CAMB. UNIV. PRESS,Nov. 14
"Cook (Augusta) --By way of the East; or, Gathered light from our travels in Palestine, Egypt, &c. 2nd edit. Cr. 8vo., Is. 6d. net ; swd. is. net R. BANKS, May 14",69,77,,Cook (Augusta),"By way of the East; or, Gathered light from our travels in Palestine, Egypt, &c. 2nd edit.",Cr. 8vo.,", Is. 6d. net ; swd. is. net",R. BANKS,May 14
"Cook (Augustus H.)-Eve repentant, and other poems. 12m0., 28. od. net BELI, May 14",69,77,,Cook (Augustus H.),"Eve repentant, and other poems.",12m0.,28. od. net,BELI,May 14
"Cook (C. F.) ed. - The Book of Sussex verse. 12mo. 64 X4, pp. 244, 2s, net COMBRIDGE, Nov. 14",69,77,,Cook (C. F.) ed.,The Book of Sussex verse.,12mo.,"64 X4, pp. 244, 2s, net",COMBRIDGE,Nov. 14
"Cook (E. T.)-Gardening for beginners : a hand- book to the garden. 6th edit. Fully rev. by F. W. Harvey. 8vo. 94 X5, pp. 668, 125. 6d. net NEWNES, Aug. 14",69,77,,Cook (E. T.),Gardening for beginners : a hand- book to the garden. 6th edit. Fully rev. by F. W. Harvey.,8vo.,"94 X5, pp. 668, 125. 6d. net",NEWNES,Aug. 14
"Cook (Sir Edward)--How Britain strove for peace : a record of Anglo-German negotiations, 1898-1914. Told from authoritative sources. 8vo., swd., 2d. ......MACMILLAN, Oct. 14",69,77,,Cook (Sir Edward),"How Britain strove for peace : a record of Anglo-German negotiations, 1898-1914. Told from authoritative sources.",8vo.,"swd., 2d. ...... ",MACMILLAN,Oct. 14
"Cook (Sir Edward)—Britain and Turkey : the causes of the rupture set out, in brief form, from the diplomatic correspondence. 8vo., swd., 2d. . MACMILLAN, Dec. 14",69,77,,Cook (Sir Edward),"Britain and Turkey : the causes of the rupture set out, in brief form, from the diplomatic correspondence.","8vo.,","swd., 2d. .",MACMILLAN,Dec. 14
"Cook (Sir Edward)—Why Britain is at war : the causes and the issues. 8vo., pp. 24, swd. 2d. MACMILLAN, Sep. 14",69,77,,Cook (Sir Edward),Why Britain is at war : the causes and the issues.,8vo.,"pp. 24, swd. 2d.",MACMILLAN,Sep. 14
"Cook (Stanley A.) The Foundations of religion. 12mo., 6d. net (People's books) JACK, Feb. 14",69,77,,Cook (Stanley A.),The Foundations of religion.,12mo.,6d. net (People's books),JACK,Feb. 14
"Cook (Stanley A.)-The Study of religions. 8vo., 8. X 5, pp. 464, 75. 6d. net BLACK, Oct. 14",69,77,,Cook (Stanley A.),The Study of religions.,8vo.,"8. X 5, pp. 464, 75. 6d. net",BLACK,Oct. 14
"Cook (Theodore Andrea) - The Curves of life : being an account of spiral formations and their applications to growth in nature, science, and art. Illus. Ryl. 8vo., 105 X6], pp. 510, 12s. 6d. net CONSTABLE, Oct. 14",69,77,,Cook (Theodore Andrea),"The Curves of life : being an account of spiral formations and their applications to growth in nature, science, and art. Illus.",Ryl. 8vo.,"105 X6], pp. 510, 12s. 6d. net",CONSTABLE,Oct. 14
"Cook (Valentine)--Thomas Cook, evangelist, saint : an appreciation by his brother. Cr. 8vo. 8 X5, pp. 225, 23. 64. net C. H. KELLY, Sep. 14",69,77,,Cook (Valentine),"Thomas Cook, evangelist, saint : an appreciation by his brother.",Cr. 8vo.,"8 X5, pp. 225, 23. 64. net",C. H. KELLY,Sep. 14
"Cooke (A. B.) ed.-A Treatise on diseases of the rectum. Svo. 235. 60. net S. PHILLIPS, July 14",69,77,,Cooke (A. B.) ed.,A Treatise on diseases of the rectum.,Svo.,235. 60. net,S. PHILLIPS,July 14
"Cooke (Arthur 0.)- The Story of Napoleon. Imp. 16mo., bds. is. net ... ...FROWDE, Nov. 14",69,77,,Cooke (Arthur 0.),The Story of Napoleon.,"Imp. 16mo.,",bds. is. net ... ...,FROWDE,Nov. 14
"Cooke (Arthur 0.)-Life at sca. Cr. Svo. 3s. 6d. net .I'ROWDE, Oct. 14",69,77,,Cooke (Arthur 0.),Life at sca.,Cr. Svo.,3s. 6d. net .,I'ROWDE,Oct. 14
"Cooke (Arthur 0.)-Our British animals, Cr. 8vo., pp. 96, bds. Is. net ...NELSOX, Oct. 14",69,77,,Cooke (Arthur 0.),"Our British animals,",Cr. 8vo.,"pp. 96, bds. Is. net ...",NELSOX,Oct. 14
"Cooke (Arthur 0.)-Our British trees. Cr. 8vo. pp. 96, bds. is. net ...NELSON, Oct. 14",69,77,,Cooke (Arthur 0.),Our British trees.,Cr. 8vo.,"pp. 96, bds. is. net",NELSON,Oct. 14
"Cooke (Arthur 0.)-Our British wild flowers. Cr. 8vo., pp. 96, bds., IS. net, NELSON, Oct. 14",69,77,,Cooke (Arthur 0.),Our British wild flowers.,Cr. 8vo.,"pp. 96, bds., IS. net,",NELSON,Oct. 14
"Cooke (Arthur 0.)-Stories of France in days of old. 8vo. 81 x 5), pp. 154, Is. 6d. net JACK, Oct. 14",69,77,,Cooke (Arthur 0.),Stories of France in days of old.,8vo.,"81 x 5), pp. 154, Is. 6d. net",JACK,Oct. 14
"Cooke (F. E.)-An American hero: the story of William Lloyd Garrison. New edit. Cr. 8vo. ROUTLEDGE, Feb. 14",69,77,,Cooke (F. E.),An American hero: the story of William Lloyd Garrison. New edit.,Cr. 8vo.,,ROUTLEDGE,Feb. 14
"Cooke (J. C.) and Kidd (H. M.)-Dressmaking in the school. Illus. 4to. 81 X6), pp. 160, 43. 6d. net ..LONGMANS, Jan. 14",69,77,,Cooke (J. C.) and Kidd (H. M.),Dressmaking in the school. Illus.,4to.,"81 X6), pp. 160, 43. 6d. net ..",LONGMANS,Jan. 14
"Cooley (A. M.) sce Kinne (H.) and Cooley. Cooley (M. S.)--Vacuum cleaning systems. 8vo., 128. 6d. net.. ..SPON, Jan. 14",69,77,Cooley (A. M.) sce Kinne (H.) and Cooley.,Cooley (M. S.),Vacuum cleaning systems.,8vo.,128. 6d. net.. ..,SPON,Jan. 14
"Coomaraswamy (Ananda K.) — Visvakarma : examples of Indian architecture, sculpture, painting, handicraft. Pt. 7, Impl. 8vo. 12 plates 28. 60. net. .LUZAC, June 14",69,77,,Coomaraswamy (Ananda K.),"Visvakarma : examples of Indian architecture, sculpture, painting, handicraft. Pt. 7,",Impl. 8vo.,12 plates 28. 60. net. .,LUZAC,June 14
"Cooper (A. B.)-Frank Flower, the boy war correspondent. Cr. 8vo., pp. 256, swd. is. net. (The Scout library) PEARSON, May 14",69,77,,Cooper (A. B.),"Frank Flower, the boy war correspondent.",Cr. 8vo.,"pp. 256, swd. is. net. (The Scout library)",PEARSON,May 14
"Cooper (A. Heaton)-Norwegian fjords. 8vo. 9X61, pp. 64, Is. 6d. net (Beautiful Europe) BLACK, June 14",69,77,,Cooper (A. Heaton),Norwegian fjords.,8vo.,"9X61, pp. 64, Is. 6d. net (Beautiful Europe)",BLACK,June 14
"Cooper (Edward H.)--Mr. Blake of Newmarket. 12mo., 7d. net ..W. COLLINS, Feb. 14",69,77,,Cooper (Edward H.),Mr. Blake of Newmarket.,12mo.,7d. net,W. COLLINS,Feb. 14
"Cooper (Elizabeth)-The Women of Egypt. Illus. 8vo. 8 X 51, pp. 380, 6s. net Hurst & B., May 14",69,77,,Cooper (Elizabeth),The Women of Egypt. Illus.,8vo.,"8 X 51, pp. 380, 6s. net",Hurst & B.,May 14
"Cooper (F. C.)-In the Canadian Bush. Cr. 8vo., 2s, net .. HEATH, CRANTON, Sep. 14",69,77,,Cooper (F. C.),In the Canadian Bush.,Cr. 8vo.,"2s, net ..","HEATH, CRANTON",Sep. 14
"Cooper (John Spencer) -Rough notes of seven campaigns : in Portugal, Spain, France, and America during the years 1809-15. Reprint. 12mo, 6 x4, pp. 160, 25. F. EDWARDS ; H. REES, Aug. 14",69,77,,Cooper (John Spencer),"Rough notes of seven campaigns : in Portugal, Spain, France, and America during the years 1809-15. Reprint.","12mo,","6 x4, pp. 160, 25.",F. EDWARDS ; H. REES,Aug. 14
"Cooper (Reginald Davey)—Hunting and hunted in the Belgian Congo. Illus. Ryl. 8vo. 91 x64, pp. 282, Ios. 6d. net ...... SMITH, E., Apr. 14",69,77,,Cooper (Reginald Davey),Hunting and hunted in the Belgian Congo. Illus.,Ryl. 8vo.,"91 x64, pp. 282, Ios. 6d. net ...... ","SMITH, E.",Apr. 14
"Cooper (Sir William Earnshaw)-Where two worlds meet : bridging the gulf between matter and spirit. Cr. 8vo. 71 X 43, pp. 332, 3s. 6d. net L V. FOWLER, Mar. 14",70,78,,Cooper (Sir William Earnshaw),Where two worlds meet : bridging the gulf between matter and spirit.,Cr. 8vo.,"71 X 43, pp. 332, 3s. 6d. net",L V. FOWLER,Mar. 14
"Cooper-Key (A.)--A Primer on the storage of petroleum spirit and carbide of calcium. Cr. 8vo. 71x41, pp. 136, 25. 6d. net C. GRIFFIN, May 14",70,78,,Cooper-Key (A.),A Primer on the storage of petroleum spirit and carbide of calcium.,Cr. 8vo.,"71x41, pp. 136, 25. 6d. net",C. GRIFFIN,May 14
"Coote (Constance)-Combermeade Hall : a Christ- mas story of 40 years ago. Cheaper edit. Cr. 8vo., PP. 92, IS. .PARTRIDGE, Nov. 14",70,78,,Coote (Constance),Combermeade Hall : a Christ- mas story of 40 years ago. Cheaper edit.,Cr. 8vo.,"PP. 92, IS. .",PARTRIDGE,Nov. 14
"Copeland (Edwin B.)---The Coco-nut. Illus. 8vo. 81x51, pp. 226, Ios, net MACMILLAN, Oct. 14",70,78,,Copeland (Edwin B.),The Coco-nut. Illus.,8vo.,"81x51, pp. 226, Ios, net",MACMILLAN,Oct. 14
"Copeland (T. E.)- Everybody's guide to book- keeping. 12mo. 51x41, pp. 97, 60. net BRINDLEY & HOWE, Feb. 14",70,78,,Copeland (T. E.),Everybody's guide to book- keeping.,12mo.,"51x41, pp. 97, 60. net",BRINDLEY & HOWE,Feb. 14
