original_entry,page_num,doc_page_num,opening_bits,author(s),title,format,little_bits,publisher,date
"Bacon's Road Atlas of England and Wales. Cr. 8vo. swd. 2s. 6d. net ...BACON, Apr. '21",18.0,32.0,,,Bacon's Road Atlas of England and Wales.,Cr. 8vo.,swd. 2s. 6d. net,BACON,Apr. '21
"Bacon's Visitor's map of London. 18mo.swd. 4d. net ..BACON, Apr. '21",18.0,32.0,,,Bacon's Visitor's map of London.,18mo.swd.,4d. net,BACON,Apr. '21
"Bacon's Waistcoat pocket plan of London. 32mo. swd. 2d. net .BACON, Apr. '21",18.0,32.0,,,Bacon's Waistcoat pocket plan of London.,32mo.,swd. 2d. net .,BACON,Apr. '21
"Baddeley (John F.)-Russia in the 'eighties: sport and politics. Illus. 8vo. 8 × 54, pp. 482, 30s. net.. ..LONGMANS, Mar. '21",18.0,32.0,,Baddeley (John F.),Russia in the 'eighties: sport and politics. Illus.,8vo.,"8 × 54, pp. 482, 30s. net.. ..",LONGMANS,Mar. '21
"Baddeley (John, Sir)-The Guildhall of the City of London with a short account of its historic associations and the municipal work carried on therein. 5th ed., rev. 8x51, pp. 211, swd. Is. net (Guildhall) ..CITY LANDS CTTE., Oct. '21",18.0,32.0,,"Baddeley (John, Sir)","The Guildhall of the City of London with a short account of its historic associations and the municipal work carried on therein. 5th ed., rev.",,"8x51, pp. 211, swd. Is. net (Guildhall) ..",CITY LANDS CTTE.,Oct. '21
"Baden-Powell (Robert, Sir)-An Old Wolf's favourites: animals I have known. Cr. 8vo. 74×4, pp. 126, 2s. 6d. net, swd. is. 6d. net PEARSON, Sep. '21",18.0,32.0,,"Baden-Powell (Robert, Sir)",An Old Wolf's favourites: animals I have known.,Cr. 8vo.,"74×4, pp. 126, 2s. 6d. net, swd. is. 6d. net",PEARSON,Sep. '21
"Baden-Powell (Robert, Sir)-Scouting for boys: a handbook for instruction in good citizenship. 9th ed. Cr. 8vo. 7×5, pp. 334, 4s. 6d. net; swd. 2s. 6d. net .PEARSON, Jan. '21",18.0,32.0,,"Baden-Powell (Robert, Sir)",Scouting for boys: a handbook for instruction in good citizenship. 9th ed.,Cr. 8vo.,"7×5, pp. 334, 4s. 6d. net; swd. 2s. 6d. net .",PEARSON,Jan. '21
"Baden-Powell (Robert, Sir)-The Scout's first book. Cr. 8vo. 7 × 4, pp. 64, swd. 9d. net PEARSON, Feb. '21",18.0,32.0,,"Baden-Powell (Robert, Sir)",The Scout's first book.,Cr. 8vo.,"7 × 4, pp. 64, swd. 9d. net",PEARSON,Feb. '21
"Baden-Powell (Robert, Sir)—What scouts can do: more yarns. Cr. 8vo. 7 x 44, pp. 173, swd. 2s. net PEARSON, July '21",18.0,32.0,,"Baden-Powell (Robert, Sir)",What scouts can do: more yarns.,Cr. 8vo.,"7 x 44, pp. 173, swd. 2s. net",PEARSON,July '21
"Baden-Powell (Sir Robert)-Girl guiding: a hand- book for guidelets, guides, senior guides, and guiders. Rev. ed. Cr. 8vo. 7×5, pp. 204, 3s. 6d. net; swd. 2s. net ..PEARSON, Jan. '21",18.0,32.0,,Baden-Powell (Sir Robert),"Girl guiding: a hand- book for guidelets, guides, senior guides, and guiders. Rev. ed.",Cr. 8vo.,"7×5, pp. 204, 3s. 6d. net; swd. 2s. net ..",PEARSON,Jan. '21
"Badenoch (James Greig)-The Art of letter paint- ing made easy. 9th ed. 3 plates of simple monograms by Benjamin R. Prior. Cr. 8vo. 7×5, pp. 60, 2s. net. (Lockwood's Art-work manuals) .LOCKWOOD, Dec. '21",18.0,32.0,,Badenoch (James Greig),The Art of letter paint- ing made easy. 9th ed. 3 plates of simple monograms by Benjamin R. Prior.,Cr. 8vo.,"7×5, pp. 60, 2s. net. (Lockwood's Art-work manuals)",.LOCKWOOD,Dec. '21
"Baetjer (Frederick H.) and Waters (Charles A.)- Injuries and diseases of the bones and joints. 4to. 70s. net. .LEWIS, July '21",18.0,32.0,,Baetjer (Frederick H.) and Waters (Charles A.),Injuries and diseases of the bones and joints.,4to.,70s. net. .,LEWIS,July '21
"Bagster Bible stories. Illus. by Charles B. Birch. 18mo. 5× 3, pp. 136, 1s. 6d. net BAGSTER, Apr. '21",18.0,32.0,,,Bagster Bible stories. Illus. by Charles B. Birch.,18mo.,"5× 3, pp. 136, 1s. 6d. net",BAGSTER,Apr. '21
"Bailey (H. C.)-The Fool. Cr. 8vo. 7×5, pp. 250, 7s. 6d. net. METHUEN, Sep. '21",18.0,32.0,,Bailey (H. C.),The Fool.,Cr. 8vo.,"7×5, pp. 250, 7s. 6d. net.",METHUEN,Sep. '21
"Bailey (James S.)-Flame-tears and heart-joy. [Verses.] 8×51, pp. 48, IS. (Northampton) MERCURY PR., Feb. '21",18.0,32.0,,Bailey (James S.),Flame-tears and heart-joy. [Verses.],,"8×51, pp. 48, IS. (Northampton)",MERCURY PR.,Feb. '21
"Bailey (Margery)-Seven peas in the pod. With illus. by Alice Bolam Preston. 8vo. 8×51, pp. 201, 6s. net..........HARRAP, Aug. '21",18.0,32.0,,Bailey (Margery),Seven peas in the pod. With illus. by Alice Bolam Preston.,8vo.,"8×51, pp. 201, 6s. net..........",HARRAP,Aug. '21
"Bailey (Marian Elizabeth)-Boys' and girls' ask-at- home questions. Cr. 8vo. 7 × 51, pp. 283, 6s. net HARRAP, Apr. '21",18.0,32.0,,Bailey (Marian Elizabeth),Boys' and girls' ask-at- home questions.,Cr. 8vo.,"7 × 51, pp. 283, 6s. net",HARRAP,Apr. '21
"Bailey (T. Grahame, Rev.)-Linguistic studies from the Himalayas: the grammar of fifteen Himalayan dialects. 8vo. pp. 292, bds. 15s. LUZAC, Jan. '21",18.0,32.0,,"Bailey (T. Grahame, Rev.)",Linguistic studies from the Himalayas: the grammar of fifteen Himalayan dialects.,8vo.,"pp. 292, bds. 15s.",LUZAC,Jan. '21
"Bailey (Temple)-The Trumpeter Swan. Cr. 8vo. 7×5, pp. 286, 8s. 6d. net HURST & B., June '21",18.0,32.0,,Bailey (Temple),The Trumpeter Swan.,Cr. 8vo.,"7×5, pp. 286, 8s. 6d. net",HURST & B.,June '21
"Baillie (G., Major)-A Chat about dry fly-fishing. 18mo. 6×41, pp. 46, 2s. 6d. net SELWYN & B., Aug. '21",18.0,32.0,,"Baillie (G., Major)",A Chat about dry fly-fishing.,18mo.,"6×41, pp. 46, 2s. 6d. net",SELWYN & B.,Aug. '21
"Baillie (Mrs. W. W.)-Days and nights of shikar. With frontispiece by the author. 8vo. 9×6, pp. 246, 12s. 6d. net.. LANE, Nov. '21",19.0,33.0,,Baillie (Mrs. W. W.),Days and nights of shikar. With frontispiece by the author.,8vo.,"9×6, pp. 246, 12s. 6d. net..",LANE,Nov. '21
"Baillie (T. H. E.)—Rugger rhymes; or, Lays of the egg-shaped ball. Illus. by Leo Munro. Cr. 8vo. 7×5, pp. 31, swd. is. 6d. net SPORTS PUBLICATIONS, Nov. '21",19.0,33.0,,Baillie (T. H. E.),"Rugger rhymes; or, Lays of the egg-shaped ball. Illus. by Leo Munro.",Cr. 8vo.,"7×5, pp. 31, swd. is. 6d. net",SPORTS PUBLICATIONS,Nov. '21
"Baillière's Popular atlas model of the ox. 8vo. swd. 3s. 6d. net .BAILLIERE, Sep. '21",19.0,33.0,,,Baillière's Popular atlas model of the ox.,8vo. swd.,3s. 6d. net .,BAILLIERE,Sep. '21
"Baily (Dom Theodore)-Singing beads. Woodcuts and verses. Ryl. 8vo. pp. 55, swd. 6s. net HEATH CRANTON, June '21",19.0,33.0,,Baily (Dom Theodore),Singing beads. Woodcuts and verses.,Ryl. 8vo.,"pp. 55, swd. 6s. net",HEATH CRANTON,June '21
"Baily's Hunting directory, 1921-1922. By the editor of ""Baily's Magazine of Sports and Pastimes."" 8vo. 8×5, pp. 380, 10s. 6d. net VINTON & CO., Nov. '21",19.0,33.0,,,"Baily's Hunting directory, 1921-1922. By the editor of ""Baily's Magazine of Sports and Pastimes.""",8vo.,"8×5, pp. 380, 10s. 6d. net",VINTON & CO.,Nov. '21
"Bain (A. Watson) ed.-The Modern teacher: essays on educational aims and methods. Intro. by Sir W. Henry Hadow. 8vo. 9×51, pp. 287, 10s. 6d. net .METHUEN, Apr. '21",19.0,33.0,,Bain (A. Watson) ed.,The Modern teacher: essays on educational aims and methods. Intro. by Sir W. Henry Hadow.,8vo.,"9×51, pp. 287, 10s. 6d. net .",METHUEN,Apr. '21
"Bain (A. Watson)-French verb conjugation. 8vo. pp. 55, swd. 2s. 6d. net METHUEN, June '21",19.0,33.0,,Bain (A. Watson),French verb conjugation.,8vo.,"pp. 55, swd. 2s. 6d. net",METHUEN,June '21
"Bain (Robert)-James the First of Scotland. Cr. 8vo. 7×51, pp. 105, 5s. net ...... MACLEHOSE, May '21",19.0,33.0,,Bain (Robert),James the First of Scotland.,Cr. 8vo.,"7×51, pp. 105, 5s. net ...... ",MACLEHOSE,May '21
"Baines (A. E.)--The Origin and problem of life: a psycho-physiological study. Illus. Cr. 8vo. 7×5, pp. 109, 3s. 6d. net ROUTLEDGE, F eb.'21",19.0,33.0,,Baines (A. E.),The Origin and problem of life: a psycho-physiological study. Illus.,Cr. 8vo.,"7×5, pp. 109, 3s. 6d. net",ROUTLEDGE,F eb.'21
"Baines (A. E.)-Germination in its electrical aspect with some further studies in electro- physiology. Illus. 8vo. 8×5, pp. 206, 12s. 6d. net .ROUTLEDGE, Feb. '21",19.0,33.0,,Baines (A. E.),Germination in its electrical aspect with some further studies in electro- physiology. Illus.,8vo.,"8×5, pp. 206, 12s. 6d. net .",ROUTLEDGE,Feb. '21
"Baines (Cuthbert Edward)-The Black circle. Cr. 8vo. 7×5, pp. 316, 7s. 6d. net 16s. net HODDER & S., Sep. '21",19.0,33.0,,Baines (Cuthbert Edward),The Black circle.,Cr. 8vo.,"7×5, pp. 316, 7s. 6d. net 16s. net",HODDER & S.,Sep. '21
"Baker (Amy J.) (Mrs. Maynard Crawford)-The Painted lily. Cr. 8vo. 7×5, pp. 320, 8s. 6d. net J. LONG, Aug. '21",19.0,33.0,,Baker (Amy J.) (Mrs. Maynard Crawford),The Painted lily.,Cr. 8vo.,"7×5, pp. 320, 8s. 6d. net",J. LONG,Aug. '21
"Baker (Amy J.)-Dear yesterday. Ch. ed. 18mo. 6×41, pp. 254, 2s. net J. LONG, July '21",19.0,33.0,,Baker (Amy J.),Dear yesterday. Ch. ed.,18mo.,"6×41, pp. 254, 2s. net",J. LONG,July '21
"Baker (C. H. Collins)-Crome. Intro. by C. J. Holmes. 4to. 105s. net....METHUEN, Apr",19.0,33.0,,Baker (C. H. Collins),Crome. Intro. by C. J. Holmes.,4to.,105s. net....,METHUEN,Apr
"Baker (G. S.)-Ship form, resistance and screw propulsion. 2nd ed. 8vo. 9X5, pp. 270, .CONSTABLE, Jan. '21",19.0,33.0,,Baker (G. S.),"Ship form, resistance and screw propulsion. 2nd ed.",8vo.,"9X5, pp. 270, .",CONSTABLE,Jan. '21
"Baker (George P.)-Calico painting and printing in the East Indies in the 17th and 18th centuries. Folio, 600s. net .......E. ARNOLD, Feb. '21",19.0,33.0,,Baker (George P.),Calico painting and printing in the East Indies in the 17th and 18th centuries.,"Folio,",600s. net .......,E. ARNOLD,Feb. '21
"Baker (George Pierce)-Dramatic technique. 8vo. 8×5, pp. 537, 18s. net....J. CAPE, Sep. '21",19.0,33.0,,Baker (George Pierce),Dramatic technique.,8vo.,"8×5, pp. 537, 18s. net",J. CAPE,Sep. '21
"Baker (K. W.)-Garden of the Plynck. 8vo. bds. Ios. 6d. net (Yale Univ. Pr.) MILFORD, Apr. '21",19.0,33.0,,Baker (K. W.),Garden of the Plynck.,8vo.,bds. Ios. 6d. net (Yale Univ. Pr.),MILFORD,Apr. '21
"Baker (Mabel)-Cookery simplified. Cr. 8vo. 7X4, pp. 145, swd. 2s. 6d. net ARROWSMITH, June '21",19.0,33.0,,Baker (Mabel),Cookery simplified.,Cr. 8vo.,"7X4, pp. 145, swd. 2s. 6d. net",ARROWSMITH,June '21
"Baker (Olaf)-Shasta of the wolves. Illus. by Charles L. Bull. 8vo. 8 x 51, pp. 276, 6s. net HARRAP, Mar. '21",19.0,33.0,,Baker (Olaf),Shasta of the wolves. Illus. by Charles L. Bull.,8vo.,"8 x 51, pp. 276, 6s. net",HARRAP,Mar. '21
"Baker (Oliver)-Black jacks and leather bottells: some account of leather drinking vessels in England and incidentally of other ancient vessels. Folio, 13 × 94, pp. 197, 63s. net E. J. BURROW, Aug. '21",19.0,33.0,,Baker (Oliver),Black jacks and leather bottells: some account of leather drinking vessels in England and incidentally of other ancient vessels.,"Folio,","13 × 94, pp. 197, 63s. net",E. J. BURROW,Aug. '21
"Baker (Ray Palmer)-A History of English Canadian literature to the Confederation. 8vo. pp. 200, IUS. od. net (Harvard Univ. Pr.) MILFORD, June '21",19.0,33.0,,Baker (Ray Palmer),A History of English Canadian literature to the Confederation.,8vo.,"pp. 200, IUS. od. net (Harvard Univ. Pr.)",MILFORD,June '21
"Baker (T. Thorne)-Kadiographic technique. 8vo. 8×5, pp. 208, 15s. net.. CONSTABLE, Mar. '21",19.0,33.0,,Baker (T. Thorne),Kadiographic technique.,8vo.,"8×5, pp. 208, 15s. net..",CONSTABLE,Mar. '21
"Baker (Wm. King)-The Loyalists. Cr. 8vo. IOS. 6d. net .. ROUTLEDGE (K. PAUL), June '21",19.0,33.0,,Baker (Wm. King),The Loyalists.,Cr. 8vo.,IOS. 6d. net ..,ROUTLEDGE (K. PAUL),June '21
"Baldwin (May)-Barbara Bellamy : a public school girl. Illus. by Lewis Baumer. 7×5, pp. 315, 4s. net....CHAMBERS, Sep. '21",19.0,33.0,,Baldwin (May),Barbara Bellamy : a public school girl. Illus. by Lewis Baumer.,,"7×5, pp. 315, 4s. net....",CHAMBERS,Sep. '21
"Baldwin (May)-The Girls' Eton. Illus. by Percy Tarrant. Cr. 8vo. 7×51, pp. 297, 4s. net CHAMBERS, Sep. '21",19.0,33.0,,Baldwin (May),The Girls' Eton. Illus. by Percy Tarrant.,Cr. 8vo.,"7×51, pp. 297, 4s. net",CHAMBERS,Sep. '21
"Baldwin (May)-Three Pickles in and out of school. Illus. by Molly Benatar. Cr. 8vo. 7×51, pp. 375, 5s. net.... CHAMBERS, Sep. '21",19.0,33.0,,Baldwin (May),Three Pickles in and out of school. Illus. by Molly Benatar.,Cr. 8vo.,"7×51, pp. 375, 5s. net....",CHAMBERS,Sep. '21
"Balfour (Arthur James)--A Defence of philosophic doubt an essay on the foundations of belief. New ed. 8vo. 9×5, pp. 362, 15s. 6d. net HODDER & S., June '21",19.0,33.0,,Balfour (Arthur James),A Defence of philosophic doubt an essay on the foundations of belief. New ed.,8vo.,"9×5, pp. 362, 15s. 6d. net",HODDER & S.,June '21
"Balfour (Graham, Sir)—Educational administra- tion. 8vo. swd. 2s. 6d. net.. MILFORD, June '21",19.0,33.0,,"Balfour (Graham, Sir)",Educational administra- tion.,8vo.,swd. 2s. 6d. net..,MILFORD,June '21
"Balfour (Lady Frances)-Dr. Elsie Inglis. With foreword by Sir William Macewen. Cr. 8vo. 71×4, pp. 54, 2s. 6d. net. (Rose and dragon books: young citizen ser.) BRITISH PERIODICALS, July '21",19.0,33.0,,Balfour (Lady Frances),Dr. Elsie Inglis. With foreword by Sir William Macewen.,Cr. 8vo.,"71×4, pp. 54, 2s. 6d. net. (Rose and dragon books: young citizen ser.)",BRITISH PERIODICALS,July '21
"Balilie (J. B.)-Studies in human nature 8vo. 9×5, pp. 308, 15s net. .BELL, Apr. '21",19.0,33.0,,Balilie (J. B.),Studies in human nature,8vo.,"9×5, pp. 308, 15s net. .",BELL,Apr. '21
"Ball (Robert, Sir)-Time and tide: a romance of the moon. 2nd ed. Cr. 8vo. 7×5, pp. 192, .S.P.C.K., July '21",19.0,33.0,,"Ball (Robert, Sir)",Time and tide: a romance of the moon. 2nd ed.,Cr. 8vo.,"7×5, pp. 192,",.S.P.C.K.,July '21
"Ball (W. Valentine)-Bankruptcy, deeds of arrangement and bills of sale. 4th ed. 8vo. 8x4, pp. 394, 12s. 6d. net PITMAN, Mar. '21",19.0,33.0,,Ball (W. Valentine),"Bankruptcy, deeds of arrangement and bills of sale. 4th ed.",8vo.,"8x4, pp. 394, 12s. 6d. net",PITMAN,Mar. '21
"Ball (W. W. Rouse)-String figures. 2nd ed. Cr. 8vo. 7×51, pp. 70, 2s. 6d. net HEFFER, May '21",19.0,33.0,,Ball (W. W. Rouse),String figures. 2nd ed.,Cr. 8vo.,"7×51, pp. 70, 2s. 6d. net",HEFFER,May '21
"Ballantine (Henry Winthrop)-The Preparation of contracts and conveyances, with forms and problems. 8vo. 12s. 6d. net MACMILLAN, June '21",19.0,33.0,,Ballantine (Henry Winthrop),"The Preparation of contracts and conveyances, with forms and problems.",8vo.,12s. 6d. net,MACMILLAN,June '21
"Ballantyne (R. M.)-The Young fur-traders: snowflakes and sunbeams. Ch. ed. Cr. 8vo. 7X4, pp. 255, 2s. net. (Royal ser.) WARD, LOCK, May '21",19.0,33.0,,Ballantyne (R. M.),The Young fur-traders: snowflakes and sunbeams. Ch. ed.,Cr. 8vo.,"7X4, pp. 255, 2s. net. (Royal ser.)","WARD, LOCK",May '21
"Ballantyne (R. M.)—The Gorilla hunters: a tale of the wilds of Africa. Cr. 8vo. 7 × 5, pp. 310, 3s. net WARD, LOCK, May '21",19.0,33.0,,Ballantyne (R. M.),The Gorilla hunters: a tale of the wilds of Africa.,Cr. 8vo.,"7 × 5, pp. 310, 3s. net","WARD, LOCK",May '21
"Ballantyne (Robert M.)-Martin Rattler. Abridged, with notes, by W. H. Webster. Cr. 8vo. 7×51, pp. 96, swd. 7d. net (A.L. Bright Story Readers) E. J. ARNOLD, Jan. '21",19.0,33.0,,Ballantyne (Robert M.),"Martin Rattler. Abridged, with notes, by W. H. Webster.",Cr. 8vo.,"7×51, pp. 96, swd. 7d. net (A.L. Bright Story Readers)",E. J. ARNOLD,Jan. '21
"Ballard (C. W.)-Elements of vegetable histology. 8vo. 17s. 6d. net (Wiley) CHAPMAN & H., May '21",19.0,33.0,,Ballard (C. W.),Elements of vegetable histology.,8vo.,17s. 6d. net (Wiley),CHAPMAN & H.,May '21
"Ballard (Frank)-Christian theism justified: statement for the times. (In 4 parts.) Part 1, A Reply to recent issues by the Ration- alist Press Association. Cr. 8vo. 7 × 41, pp. 72, swd. 2s. net ..EPWORTH PR., Apr. '21",19.0,33.0,,Ballard (Frank),"Christian theism justified: statement for the times. (In 4 parts.) Part 1, A Reply to recent issues by the Ration- alist Press Association.",Cr. 8vo.,"7 × 41, pp. 72, swd. 2s. net ..",EPWORTH PR.,Apr. '21
"Ballard (Frank)-Christian theism justified: statement for the times. (in 4 pts.) Part 2. Why does not God prevent all evil? Cr. 8vo. 71× 5, pp. 60, swd. 2s. net EPWORTH PR., Sep.'21",19.0,33.0,,Ballard (Frank),Christian theism justified: statement for the times. (in 4 pts.) Part 2. Why does not God prevent all evil?,Cr. 8vo.,"71× 5, pp. 60, swd. 2s. net",EPWORTH PR.,Sep.'21
"""Banco ""-Doll of the dance. Cr. 8vo. 7X5, pp. 236, 2s. 6d. net....HOLDEN & H., June '21",20.0,34.0,,Banco,Doll of the dance.,Cr. 8vo.,"7X5, pp. 236, 2s. 6d. net....",HOLDEN & H.,June '21
"Ballard (F.)-Does it matter what a man be- lieves? Cr. 8vo. 2s. 6d. net (Lib. of theology) W.C.O., May '21",20.0,34.0,,Ballard (F.),Does it matter what a man be- lieves?,Cr. 8vo.,2s. 6d. net (Lib. of theology),W.C.O.,May '21
"Ballard (G. A., Vice-Adm.)-The Influence of the sea on the political history of Japan. 8vo. 9×6, pp. 330, 18s. net ....MURRAY, Oct. '21",20.0,34.0,,"Ballard (G. A., Vice-Adm.)",The Influence of the sea on the political history of Japan.,8vo.,"9×6, pp. 330, 18s. net",MURRAY,Oct. '21
