original_entry,page_num,doc_page_num,opening_bits,author(s),title,format,little_bits,publisher,date
"Methuen (A.) ed.-An Anthology of modern verse, Intro. by Robert Lynd. Cr. 8vo. 7×4, pp. 300, 7s. 6d. net.. .METHUEN, Oct. '21",177.0,191.0,,Methuen (A.),"ed.-An Anthology of modern verse, Intro. by Robert Lynd.",Cr. 8vo.,"7×4, pp. 300, 7s. 6d. net.. .",METHUEN,Oct. '21
"Metternich (Princess Pauline)-The Days that are no more: some reminiscences. 8vo. 9×5, pp. 192, IOS. 6d. net .......E. NASH, Oct. '21",177.0,191.0,,Metternich (Princess Pauline),The Days that are no more: some reminiscences.,8vo.,"9×5, pp. 192, IOS. 6d. net",E. NASH,Oct. '21
"Mew (Charlotte)-The Farmer's bride. New ed., with eleven new poems. 8vo. 8 x 6, pp. 60, 4s. net..........POETRY BOOKSHOP, Apr. '21",177.0,191.0,,Mew (Charlotte),"The Farmer's bride. New ed., with eleven new poems.",8vo.,"8 x 6, pp. 60, 4s. net..........",POETRY BOOKSHOP,Apr. '21
"Mew's Digest of English case law: containing the reported decisions of the Superior Courts, &c., reported during 1916 to 1920. Ryl. 8vo., pp. 1,771, 55s. net ...SWEET & M., July '21",177.0,191.0,,,"Mew's Digest of English case law: containing the reported decisions of the Superior Courts, &c., reported during 1916 to 1920.",Ryl. 8vo.,"pp. 1,771, 55s. net ...",SWEET & M.,July '21
"Mew's Digest of English case law. Annual, 1920. 10×6, 15s. net; Quarterly issues, 20s. per annum SWEET & M.; STEVENS, Mar., &c., '21",177.0,191.0,,,"Mew's Digest of English case law. Annual, 1920.",,"10×6, 15s. net; Quarterly issues, 20s. per annum",SWEET & M.; STEVENS,"Mar., &c., '21"
"Mex. Fuel Oil (Anglo-Mexican Petroleum Co., Ltd.). 8vo. 1os. 6d. net, G. PHILIP, Aug. '21",177.0,191.0,,,"Mex. Fuel Oil (Anglo-Mexican Petroleum Co., Ltd.).",8vo.,"1os. 6d. net,",G. PHILIP,Aug. '21
"Meyer (F. B., Rev.)-Golden sayings. 3×2, swd. is. net. (Langham watchwords, 10) L. B. HILL, Mar. '21",177.0,191.0,,"Meyer (F. B., Rev.)",Golden sayings.,,"3×2, swd. is. net. (Langham watchwords, 10)",L. B. HILL,Mar. '21
"Meyerstein (E. H. W.)-Mysteria mundi. Cr. 8vo. 7× 5, pp. 31, 3s. net....BLACKWELL, May '21",177.0,191.0,,Meyerstein (E. H. W.),Mysteria mundi.,Cr. 8vo.,"7× 5, pp. 31, 3s. net....",BLACKWELL,May '21
"Meyerstein (E. H. W.)-Wade's boat: poems. Cr. 8vo. pp. 79, bds. 5s. net MURRAY, Aug. '21",177.0,191.0,,Meyerstein (E. H. W.),Wade's boat: poems.,Cr. 8vo.,"pp. 79, bds. 5s. net",MURRAY,Aug. '21
"Meyerstein (F. H. W.)-The Trireme a romance. Cr. 8vo. 7×5, pp. 67, 3s. net BLACKWELL, Jan. '21",177.0,191.0,,Meyerstein (F. H. W.),The Trireme a romance.,Cr. 8vo.,"7×5, pp. 67, 3s. net",BLACKWELL,Jan. '21
"Meynell (Alice)-The Second person singular, and other essays. 8vo. 8 × 54, pp. 140, 6s. net MILFORD, Dec. '21",177.0,191.0,,Meynell (Alice),"The Second person singular, and other essays.",8vo.,"8 × 54, pp. 140, 6s. net",MILFORD,Dec. '21
"Meynell (Viola)-Antonia. Cr. 8vo. 7×5, pp. 283, 8s. 6d. net .SECKER, Sep. '21",177.0,191.0,,Meynell (Viola),Antonia.,Cr. 8vo.,"7×5, pp. 283, 8s. 6d. net .",SECKER,Sep. '21
"Michelet (Jules)-Pages d'histoire de France: prisés dans l'oeuvre de Michelet. Edit. by M. Coppin. 18mo. limp is. 6d. net. (Modern lan- guage ser.) .HARRAP, May '21",177.0,191.0,,Michelet (Jules),Pages d'histoire de France: prisés dans l'oeuvre de Michelet. Edit. by M. Coppin.,18mo.,limp is. 6d. net. (Modern lan- guage ser.),.HARRAP,May '21
"Micklem (Nathaniel) and Morgan (Herbert)— Christ and Cæsar. Cr. 8vo. 7×5, pp. 251, 6s. 6d. net (Christian revolution ser.) SWARTHMORE PR., Sep. '21",177.0,191.0,,Micklem (Nathaniel) and Morgan (Herbert),Christ and Cæsar.,Cr. 8vo.,"7×5, pp. 251, 6s. 6d. net (Christian revolution ser.)",SWARTHMORE PR.,Sep. '21
"Micklem (Nathaniel)-A First century letter: an exposition of Paul's First Epistle to the Corin- thians. Cr. 8vo. 7 X5, pp. 112, 3s. 6d. net STUDENT CHRISTIAN MOVEMENT, Jan. '21",177.0,191.0,,Micklem (Nathaniel),A First century letter: an exposition of Paul's First Epistle to the Corin- thians.,Cr. 8vo.,"7 X5, pp. 112, 3s. 6d. net",STUDENT CHRISTIAN MOVEMENT,Jan. '21
"Micklem (Philip A.)-Principles of Church organi- zation with special reference to the Church of England in Australia. 8vo. 81×61, pp. 160. (Moorhouse lectures, 1920) ..S.P.C.K., July '21",177.0,191.0,,Micklem (Philip A.),Principles of Church organi- zation with special reference to the Church of England in Australia.,8vo.,"81×61, pp. 160. (Moorhouse lectures, 1920)",S.P.C.K.,July '21
"Middle-aged man (The). By ""Flaneuse."" Cr. 8vo. 7×5, pp. 248, 2s. 6d. net HOLDEN & HARDINGHAM, May '21",177.0,191.0,,,"Middle-aged man (The). By ""Flaneuse.""",Cr. 8vo.,"7×5, pp. 248, 2s. 6d. net",HOLDEN & HARDINGHAM,May '21
"Middleton (Lydia Miller)-Their London cousins. Illus. by Frank Gillett. Cr. 8vo. 7x5, pp. 256, 6s. net.. ...BLACKIE, Oct. '21",177.0,191.0,,Middleton (Lydia Miller),Their London cousins. Illus. by Frank Gillett.,Cr. 8vo.,"7x5, pp. 256, 6s. net.. ...",BLACKIE,Oct. '21
"Midland Arithmetic (The). Standard III. Cr. 8vo. 7×4, pp. 33, limp 5d. .T. EVANS, Mar. '21",177.0,191.0,,,Midland Arithmetic (The). Standard III.,Cr. 8vo.,"7×4, pp. 33, limp 5d. .",T. EVANS,Mar. '21
"Midland handbook of geography questions (The). 15th Rev. ed. Cr. 8vo. 7×5, pp. 98, swd. Is. net (Midland geographies ser.) ...... T. EVANS, Aug. '21",177.0,191.0,,,Midland handbook of geography questions (The). 15th Rev. ed.,Cr. 8vo.,"7×5, pp. 98, swd. Is. net (Midland geographies ser.)",T. EVANS,Aug. '21
"Miles (Alexander)-Surgical ward work and nursing a handbook for nurses and others. 4th ed. 8vo. 8×51, pp. 426, 10s. 6d. net SCIENTIFIC PR., June '21",177.0,191.0,,Miles (Alexander),Surgical ward work and nursing a handbook for nurses and others. 4th ed.,8vo.,"8×51, pp. 426, 10s. 6d. net",SCIENTIFIC PR.,June '21
"Miles (Eustace)-Through the day: how workers can easily increase their health, efficiency and happiness. Cr. 8vo. 71× 4, pp. 222, 3s. 6d. net LONDON & NORWICH PR., Feb. '21",177.0,191.0,,Miles (Eustace),"Through the day: how workers can easily increase their health, efficiency and happiness.",Cr. 8vo.,"71× 4, pp. 222, 3s. 6d. net",LONDON & NORWICH PR.,Feb. '21
"Miles (Lady)--The Red flame: a novel. Cr. 8vo. 7×5, pp. 288, 8s. 6d. net HUTCHINSON, Jan. '21",177.0,191.0,,Miles (Lady),The Red flame: a novel.,Cr. 8vo.,"7×5, pp. 288, 8s. 6d. net",HUTCHINSON,Jan. '21
"Miles (Lady)-Red, white and grey. Cr. 8vo. 7×5, pp. 287, 8s. 6d. net HUTCHINSON, Sep. '21",178.0,192.0,,Miles (Lady),"Red, white and grey.",Cr. 8vo.,"7×5, pp. 287, 8s. 6d. net",HUTCHINSON,Sep. '21
"Milford Haven (Marquess of)-Naval medals. 4to., 252s. net; Ed. de luxe, 315s. net MURRAY, Sep. '21",178.0,192.0,,Milford Haven (Marquess of),Naval medals.,4to.,"252s. net; Ed. de luxe, 315s. net",MURRAY,Sep. '21
"Milk-A Bacteriological investigation of Dublin milks and the pure milk problem: report. 2s. 6d. net... H.M.S.O., June '21",178.0,192.0,,,Milk-A Bacteriological investigation of Dublin milks and the pure milk problem: report.,,2s. 6d. net...,H.M.S.O.,June '21
"Millar (J. S.)-Ether stream. Cr. 8vo. swd. 2s. 6d. net.. WATTS, May '21",178.0,192.0,,Millar (J. S.),Ether stream.,Cr. 8vo.,swd. 2s. 6d. net..,WATTS,May '21
"Millar (James)-Clydeside memories [poems]. 7×5, pp. 112, 5s. net....STOCKWELL, Mar. '21",178.0,192.0,,Millar (James),Clydeside memories [poems].,,"7×5, pp. 112, 5s. net....",STOCKWELL,Mar. '21
"Millar (James)-Etincelles [poems, &c.]. 7×41, pp. 106, 5s. net. STOCKWELL, Oct. '21",178.0,192.0,,Millar (James),"Etincelles [poems, &c.].",,"7×41, pp. 106, 5s. net.",STOCKWELL,Oct. '21
"Miller (Alice Duer)-The Charm school. Ch. ed. Cr. 8vo. 7 X41, pp. 254, 2s. net HODDER & S., Jan. '21",178.0,192.0,,Miller (Alice Duer),The Charm school. Ch. ed.,Cr. 8vo.,"7 X41, pp. 254, 2s. net",HODDER & S.,Jan. '21
"Miller (E. W.)-The Beginner's History of England to the end of the Great War. Illus. Cr. 8vo. 7 X 41, pp. 279, 2s. 6d. net HARRAP, July '21",178.0,192.0,,Miller (E. W.),The Beginner's History of England to the end of the Great War. Illus.,Cr. 8vo.,"7 X 41, pp. 279, 2s. 6d. net",HARRAP,July '21
"Miller (H. Crichton)-The New psychology and the teacher. Cr. 8vo. 7× 5, pp. 232, 6s. net JARROLDS, Nov. '21",178.0,192.0,,Miller (H. Crichton),The New psychology and the teacher.,Cr. 8vo.,"7× 5, pp. 232, 6s. net",JARROLDS,Nov. '21
"Miller (Hugh)-How to make motor transport pay a treatise on mechanical road transport organisation and running costs. Cr. 8vo. 7×5, pp. 124, 2s. 6d. net CARRIERS PUBG. CO., Mar. '21",178.0,192.0,,Miller (Hugh),How to make motor transport pay a treatise on mechanical road transport organisation and running costs.,Cr. 8vo.,"7×5, pp. 124, 2s. 6d. net",CARRIERS PUBG. CO.,Mar. '21
"Miller (J. R.)-Secrets of a beautiful life. 17th ed. Cr. 8vo. 7X4, pp. 300, 5s. net HODDER & S., Oct. '21",178.0,192.0,,Miller (J. R.),Secrets of a beautiful life. 17th ed.,Cr. 8vo.,"7X4, pp. 300, 5s. net",HODDER & S.,Oct. '21
"Miller (W. Haig)—The Mirage of life. İllus. by Tenniel. Cr. 8vo. 7 × 4, pp. III, 2s. net R.T.S., Nov. '21",178.0,192.0,,Miller (W. Haig),The Mirage of life. İllus. by Tenniel.,Cr. 8vo.,"7 × 4, pp. III, 2s. net",R.T.S.,Nov. '21
"Miller (Warren H.)-The Black Panther of the Navaho. Cr. 8vo. 7×5, pp. 252, 7s. net APPLETON, Nov. '21",178.0,192.0,,Miller (Warren H.),The Black Panther of the Navaho.,Cr. 8vo.,"7×5, pp. 252, 7s. net",APPLETON,Nov. '21
"Miller (William)-Essays on the Latin Orient. Ryl. 8vo. 9×6, pp. 590, 40s. net CAMB. UNIV. PR., Sep. '21",178.0,192.0,,Miller (William),Essays on the Latin Orient.,Ryl. 8vo.,"9×6, pp. 590, 40s. net",CAMB. UNIV. PR.,Sep. '21
"Miller (William)-The Turkish restoration in Greece, 1718-1797. Cr. 8vo. 7 × 43, pp. 45, swd. Is. 3d. net (Helps for students of history, No. 38) S.P.C.K., Mar. '21",178.0,192.0,,Miller (William),"The Turkish restoration in Greece, 1718-1797.",Cr. 8vo.,"7 × 43, pp. 45, swd. Is. 3d. net (Helps for students of history, No. 38)",S.P.C.K.,Mar. '21
"Millin (Sarah Gertrude-Middle-class. Cr. 8vo. 71×5, pp. 272, 7s. 6d. net .. COLLINS, Oct. '21",178.0,192.0,,Millin (Sarah Gertrude,Middle-class.,Cr. 8vo.,"71×5, pp. 272, 7s. 6d. net ..",COLLINS,Oct. '21
"Millington (T. S.)-The Latch-key; or, Tco many by half. Cr. 8vo. 7×5, pp. 182, 2s. net (Advance ser.) .R.T.S., June '21",178.0,192.0,,Millington (T. S.),"The Latch-key; or, Tco many by half.",Cr. 8vo.,"7×5, pp. 182, 2s. net (Advance ser.) .",R.T.S.,June '21
"Mills (Arthur)-Ursula Vanet. Cr. 8vo. 7×5, pp. 343, 6s. net......... ....BALE, May '21",178.0,192.0,,Mills (Arthur),Ursula Vanet.,Cr. 8vo.,"7×5, pp. 343, 6s. net......... ....",BALE,May '21
"Mills (Clifford)-Where the rainbow ends. Ch. ed. CI. 8vo. 7×4, pp. 255, 2s. net HODDER, Dec. '21",178.0,192.0,,Mills (Clifford),Where the rainbow ends. Ch. ed.,CI. 8vo.,"7×4, pp. 255, 2s. net",HODDER,Dec. '21
"Mills (Clifford)-Where the rainbow ends. Illus. by Leo Bates. Folio. 1181, pp. 126, 20s. net HODDER & S., Nov. '21",178.0,192.0,,Mills (Clifford),Where the rainbow ends. Illus. by Leo Bates.,Folio.,"1181, pp. 126, 20s. net",HODDER & S.,Nov. '21
"Mills (Ethel M.)-The Blessed service: poems on Holy Communion. 62 × 44, pp. 27, 2s. 6d. net...... Soc. OF SS. PETER & PAUL, Jan. '21",178.0,192.0,,Mills (Ethel M.),The Blessed service: poems on Holy Communion.,,"62 × 44, pp. 27, 2s. 6d. net......",Soc. OF SS. PETER & PAUL,Jan. '21
"Mills (J. Saxon)-Sir Edward Cook, K.B.E.: a biography. 8vo. 9×54, pp. 312, 16s. net CONSTABLE, Oct. '21",178.0,192.0,,Mills (J. Saxon),"Sir Edward Cook, K.B.E.: a biography.",8vo.,"9×54, pp. 312, 16s. net",CONSTABLE,Oct. '21
"Mills (William Haslam)- ""The Manchester Guard- ian"" a century of history. 8vo. 9×54, pp. 147, fs. net.. CHATTO & W., Oct. '21",178.0,192.0,,Mills (William Haslam),"""The Manchester Guard- ian"" a century of history.",8vo.,"9×54, pp. 147, fs. net..",CHATTO & W.,Oct. '21
"Miln (Louise Jordan)-The Heart of a rose. ed. Cr. 8vo. 7 X5, pp. 224, 2s. 6d. net HUTCHINSON, Jan. '21",178.0,192.0,,Miln (Louise Jordan),The Heart of a rose. ed.,Cr. 8vo.,"7 X5, pp. 224, 2s. 6d. net",HUTCHINSON,Jan. '21
"Miln (Louise Jordan)-The Pursuit of Pamela. Cr. 8vo. 7× 5, pp. 303, 8s. 6d. net Ch. HODDER & S., Apr. '21",178.0,192.0,,Miln (Louise Jordan),The Pursuit of Pamela.,Cr. 8vo.,"7× 5, pp. 303, 8s. 6d. net Ch.",HODDER & S.,Apr. '21
"Miln (Louise Jordan)-The Virgin of Stamboul. Cheap ed. Cr. 8vo. 7 × 5, pp. 190, 2s. net ODHAMS PR., Oct. '21",178.0,192.0,,Miln (Louise Jordan),The Virgin of Stamboul. Cheap ed.,Cr. 8vo.,"7 × 5, pp. 190, 2s. net",ODHAMS PR.,Oct. '21
"Milne (A. A., Rev.)-Communion tokens of the Presbyterian Church in Ireland. Illus. 10×71, pp. 91, 10s. 6d. net (Doune, Perthshire) AUTHOR, Jan. '21",178.0,192.0,,"Milne (A. A., Rev.)",Communion tokens of the Presbyterian Church in Ireland. Illus.,,"10×71, pp. 91, 10s. 6d. net (Doune, Perthshire)",AUTHOR,Jan. '21
"Milne (A. A.) The Sunny side. Cr. 8vo. 7×5, pp. 256, 6s. net.... .METHUEN, Oct. '21",178.0,192.0,,Milne (A. A.),The Sunny side.,Cr. 8vo.,"7×5, pp. 256, 6s. net.... .",METHUEN,Oct. '21
"Milne (A. A.)-Second plays. Cr. 8vo. 7 × 51, pp. 281, 7s. 6d. net CHATTO & W., May '21",178.0,192.0,,Milne (A. A.),Second plays.,Cr. 8vo.,"7 × 51, pp. 281, 7s. 6d. net",CHATTO & W.,May '21
"Milne (A. A.)-The Day's play. 8th and ch. ed. Cr. 8vo. 7×5, pp. 306, 4s. 6d. net METHUEN, Mar. '21",178.0,192.0,,Milne (A. A.),The Day's play. 8th and ch. ed.,Cr. 8vo.,"7×5, pp. 306, 4s. 6d. net",METHUEN,Mar. '21
"Milne (A. A.)-The Holiday round. 4th and ch. ed. Cr. 8vo. 7×5, pp. 244, 4s. 6d. net METHUEN, May '21",178.0,192.0,,Milne (A. A.),The Holiday round. 4th and ch. ed.,Cr. 8vo.,"7×5, pp. 244, 4s. 6d. net",METHUEN,May '21
"Milne (A. A.)Mr. Pim. Cr. 8vo. 7×5, pp. 318, 7s. 6d. net. HODDER & S., Sep. '21",178.0,192.0,,Milne (A. A.),Mr. Pim.,Cr. 8vo.,"7×5, pp. 318, 7s. 6d. net.",HODDER & S.,Sep. '21
"Milne (A. Berkeley, Adm. Sir) The Flight of the Goeben and the ""Breslau :: an episode in naval history. Cr. 8vo. 7×5, pp. 160, 6s. net ..E. NASH, Mar. '21",178.0,192.0,,"Milne (A. Berkeley, Adm. Sir)","The Flight of the Goeben and the ""Breslau :: an episode in naval history.",Cr. 8vo.,"7×5, pp. 160, 6s. net ..",E. NASH,Mar. '21
"Milne (James)-The Black Colonel. Cr. 8vo. 7×5, pp. 250, 7s. net .LANE, Oct. '21",178.0,192.0,,Milne (James),The Black Colonel.,Cr. 8vo.,"7×5, pp. 250, 7s. net .",LANE,Oct. '21
"Milne (Mrs. Leslie)-An Elementary Palaung grammar. Intro. by C. O. Blagden. Cr. 8vo. 8s. 6d. net. .MILFORD, May '21",178.0,192.0,,Milne (Mrs. Leslie),An Elementary Palaung grammar. Intro. by C. O. Blagden.,Cr. 8vo.,8s. 6d. net. .,MILFORD,May '21
"Milroy (J. A.)-Practical physiological chemistry. 3rd ed. 8vo. 8 × 5, pp. 458, 21s. net net ...... GREEN, Oct. '21",178.0,192.0,,Milroy (J. A.),Practical physiological chemistry. 3rd ed.,8vo.,"8 × 5, pp. 458, 21s. net net ...... ",GREEN,Oct. '21
"Milroy (Lilias) and Browne (Elizabeth M.)——A Book of English history for children. Part 2, From 1603 to the end of the Great War. Cr. 8vo. 7×4, pp. 256, 35. net.. BLACKIE, Jan. '21",178.0,192.0,,Milroy (Lilias) and Browne (Elizabeth M.),"A Book of English history for children. Part 2, From 1603 to the end of the Great War.",Cr. 8vo.,"7×4, pp. 256, 35. net..",BLACKIE,Jan. '21
"Milton (John)-Comus. Illus. by Arthur Rack- ham. Ryl. 8vo. 10×71, pp. 76, 25s. net; vellum 63s. net HEINEMANN, Oct. '21",178.0,192.0,,Milton (John),Comus. Illus. by Arthur Rack- ham.,Ryl. 8vo.,"10×71, pp. 76, 25s. net; vellum 63s. net",HEINEMANN,Oct. '21
"Milton (John)-Sonnets. Intro, and notes. By John S. Smart. 8vo. 8×51, pp. 205, 7s. 6d. .MACLEHOSE, Feb. '21",178.0,192.0,,Milton (John),"Sonnets. Intro, and notes. By John S. Smart.",8vo.,"8×51, pp. 205, 7s. 6d. .",MACLEHOSE,Feb. '21
"Mineral Resources Bureau (Imperial)-Reports on the mineral industry of the British Empire and foreign countries, War period: Aluminium and Bauxite, 9d. net; Antimony, Is. net; Asbestos, Is. net; Barium minerals, 9d. net; Coal, coke and by-products, pt. 1, 3s. 6d. net; Cobalt, 9d. net; Fluorspar, 9d. net; Manganese 3s. 6d. net; Talc, 9d. net; Tungsten, Is. net; Zinc, 3s. 6d. net; Statistical summary (produc tion, imports and exports, 1913-20, 35. net H.M.S.O., Jan., &c., '21",179.0,193.0,,,"Mineral Resources Bureau (Imperial)-Reports on the mineral industry of the British Empire and foreign countries, War period: Aluminium and Bauxite, 9d. net; Antimony, Is. net; Asbestos, Is. net; Barium minerals, 9d. net; Coal, coke and by-products, pt. 1, 3s. 6d. net; Cobalt, 9d. net; Fluorspar, 9d. net; Manganese 3s. 6d. net; Talc, 9d. net; Tungsten, Is. net; Zinc, 3s. 6d. net; Statistical summary (produc tion, imports and exports, 1913-20, 35. net",,,H.M.S.O.,"Jan., &c., '21"
"Mines Dept. Spontaneous combustion of coal in mines final report, 1s. 6d. net; Minutes of evidence, 23 to 26th days, 4s. 6d. net H.M.S.O., June, Aug. '21",179.0,193.0,,,"Mines Dept. Spontaneous combustion of coal in mines final report, 1s. 6d. net; Minutes of evidence, 23 to 26th days, 4s. 6d. net",,,H.M.S.O.,"June, Aug. '21"
