original_entry,page_num,doc_page_num,opening_bits,author(s),title,format,little_bits,publisher,date
"Hindustani without a master: a simple method of learning the Hindustani language in three weeks. With a copious English Hindustani vocabulary and Laskar's Hindustani, by Sadruddin Bahuddin Syed. 2nd ed. 8vo. pp. 251, 3s. 6d……..... ..LUZAC, Mar. '21",125.0,139.0,,,"Hindustani without a master: a simple method of learning the Hindustani language in three weeks. With a copious English Hindustani vocabulary and Laskar's Hindustani, by Sadruddin Bahuddin Syed. 2nd ed.",8vo.,"pp. 251, 3s. 6d.",LUZAC,Mar. '21
"Hine (Muriel)-Autumn. Cr. 8vo. 7×5, pp. 350, 3s. 6d. net ..LANE, Nov. '21",125.0,139.0,,Hine (Muriel),Autumn.,Cr. 8vo.,"7×5, pp. 350, 3s. 6d. net ..",LANE,Nov. '21
"Hine (Muriel)-The Man with a double heart. Ch. ed. 18mo. 6×41, pp. 277, 2s. net LANE, July '21",125.0,139.0,,Hine (Muriel),The Man with a double heart. Ch. ed.,18mo.,"6×41, pp. 277, 2s. net",LANE,July '21
"Hine (Muriel)-Torquil's success. 8vo. 8×5, pp. 328, 7s. 6d. net .LANE, Nov. '21",125.0,139.0,,Hine (Muriel),Torquil's success.,8vo.,"8×5, pp. 328, 7s. 6d. net .",LANE,Nov. '21
"Hingley (R. H.)—Psycho-analysis. Cr. 8vo. 7×5, pp. 197, 6s. net METHUEN, Dec. '21",125.0,139.0,,Hingley (R. H.),Psycho-analysis.,Cr. 8vo.,"7×5, pp. 197, 6s. net",METHUEN,Dec. '21
"Hinks (Arthur R.)-Map projections. 2nd ed., rev. and enl. 8vo. 8×5, pp. 170, 12s. 6d. net CAMB. UNIV. PR., Oct. '21",125.0,139.0,,Hinks (Arthur R.),"Map projections. 2nd ed., rev. and enl.",8vo.,"8×5, pp. 170, 12s. 6d. net",CAMB. UNIV. PR.,Oct. '21
"Hinton (C. Howard)-The Fourth dimension. Cr. 8vo. 7×5, pp. 278, 7s. 6d. net ALLEN & U., July '21",125.0,139.0,,Hinton (C. Howard),The Fourth dimension.,Cr. 8vo.,"7×5, pp. 278, 7s. 6d. net",ALLEN & U.,July '21
"Hinton (Martin A. C.) (G. E. H.) and Hinton. Hints and tips for motor cyclists. 8th ed. By ""Road Rider."" 18mo. 6 x 3, swd. 2s. net ILIFFE, July '21",125.0,139.0,,Hinton (Martin A. C.) (G. E. H.) and Hinton.,"Hints and tips for motor cyclists. 8th ed. By ""Road Rider.""",18mo.,"6 x 3, swd. 2s. net",ILIFFE,July '21
"Hints to the workers. 7×4, pp. 24, swd. 6d. net.... STOCKWELL, Feb. '21",125.0,139.0,,,Hints to the workers.,,"7×4, pp. 24, swd. 6d. net....",STOCKWELL,Feb. '21
"Hippius (Zinaida)-The Green ring: a play in four acts. Authorised trans. from the Russian by S. S. Koteliansky. Cr. 8vo. 7×5, pp. 104, 3s. 6d. net. (Plays for a people's theatre) DANIELS, Feb. '21",125.0,139.0,,Hippius (Zinaida),The Green ring: a play in four acts. Authorised trans. from the Russian by S. S. Koteliansky.,Cr. 8vo.,"7×5, pp. 104, 3s. 6d. net. (Plays for a people's theatre)",DANIELS,Feb. '21
"Hirst (Herbert)—Bookbinding in schools : a teacher's handbook. 8vo. 81× 51, pp. 52, limp 2s. net. (S. & S. ser.) SCHOFIELD & S., Nov. '21",125.0,139.0,,Hirst (Herbert),Bookbinding in schools : a teacher's handbook.,8vo.,"81× 51, pp. 52, limp 2s. net. (S. & S. ser.)",SCHOFIELD & S.,Nov. '21
"Hiscox (W. J.)-Factory administration in prac- tice organization and administration from the factory standpoint. 8vo. 81×51, pp. 224, 8s. 6d. net .PITMAN, Oct. '21",126.0,140.0,,Hiscox (W. J.),Factory administration in prac- tice organization and administration from the factory standpoint.,8vo.,"81×51, pp. 224, 8s. 6d. net .",PITMAN,Oct. '21
"History of the London Rifle Brigade, 1859-1919. Intro. by Maj.-Gen. Sir Frederick Maurice. Maps in case. 8vo. 9×54, pp. 535, 21s. net CONSTABLE, May '21",126.0,140.0,,,"History of the London Rifle Brigade, 1859-1919. Intro. by Maj.-Gen. Sir Frederick Maurice. Maps in case.",8vo.,"9×54, pp. 535, 21s. net",CONSTABLE,May '21
"Hitchcock (George S.)-Questions in economics for evening classes. 8×51, pp. 16, swd. Is. net HENDERSON, Sep. '21",126.0,140.0,,Hitchcock (George S.),Questions in economics for evening classes.,,"8×51, pp. 16, swd. Is. net",HENDERSON,Sep. '21
"Hitchcock (George S.)-Ten laws of religious evolution. 8×51, pp. 16, IS. HENDERSONS, Apr. '21",126.0,140.0,,Hitchcock (George S.),Ten laws of religious evolution.,,"8×51, pp. 16, IS.",HENDERSONS,Apr. '21
"Hitschmann (Eduard)-Freud's Theories of the neuroses. Authorized trans. by Dr. C. R. Payne. Intro. by Ernest Jones. 8vo. 8× 51, pp. 281, 10s. 6d. net .K. PAUL, June '21",126.0,140.0,,Hitschmann (Eduard),Freud's Theories of the neuroses. Authorized trans. by Dr. C. R. Payne. Intro. by Ernest Jones.,8vo.,"8× 51, pp. 281, 10s. 6d. net .",K. PAUL,June '21
"Hjort (Johan)-The Unity of science: a sketch. Cr. 8vo. 7×5, pp. 182, 6s. net GYLDENDAL, Apr. 21",126.0,140.0,,Hjort (Johan),The Unity of science: a sketch.,Cr. 8vo.,"7×5, pp. 182, 6s. net",GYLDENDAL,Apr. 21
"Hobday (Frederick) and Stainton (J. Harold)— Baillière's Atlas of the dog its anatomy and physiology. Bds. 10s. 6d. net BAILLIERE, July '21",126.0,140.0,,Hobday (Frederick) and Stainton (J. Harold),Baillière's Atlas of the dog its anatomy and physiology.,,Bds. 10s. 6d. net,BAILLIERE,July '21
"Hobhouse (I. T.)-The Rational good: a study in the logic of practice. 8vo. 8×51, pp. 165, 8s. 6d. net.. ALLEN & U., Feb. '21",126.0,140.0,,Hobhouse (I. T.),The Rational good: a study in the logic of practice.,8vo.,"8×51, pp. 165, 8s. 6d. net..",ALLEN & U.,Feb. '21
"Hobhouse (L. T.)-The Elements of social justice. 8vo. 8×5, pp. 208, 10s. 6d. net ALLEN & U., Nov. '21",126.0,140.0,,Hobhouse (L. T.),The Elements of social justice.,8vo.,"8×5, pp. 208, 10s. 6d. net",ALLEN & U.,Nov. '21
"Hobson (Adele)-Dreams of outback. Cr. 8vo. pp. 64, bds. 2s. 6d. net......WARNE, Dec. '21",126.0,140.0,,Hobson (Adele),Dreams of outback.,Cr. 8vo.,"pp. 64, bds. 2s. 6d. net......",WARNE,Dec. '21
"Hobson (Bernard)-The West Riding of York- shire. Illus. Cr. 8vo. 7× 5, pp. 200, 3s. 6d. net (Cambridge county geographies) CAMB. UNIV. PR., May '21",126.0,140.0,,Hobson (Bernard),The West Riding of York- shire. Illus.,Cr. 8vo.,"7× 5, pp. 200, 3s. 6d. net (Cambridge county geographies)",CAMB. UNIV. PR.,May '21
"Hobson (E. W.)-Theory of functions of a real variable and the theory of Fourier's series. Vol. 1. 2nd ed., rev. and enl. Ryl. 8vo. 45s. net CAMB. UNIV. PR., Jan. '21",126.0,140.0,,Hobson (E. W.),"Theory of functions of a real variable and the theory of Fourier's series. Vol. 1. 2nd ed., rev. and enl.",Ryl. 8vo.,45s. net,CAMB. UNIV. PR.,Jan. '21
"Hobson (J. A.)-Problems of a new world. Cr. 8vo. 7 X5, pp. 285, 7s. 6d. net ALLEN & U., Jan. '21",126.0,140.0,,Hobson (J. A.),Problems of a new world.,Cr. 8vo.,"7 X5, pp. 285, 7s. 6d. net",ALLEN & U.,Jan. '21
"Hobson (J. A.)-The Economics of reparation. 8vo. 8×5, pp. 32, swd. is. net ALLEN & U., July '21",126.0,140.0,,Hobson (J. A.),The Economics of reparation.,8vo.,"8×5, pp. 32, swd. is. net",ALLEN & U.,July '21
"Hoch (August)-Benign stupors. Cr. 8vo. pp. 284, 145. net.. CAMB. UNIV. PR., Dec. '21",126.0,140.0,,Hoch (August),Benign stupors.,Cr. 8vo.,"pp. 284, 145. net..",CAMB. UNIV. PR.,Dec. '21
"Hocking (Joseph)-Jabez Easterbrook. Cr. 8vo. 7X41, pp 256, 2s. net Ch. ed. WARD, LOCK, Apr. '21",126.0,140.0,,Hocking (Joseph),Jabez Easterbrook.,Cr. 8vo.,"7X41, pp 256, 2s. net Ch. ed.","WARD, LOCK",Apr. '21
"Hocking (Joseph)-The Man who almost lost. Cr. 8vo. 7×5, pp. 256, 3s. 6d. net HODDER & S., July '21",126.0,140.0,,Hocking (Joseph),The Man who almost lost.,Cr. 8vo.,"7×5, pp. 256, 3s. 6d. net",HODDER & S.,July '21
"Hocking (Joseph)-The Ring of destiny. Cr. 8vo. 7×5, pp. 320, 75. net..WARD, LOCK, Mar. '21",126.0,140.0,,Hocking (Joseph),The Ring of destiny.,Cr. 8vo.,"7×5, pp. 320, 75. net..","WARD, LOCK",Mar. '21
"Hocking (Joseph)-The Weapons of mystery. Cheap ed. 8vo. 8×51, pp. 124, swd. Is. net WARD, LOCK, Sep. '21",126.0,140.0,,Hocking (Joseph),The Weapons of mystery. Cheap ed.,8vo.,"8×51, pp. 124, swd. Is. net","WARD, LOCK",Sep. '21
"Hocking (Joseph)-The Wilderness. Ch. ed. Cr. 8vo. 7×41, pp. 250, 2s. net HODDER & S., Mar. '21",126.0,140.0,,Hocking (Joseph),The Wilderness. Ch. ed.,Cr. 8vo.,"7×41, pp. 250, 2s. net",HODDER & S.,Mar. '21
"Hodder (Edwin)-Tossed on the waves. Cr. 8vo. 71 × 4, pp. 324, 3s. net (Boy's new lib.) MILFORD, Oct. '21",126.0,140.0,,Hodder (Edwin),Tossed on the waves.,Cr. 8vo.,"71 × 4, pp. 324, 3s. net (Boy's new lib.)",MILFORD,Oct. '21
"Hodder-Williams (J. E.)-The Father of the Red Triangle: the life of Sir George Williams. 7×5, pp. 308... ...HODDER & S., Oct. '21",126.0,140.0,,Hodder-Williams (J. E.),The Father of the Red Triangle: the life of Sir George Williams.,,"7×5, pp. 308...",HODDER & S.,Oct. '21
"Hodgkison (E. G.)-The Preliminary geography. 3rd ed., 6th impr. Cr. 8vo. pp. 246, 3s. UNIV. TUTORIAL PR., Jan. '21",126.0,140.0,,Hodgkison (E. G.),"The Preliminary geography. 3rd ed., 6th impr.",Cr. 8vo.,"pp. 246, 3s.",UNIV. TUTORIAL PR.,Jan. '21
"Hodgson (Ralph)-The Last blackbird, and other lines. Cr. 8vo. 7×4, pp. 64, 4s. 6d. net ALLEN & U., May '21",126.0,140.0,,Hodgson (Ralph),"The Last blackbird, and other lines.",Cr. 8vo.,"7×4, pp. 64, 4s. 6d. net",ALLEN & U.,May '21
"Hodgson (William Hope)-Captain Gault: the exceedingly private log of a sea-captain. Ch. ed. Cr. 8vo. 7 x 5, pp. 245, 2s. 6d. net HOLDEN & H., Mar. '21",126.0,140.0,,Hodgson (William Hope),Captain Gault: the exceedingly private log of a sea-captain. Ch. ed.,Cr. 8vo.,"7 x 5, pp. 245, 2s. 6d. net",HOLDEN & H.,Mar. '21
"Hodgson (William Hope)-Men of the deep waters. Ch. ed. Cr. 8vo. 7X5, pp. 250, 2s. 6d. net HOLDEN & H., Mar. '21",126.0,140.0,,Hodgson (William Hope),Men of the deep waters. Ch. ed.,Cr. 8vo.,"7X5, pp. 250, 2s. 6d. net",HOLDEN & H.,Mar. '21
"Hodgson (William Hope)-The House on the borderland. Ch. ed. Cr. 8vo. 7× 5, pp. 352, 2s. 6d. net... HOLDEN & H., Mar. '21",126.0,140.0,,Hodgson (William Hope),The House on the borderland. Ch. ed.,Cr. 8vo.,"7× 5, pp. 352, 2s. 6d. net...",HOLDEN & H.,Mar. '21
"Hodgson (William) and Sanders (W. H.)-East- bourne, with its surroundings. 5th ed. Cr. 8vo. 7×5, pp. 90, swd. Is. 6d. net. (Homeland handbooks, no.60) HOMELAND ASSOC., Mar. '21",126.0,140.0,,Hodgson (William) and Sanders (W. H.),"East- bourne, with its surroundings. 5th ed.",Cr. 8vo.,"7×5, pp. 90, swd. Is. 6d. net. (Homeland handbooks, no.60)",HOMELAND ASSOC.,Mar. '21
"Hodgson (William Hope)-The Night land: a love tale. Abridged ed. Cr. 8vo. 7×4}, pp. 254, 2s. 6d. net ..HOLDEN & H., Aug. '21",127.0,141.0,,Hodgson (William Hope),The Night land: a love tale. Abridged ed.,Cr. 8vo.,"7×4}, pp. 254, 2s. 6d. net ..",HOLDEN & H.,Aug. '21
"Hodgson (William Hope)-The Voice of the ocean. [Poems.] 7×5, pp. 46, 2s. 6d. net SELWYN & B., Nov. '21",127.0,141.0,,Hodgson (William Hope),The Voice of the ocean. [Poems.],,"7×5, pp. 46, 2s. 6d. net",SELWYN & B.,Nov. '21
"Hodivala (S. K.)-Parsis of ancient India. Ryl. 8vo. pp. 178, bds. 9s. .LUZAC, Jan. '21",127.0,141.0,,Hodivala (S. K.),Parsis of ancient India.,Ryl. 8vo.,"pp. 178, bds. 9s. .",LUZAC,Jan. '21
"Hodson (Leonard J.)-Udimore, past and present: the story of a Sussex parish. 8×5, pp. 48, 5s. (Robertsbridge, Sussex) AUTHOR, Jan. '21",127.0,141.0,,Hodson (Leonard J.),"Udimore, past and present: the story of a Sussex parish.",,"8×5, pp. 48, 5s. (Robertsbridge, Sussex)",AUTHOR,Jan. '21
"Hoffmann (Professor)-Card tricks without appara- tus. Illus. Cr. 8vo. 7×5, pp. 104, Is. 3d. net WARNE, Sep. '21",127.0,141.0,,Hoffmann (Professor),Card tricks without appara- tus. Illus.,Cr. 8vo.,"7×5, pp. 104, Is. 3d. net",WARNE,Sep. '21
"Hogben (Lancelot)-Exiles of the snow, and other poems. Re-issue. 18mo. 6×41, pp. 62, 2s. 6d. net (Life and colour ser.).. J. CAPE, Sep. '21",127.0,141.0,,Hogben (Lancelot),"Exiles of the snow, and other poems. Re-issue.",18mo.,"6×41, pp. 62, 2s. 6d. net (Life and colour ser.)..",J. CAPE,Sep. '21
"Hohfeld (W. N.)-Fundamental legal conceptions as applied in judicial reasoning, &c. Ryl. 8vo. pp. 114, swd. 5s. 6d. net net (YALE UNIV. PR.) MILFORD, Nov. '21",127.0,141.0,,Hohfeld (W. N.),"Fundamental legal conceptions as applied in judicial reasoning, &c.",Ryl. 8vo.,"pp. 114, swd. 5s. 6d. net net",(YALE UNIV. PR.) MILFORD,Nov. '21
"Holbrook (R. T.)-Etude sur Pathelin: essai de bibliographie et d' interpretation. Ryl. 8vo. swd. 5s. 6d. net (Elliott monographs) MILFORD, Sep. '21",127.0,141.0,,Holbrook (R. T.),Etude sur Pathelin: essai de bibliographie et d' interpretation.,Ryl. 8vo.,swd. 5s. 6d. net (Elliott monographs),MILFORD,Sep. '21
"Holcombe (F. D.)-Modern sea angling. Illus. 8vo. 8×5, pp. 320, 21s. net F. WARNE, Oct. '21",127.0,141.0,,Holcombe (F. D.),Modern sea angling. Illus.,8vo.,"8×5, pp. 320, 21s. net",F. WARNE,Oct. '21
"Holden (J. Stuart)-Your reasonable service: addresses. Cr. 8vo. 7×5, pp. 176, 3s. 6d. net MARSHALL BROS., July '21",127.0,141.0,,Holden (J. Stuart),Your reasonable service: addresses.,Cr. 8vo.,"7×5, pp. 176, 3s. 6d. net",MARSHALL BROS.,July '21
"Holden (Joshua)-The Spirit of Jesus and the Churches. Cr. 8vo. 7× 5, pp. 118, swd. 3s. 6d. net .METHUEN, Mar. '21",127.0,141.0,,Holden (Joshua),The Spirit of Jesus and the Churches.,Cr. 8vo.,"7× 5, pp. 118, swd. 3s. 6d. net .",METHUEN,Mar. '21
"Holdsworth (Ethel)-The Taming of Nan. Cheap ed. Cr. 8vo. 7×41, pp. 319, 2s. net H. JENKINS, June '21",127.0,141.0,,Holdsworth (Ethel),The Taming of Nan. Cheap ed.,Cr. 8vo.,"7×41, pp. 319, 2s. net",H. JENKINS,June '21
"Hole (Walter)-The Distribution of gas. 4th ed., rewritten and enl. Ryl. 8vo. 9×71, pp. 715, 50s. net BENN BROS., Nov. '21",127.0,141.0,,Hole (Walter),"The Distribution of gas. 4th ed., rewritten and enl.",Ryl. 8vo.,"9×71, pp. 715, 50s. net",BENN BROS.,Nov. '21
"Holiday book (The). Ryl. 8vo. 101×81, 5s. net PARTRIDGE, July '21",127.0,141.0,,,Holiday book (The).,Ryl. 8vo.,"101×81, 5s. net",PARTRIDGE,July '21
"Holiday resorts and recommended addresses at home and abroad (36th annual issue.) 61×41, pp. 90, 2s.... TEACHERS' GUILD, May '21",127.0,141.0,,,Holiday resorts and recommended addresses at home and abroad (36th annual issue.),,"61×41, pp. 90, 2s....",TEACHERS' GUILD,May '21
"Holidays (The): Where to stay and what to see. 26th ed. 8vo. 8×51, pp. 1,046, 2s. net WALTER HILL, Aug. '21",127.0,141.0,,,Holidays (The): Where to stay and what to see. 26th ed.,8vo.,"8×51, pp. 1,046, 2s. net",WALTER HILL,Aug. '21
"Holidays where to go, what to see-and the cost. Folio, 129, pp. 78, swd. 2s. 6d. net CASSELL, May '21",127.0,141.0,,,"Holidays where to go, what to see-and the cost.","Folio,","129, pp. 78, swd. 2s. 6d. net",CASSELL,May '21
"Holland (R. W.)-Business statistics: prepara- tion, compilation and presentation. Cr. 8vo. 71×4, pp. 93, 3s. 6d. net....PITMAN, May '21",127.0,141.0,,Holland (R. W.),"Business statistics: prepara- tion, compilation and presentation.",Cr. 8vo.,"71×4, pp. 93, 3s. 6d. net....",PITMAN,May '21
"Holland (Thomas, Sir)-Letters to the Times "" upon war and neutrality, 1881-1920. 3rd ed. 8vo. 10s. 6d. net. .LONGMANS, June '21",127.0,141.0,,"Holland (Thomas, Sir)","Letters to the Times "" upon war and neutrality, 1881-1920. 3rd ed.",8vo.,10s. 6d. net. .,LONGMANS,June '21
"Holliday (Robert C.)-Men and books and cities. 8X5, pp. 263, 88. 6d. net ""6 HODDER & S., Feb. '21",127.0,141.0,,Holliday (Robert C.),Men and books and cities.,,"8X5, pp. 263, 88. 6d. net ""6",HODDER & S.,Feb. '21
"Hollings (F.)-The Beginner's book of chess. 18mo. 613, pp. 32, swd. 6d. net F. HOLLINGS, Apr. '21",127.0,141.0,,Hollings (F.),The Beginner's book of chess.,18mo.,"613, pp. 32, swd. 6d. net",F. HOLLINGS,Apr. '21
"Hollis (Gertrude)-His life and ours. 18mo. 6×41, pp. 121, 3s. 6d. net MOWBRAY, Mar. '21",127.0,141.0,,Hollis (Gertrude),His life and ours.,18mo.,"6×41, pp. 121, 3s. 6d. net",MOWBRAY,Mar. '21
"Hollis (Gertrude)-The Romance of the Bible. Cr. 8vo. 7×4, pp. 250, 5s. net GARDNER, DARTON, Sep.'21",127.0,141.0,,Hollis (Gertrude),The Romance of the Bible.,Cr. 8vo.,"7×4, pp. 250, 5s. net","GARDNER, DARTON",Sep.'21
"Holman (Henry)-Hand and eye training; Education through work : its scientific and practical principles. 3rd ed. Cr. 8vo. 7×5, pp. 210, 5s. net. .PITMAN, Dec. '21",127.0,141.0,,Holman (Henry),Hand and eye training; Education through work : its scientific and practical principles. 3rd ed.,Cr. 8vo.,"7×5, pp. 210, 5s. net. .",PITMAN,Dec. '21
"Holme (Constance)-The Trumpet in the dust. Cr. 8vo. 7 × 5, pp. 236, 8s. 6d. net MILLS & B., Mar. '21",127.0,141.0,,Holme (Constance),The Trumpet in the dust.,Cr. 8vo.,"7 × 5, pp. 236, 8s. 6d. net",MILLS & B.,Mar. '21
